sentence,profane
an saidt na onshore wind farms pwede makatao nin pirang enerhiya sa grid o makatao nin kuryente sa isoladong mayo sa grid na lokasyon,0
igwang natatadang na aldaw sagkod kan katapusan nin taon,0
ang kaso na kasangkot dc administrative law judge roy pearson suing kanyang dry cleaner para sa sa ilalim ng dc gawa consumer proteksyon pagkatapos nilang nawala ang kanyang pantalon,0
siya midbid sa paggamit nin tela bilang medyum sa paggibo nin iskultura,0
pigdakitaramon an bgong tipan paduman sa bisayainunhan ni eldon leano talamisan asi pigpublikar ini kan,0
saro sa mga ini hinapot an babaye kun ano an pangaran kan banwaan,0
an kalye igualdad may kalabaan man napoon sa kanto kan kalye zamora sa may sabang sundo sa tinampo kan kalye sta,0
nuarin matapos ining finals puta,1
elena an igwang pinakamagayn na tingog sarong agom nin paraduyg saradit na ak sa gilid kan elena mga padis na inaapod na panamparan asin an pinakainot na padis iyo an mga responde,0
pinagkaklasipikar an musika ni geronimo bilang pop sagkod na ipinaluwas an saiyang ikasampulong studio album na expressions kan idinugang niya an rb asin bayle sa saiyang istilo,0
namati niya an pagabot kan oras kan panlaban kontra sa olandes,0
tangina napaso su dila ko kan mainiton na milo,1
pigendorso ini nin magkapirang komite sa un siring man kan mga legal na komunidad na lokal arog kan new york city bar kan,0
lininaniya natakdag su aki ni pay sa basod,1
sarong binukot na babae posible bisaya,0
an mga datu nagobliga asin pigtawan sinda nin mga kakanon,0
an mga siyudad na nagin nang independiente sa probinsya ilinilista kaiba sa probinsyang saindang hinalean,0
sa mga tugang an apod saiya manang inday vitang sa mga kagurubay asin tata sa mga sobrina asin sobrino,0
inot siyang nagin prominente bilang sarong akademiko barristo asin tagapagkampanya,0
pigbibilog kan soju an sa kategorya,0
totoo may elementong personal an istorya ta naitok ini sa buhay nin duwang personahe parati mga prinsipe o ginoo,0
sa misamis oriental na indibiduwal an napiritan na mag ebakwar huli sa baha,0
an paggibo nin serbesa,0
enot na apoon ni fonda nagdatong sa nweba york kan,0
si moon naelehir pagkatapos kan impeachment kan saiyang sasalidahan na si park geunhye,0
si salonga minidbid bilang sarong disney legend kan agosto,0
sa sarong detalyadong mapa ni francisco alegre mapa de la provincia de caraga taon nasurat man na bislig an ngaran,0
an duwa niyang tugang na ini pareho man nagin pulitiko asin nagsirbi komo mga representante kan camarines sur asin ta si felix nagin man gobernador,0
hinihiling man ni rebetez an persepsyon nin mga tawo sa klima,0
kadaklan kan mga ilokano mga romano katoliko mientras na significanteng numero kabali sa simbahan na aglipayan church na nagpoon sa ilocos norte,0
pahali na naman lamang si leon pero so relief samuya wara pa,0
si cayetano sarong tagatulod kan isports asin parte kan sarong holistikong programa para sa pagbabago nin kaakian pagpugol kan mga kahilangan asin an pangangaipo para sa sarong marhay na salud asin malinig na pagbuhay,0
kadaklan kan siring na hayop nanlalaban paagi nin pagpakupsit nin kemikal asin pagwalat sa kalaban nin mga pinong barahibo,0
ay pucha talaga iyo kaya palan pirming ayos na ako tol kasubago ako naman bida bida,1
an tulay golden gate sarong kolganteng tulay na nabalagbag sa ngawngaw inapod golden gate bulawan na tata kan sola nin san francisco asin ini an natakod kan kalsada haleng siyudad nin san francisco pasiring sa marin county,0
an sinambit isyu panahon pa ni dating general manager emelita candia perang veces nagfollow erc sagcod ngunian mayo reply pa,0
puta an iba tabi ang branding mo dk maawa ka sako,1
sa timog nin aprika an tubig na antartico minabolos paamihanan paagi sa agulhas baisin dangan pasirangan sa agulhas pasage asin sa timog na parte kan agulhas plateau hale sa lugar na iyan ibinalyo sa mozambique bain,0
ulol tangina mo bua,1
sa ika kan enero pigbendisyunan an bagong building at inako ang bagong pangaran na st,0
dai taka man crush pucha ka,1
ini dinadayo na gayo kan mga turista asin masabi na dai kumpleto an pagbisita sa pasig kun an sarong turista o bisita dai mapagabay igdi,0
an qatar sarong emiratong arabo sa tangang subangan na laklak niya an sadit na qatar peninsula sa may nortesubangan na kosa kan mas darodakula na arabong peninsula,0
iyo si obispo gainza an nagorden na an nobenaryo ipalagda sa imprenta de m sanchez y cia asin ipalakop sa mga deboto,0
an joaquin na tugang niya ngapit magigin senador poon sundo,0
mga patal mag iribahan kamo,1
nagpadara man nin kamawotan sa tsina malaysia indonesya asin filipinas natabangan an mga parasirang mangangaipuhan nin masirungan gikan sa bagyo,0
si taylor nagluwas man sa takop kan april na isyu kan fhm philippine edition na nagtau saiya nin dalan para sa mas mga matured na karakter,0
an sabi niya mapirma siya kun an simbahan lakawon an kagustohan niyang madugangan na madugangan an pagnombra sa mga importanteng pwesto an mga filipinong padi,0
ngonyan saro siya sa nangengenot na kandidato para bise presidente sa eleksyon presidensyal kan filipinas,0
piginaguraran an torre kan abril,0
nagdakula sya sa kampala asin pinunan an saiyang aktibismo kan disyembre pakatapos na mahadit manungod sa pambihira kalangkaw na temperatura sa saiyang nasyon,0
igwa ining sukol na kilometro kwadrado na kadagaan asin namumugtak sa inot na distrito,0
daing gayo isi an talagang kawsa kan pangyari nin vitiligo,0
tian man garo man ini bakla magayon ini padi,1
inin an panganom na letra sa suanoy na abakadang tagalog,0
pakalihis nin oras nagsunod an jma,0
mahuyo an boot mayong ayre asin parati ngane mahiling sa sentro kan naga nakashorts sana,0
bwiset kaya mga scammers eh,1
ipinahiling digdi kun pano pakusogon an namamate asin emosyon sa paagi kan saiyang mga ginibo,0
heyheyheyheyluhayluhay bugayninaniya sarong tagay tulong hungit ning pulutan,1
an mga magurang niya iyo sinda pedro dimarumba asin frisca aytona,0
an wolpramyo o tungsten na bistado man bilang wolfram iyo sarong elementong kimikal na may simbolo na w asin atomikong bilang na an taramong tungsten iyo gikan sa tataramong swedish na tung sten na direktang mapapalis na magabat na gapo,0
an kusog kan halas sa ikog nagpopoon,0
igwang sukol na km an probinsya kay ini ang ika sa pinakasadit na probinsya sa nasyon,0
mga industriya sa serbisyo nangawat na gayo nin prominenteng papel sa pagtalubo kan saiyang warterfront asin sa pagmukna kan saro sa pinakadakulang downtown kan nasyon nin estados unidos,0
igdi nagtolong taon siyang serbisyo asin pighingoa niyang mabalik an naraot na kredibilidad kan ahensya,0
ipirot ako pero dae ako mangiturog deputa,1
padaba ka man kaan ta malipot,0
pasahan na kang gabos saaga,1
an potensyal para sa mga nawawarang artikulong idto madedeterminar sa paagi nin paghahanap kan mga red hyperlinks na yaun sa mga eksistido sa wikipedia o mga templates,0
sa kadakol na mga simbahan ngunyan mga gurangan asin kaarakian minapalaen para sa gabos o an iba man na serbisyo minaresibe uyon sa tamang edad na katukdoan,0
an sultan naga dimaporo namomogtak sa sursolnopan na parte kan probinsya nin lanao del norte,0
kaya an mga banal sa huringaldaw naniniwala sa premortal na pagkabuhay na kun saen an mga katawohan literal na espiritung kaarakian nin diyos,0
an siyudad kan naga makaag nin sarong museo kun saen matitipon asin masasaray an gabos na memorabilia kan dainang sekretaryo na aaporon jesse m robredo museum and memorabilia mapepwesto sa laog kan raul s roco library harani sa city hall,0
iyo ini an saro sa mga sinurat niyang ultimo bago siya pinapabadil duman sa bagumbayan ngonyan liwasang rizal na,0
an dzvofm mhz play radio iyo an nangenot na istasyon nin radyo kan audiovisual communicaters inc,0
tinatanom kaini pwede an saiyang mga pisog o mga sanga,0
sa mga libro an pantasya dapit sa mahika,0
dae gabos nin mga datu iyo nagtinir sa panay arug nin duwa sa mga ini kaiba an saindang mga angkan asin mga tagasunod sinda nagpadagos pasiring sa norte,0
an flags of the world o fotw sarong websayt manonongod sa mga bandera,0
sobra sa kan domestik na shipping nakabase igdi sa cebu,0
an proyektong openleaks pigtogdas kan septyembre,0
kan habang siyan nagtatrabaho sa regal films inimbitahan siya na magsali sa bagong abscbn na nagbukas ulit kan setyembre,0
lain man igdi an kapangyarihan sa gobyerno,0
retrato pinitk sa may golpo kan ragay haleng san pascual masbate pasiring pantalan kan pasacao camarines sur,0
brown william h volume dept of agriculture and commerce technical bulletin manila,0
as a firstimer pucha makabuahon palan talaga ang research nabubua na ako,1
dakula an ikinontribwir nya sa pagtao nin atensyon sa mga isyu na mayo nin malinig na inumon na tubig sa mga komunidad nin mga katutubo,0
kyuton si primo puta,1
an butanding ingles whale shark rhincodon typus sarong klaseng sira na konsideradong iyo na an pinakadakula asin ini minimidbid na sarong pating,0
dai na lugod ako nakakaon na maray gari dangag,1
an saiyang ama paratahi asin tagagibo nin mga aksesorya na panlalaki na nagadan kan tolong taon pa lang si donna,0
ayuda imang letra pero puro kapamilya ang naka lista,0
iuragan talaga ako sa mga hugak hugakunon mga putangina nindo batugan kamo mga pasibaon pa pakyu,1
saiyang napangalas ini sa pagsimbag na libyanong libyano sa mga hapot na sobra pagkadipisil,0
bilang kadagdagan sa pagpirit sa pagpinta kan iba igwang mga bareta sa medya na nagmumungkahi na an pira sa malawig na bilang kan mga pinta na ipinagribay sa irarom kan pangaran ni minnie dai pigmukna kan gabos saiya,0
tabaco an rona pero kun isasangat sa lebel kan kagabsan saro ining simbolo kan gabos na dati baad sa kaakian pinadabang maray dangan nawara dangan ngonian baad sa kagurangan labilabing pighihidaw,0
puon sagkod presidente si david kan ecoshelter inc sarong pribadong kumpanya na imbwelto pagtugdok nin istaran asin paghimo nin alternatibong mga materyales sa pagpaharong,0
jose roberto an apat nagin mga abogado na iyo sinda jose maria jesus antonio jr jesus fernando asin juan luis,0
sa pagkauyam ni tecson ipigwasiwas kaini an saiyang sundang,0
siya an inot na kagsurat nin kasaysayan kan literaturang bikolnon,0
an enot na mga kristiyano mayong kakudian laban sa mga imahe litrato o mga estatuwa,0
bilang sarong propesor siya nagtutukdo nin ingles asin dyurnalismo sa unibersidad kan ateneo de manila,0
an tangguli kaini mas lasawlasaw asin mas madaling magraot sa lawig nin panahon,0
ibang mga eksperto nagsusunod sa teoriya na an pagpugot payo asin pagsaray kaini huli sa pagtubod na an payo iyo an sarayan kan kalag o pwersa espiritu na pwedeng makulong asin makataong darupi sa kagsaray kan pinugot,0
si moreno saro sa doseng artistang ginana an apat na mayor na mga premyo sa lantad nin amerikanong entertainment egot oscar emmy grammy asin tony,0
mas gusto niya pa na yaon lang siya sa likod kan ripondipon nagdadangog sa saiyang agom pagdidiskurso,0
sinda an naghira kan filipinas na magin iyo an ikatolong pinakadakulang nasyon sa bilog na kinban na tataong magtaram ingles,0
feeling makusog ampota kaya wara nagahiling saimo ta,1
sa ultimong edisyon na ini saiyang itinolod an pagtubod na igwa kan sinasabing pagisog kan kadagaan kan mga kotinente sarong hipotesis na naprobaran na totoo pakalihis nin pirang siglo pa,0
si fonda yaon sa hunta igdi,0
pangiton ako makauragon mga anong ini sa pandok kairita puta,1
mga awit para sa ina an tambobong nin literaturang bikolnon tomo blg,0
haluyon daa pailawan kang aleco sabi kang naki jumper,0
inusisa kan mga pulis si contemplacion asin ka inot pa nagtuga na ini sa krimen nin paggadan ki maga asin huang,0
nagistar sinda sa london asin igwang tolong aki,0
nababanga an villasis sa barangay,0
kan nagsulot si princess eugenie nin tolonf desinyo ni westwoodparasa saiyang okasyon bago ang kasal seremonya asin pakatapos sa kasal ni prince william asin catherine middleton,0
namimiss taka na naman kapal talaga kan pandok mo,0
sa mga aki bako man na gayo labi an isog kan sintomas,0
haha mag ccod nalang ako punyeta maski pa botfrag ako sa codm atleast may kill buda ambag pero pag sa valo inda na sana,1
an mga gibo ni mallari naitanghal na sa mga eksibisyon sa kinaban an pira igdi iyo an manila los angeles denmark mexico japan australia singapore asin malaysia,0
an cuenca institute natindog kan asin ini an pinakaenot na segundarya sa banwaan,0
napatos sinda kan laboy sa tuyong bako sana malipotan kundi ngane dai pagparakagaton kan mga insekto,0
kan naglipat si park hale sa pagkanta paduman sa pagarte nagpuon niyang gamiton an ngaran na park heevon,0
siya man an pinakaprimerong arsobispo kan nueva segovia kan ini ginibong arkidiosesis kan hunyo,0
si jeffrey horn namundag pebrero sarong australianong boksyador na propesyonal,0
an abiso na ipinaluwas susog sa iucn red list of threatened species an gamgam na ini madali nang gayo mawara,0
zero based gayod grado kay patal,1
igwang dambana sa isla na pigaapod na koganeyamajinja na kung sain napetdahan ini poon kan ika na siglo,0
pigpalis na ini sa na mga lenggwahe,0
an mga minasunod na eskema nin klasipikasyon gikan ki sneddon,0
gago kang patal ka,1
an mga singles sa sarong erya puwedeng makanagbo nin iba man na singles na may kaparehong interes asin mga paniniwala ginigibo kaining sayon na makanagbo nin sarong agomon,0
pero puta makulog ngunyan na june ta duman sa philhealth unless pakarayon su mag shift ki payment scheme su payroll buda hr,1
ang kultoy ay pwedeng mawara sa laog kang saro duwang semana o na aldaw kung dae mapabayaan,0
alagad guminana man kuta sinda dangan sana ta nagadan sa pakikilaban an prinsesa,0
dae ko narecover puta wara din sa icloud,1
pakyu ka sarong milyon dara ko ang gulogulo ko saimo hanggang buhay hayop ka,1
an manggosten garcinia mangostana sarong tropikal na tinanom na nagkakahoy,0
sa mga gurang bihira an mga sintomas na ini,0
bago an gera nagtrabaho si tapang bilang sarong organisador kan pambansang katipunan ng mga magsasaka ng pilipinas national assembly of farmers in the philippines,0
may lokal na dyalekto igdi na ginagamit pero ngane mas lakop igdi an lenggwaheng bisaya na cebuano,0
an mga gapo pinagsarama gamit martilyo asin mga tiam an ginamit ngani an nakasapaw na gapo sa ibabaw kan mga nakatindog magin pusog asin magpugol sa mga gapong tindog,0
an lugar na ini iyo an pampang kan salog sa gilid kan tulay tabuco,0
si toru baba baba tru hunyo sarong hapon na aktor parakanta asin entertainer,0
putangina nasusuka na naman ako,1
an kublit kan hawak niya sarama sana asin garo may mga malamuting pamalit,0
nagaba ini kan bagyo kan asin natomtom sa kalayo kan,0
pakatapos magluwas mystery thriller na rainbow eyes asin holiday movie na romantic island nagbalik si lee sa telebisyon,0
alagad an mga linggwista boot sabihon kan mandarin iyo na an bilog na kahiwasan kan lenggwaheng ini,0
an mayor na mga denominasyon minabale sa shaibismo shaktismo vaishnabismo smartismo asin halumatha,0
ini may mga paroparikpik sa kalabaan kan talodtod sundo sa saindang ikog asin may sadit na ikatolong mata sa payo,0
uragon joke naglala insecurity ko haha putangina mo haha,1
an summer session sa devon high school nagpapahiling nin katalingkasan kawaran nin orden asin kadiit sanang pagaradal,0
ini an pinaka nagdadakulang syudad sa rehiyon sa southeast asiamagin sa populasyon asin ekonomiya,0
an pahanan agta palanan dumagat sarong naiibang tataramon na suway sa paranan agta,0
iula na an lasaw na guta sa kawali saka medyo aloyooy sana an kalayo,0
si adi koila maritakau sarong fijian na abogado na nagserbe bilang diplomato asin politiko,0
puta dapat palan atchan ko na ini tig punan bago ako magkaturog makaon pa akong pamanggihan pano ko ini iexplain na hurubag mata ko,1
bago an moraturyo si martin pigtulod na maipaluwas sa publiko an eksperyensya asin salang pagpadalagan kan industriya nin pagsisira nin cod sa pagandam na mapepreserbar pa an mga ekosistema,0
pangsampulo an nasyon na hapon sa may pinakadakol na populasyon na igwang milyong katawo,0
pigiingganyo man kaini an mga namamanwa kan naga na magin responsable tanganing mamantinir an kalinigan kan salog,0
si norma sinundan an yapak kan saiyang ina na naging nars asin tagagibo kan saiyang mga imbensyon,0
punyeta nata dae nadelete old instagram ko,1
puta kamo puta dae ko napasa mga assignments ko dahil sa putang service nindo mga puta,1
an mga bukol na arog kan ladrilyo midbid sa bareta an nakapatos pagkatapos asin ipigpapabakal,0
saro siya sa miyembro kan koreanong grupo nin musika na izone,0
ngunyan an bagong henerasyon naghahagad nin kapaliwanagan kun ano an ginibo ta sa mga daga na sinubli ta sana man sainda,0
mant labing sangribo an variety kan mangga mansana kaini an pigkukultibar para sa komersyal na produksyon,0
igwa ining sukol na kilometro kwadrado na kadagaan asin namumugtak sa ikaduwang distrito,0
inaapod man ini bilang archimedes constant,0
may kahulugan ini na rasyo kan sirkumperensya sa saiyang diyametro sa sarong bilog asin igwa man nin manlainlain na kaparehas na depinisyon,0
partikularmente kan sayumahan kaini na magdeklarar nin gera kontra sa estados unidos asin united kingdom,0
malason pano ako mauli warang service commute pakshet,1
sa ibang lugar sa bicol ini mayong kasalak na ano pa man na gulaygulay kundi sili o lada sana nanggad,0
an bagyo nagkikibigkibig sa daga asin sa trapik sa aire,0
si morris nangagin sarong daragang igwang langkaw na pye pulgada asin timbang na libras igwa nin bughaw na mga mata asin marumarom na kolor kayumanggi haros itom na buhok asin pigurang may sukol na pulgada,0
an magagom may tulong aki anas babae jessica marie aika janine patricia asin jillian therese,0
ihinghing an sakit na sakuyang inaagihan,0
an syudad an sentro nin politika sa pakistan aasin pinamamahalaan kan islamabad metropolitan corporation asin sinusuportahan kan capital development authority cda,0
an rasonic sarong pangaran nin brand sa irarom kan shun hing electric works and engineering co,0
kan marsdo an sityo nakahakot na nin milyon na bisita bulanbulan,0
kadaklan kan mga naga pigkukuan nin pasagi na gamit na gayo sa konstruksyon asin an kahoy kaini makunot matagal pino an supat,0
ulol putangina mo gago pakyu,1
si washington nagperform man sa tada,0
pagkatapos kan saiyang pagklase sa estados unidos si lopez binayaan an saiyang marangyang buhay sa manila para magin sarong misyonaryo kan yoga kun saen itinao niya an saiynag bienteng taon na pagbuhay asin nagistar sa portugal india asin africa,0
gago mamunduon an salubong,1
kan siya piginitan na kan mga kastila duminulag siya asin nagpasiring sa espanya,0
aram nata sadit pano kang elementary dara dara sampulong libro dae man tig gagamit,0
an flute o inaapod man na flauta sarong instrumento nin musika na kabali sa seksyon o pamilya nin mga woodwind,0
an sago sinasalak sa mga kakanon arog kan taho halohalo asin iba pa,0
an mga babae dai masiripan sa laog kan harong ninda dapat an mga bintana may tahob nin tela o maski ngane magngising makusog na makaapod atensyon,0
sa panahon na idto kawasa bagong paghira nanggad sa pagkasabot kan sistema solar ta huna an kinaban iyo an iniitokan kan gabos na bagay sa kalangitan,0
siya nanombrahan direktor kan city planning board duman kan alagad an posisyon winara kan kan an lugar sinakop kan hokbong pranses,0
sinasabing an katagang langkawas kaagid mansana sa indones na tataramon na lengcuas,0
nagtrabaho sya tangani na magtao nin tabang asin mga panao sa mga rural na parte kan roma asin sya tagapagtulod man kan pantay na oportunidad para sa mga tagaroma sa bosnia asin herzegovina sa nakaaging duwang taon,0
huli sa reklamasyon kan daga na ginibo kaidtong amay na ika siglo naatras an mga pader asin kuta kaini gikan sa baybayon,0
mala ta siya daa mayong pagtubod sa dios sa anoman na relihiyon asin m akusog niyang liniliwatliwat na an gobyerno amerikano nagrororo nanggad,0
dai nagdangog boboy saiyang tugang,0
an fiji live nagsabi nin manungod saiya kan disyembre bilang pangapudan sa pagkaag nin interim na gobyerno na maimplementar sa hahagadon kan kumander militar na si,0
dakulon kamong naginibo mga hayp,1
igwa ining sukol na kilometro kwadrado na kadagaan asin namumugtak sa solong distrito,0
wara kanang trabaho gibuhon mong baynte yan punyeta,1
an koponan natapos na ikatulo dinaog kan bulgaria asin puerto rico tanganing dai makaabante sa final round,0
magkakapirang mga espesye man ang nagkalat sa ibaibang lokasyon sa north amerika asin sa kataraid na rehiyon,0
tomas an ipinublikar kan parasurat bikolnon kan,0
moments of weakness itong mga dangag kamo,1
kan an unesco pigbali ini sa lista komo saro sa pamanang pangkinaban na lugar,0
si john milton bernhisel namundag john martin bernheisel richard s van wagoner and steven c walker a book of mormons salt lake city utah signature books sv john m bernhisel,0
igwa ining sukol na kilometro kwadrado na kadagaan asin namumugtak sa inot na distrito,0
an dakulang harong kaidto pagsasadire ni capitan gregorio patrocinio iyo ngunang pinaghimo na temporaryong korte,0
an java an pinakamatawong isla sobra sa kabanga nin populasyon kan nasyon,0
an mga bitoon puwedeng magporma nin partihan sa mas dakulang grabitasyonal na istraktura arug kan pagigin cluster o sarong galaksiya,0
naenot na nagtreyning si iu sa good entertainment kaiba si uee yubin heo gayoon asin jun hyoseong,0
puta hali an sa saro kong tweet,1
nagluwas an saiyang gibo sa bolivian express pagna siete asin biyernes para sa semanal na babasahon,0
dawa takot si wilson sa paggamit mikropono sa radyo ginampanan niya an pagiging ribong na si irma peterson sa radio comedy na my friend irma puon abril hanggang august,0
haha tarantado ka man talaga,1
pagkatapos kaini sinabi niya sa mga awtoridad an dapit sa panggagadan sa saiyang aki,0
gago guna ko magagadan na ako sa pahinghing ni changbin tas may felix buda lee know version pa palan ito haha,1
kan panahon na idto an compostela valley parte pa kan davao del norte,0
an terminong ukayukay hali sa cebuano na ukay ibig sabihon maghalukay,0
mahihiling man an mga libro sa pamitisan niya simbolo nin kabatiran,0
tangina anong ipair ko digdi,1
tarantado ining school nagpa summer class guna ko enrolled na kami kinaluwasan kami pa palan ma enroll kan sadiri mi and meaning kaito gastos,1
iyo ini an inot na libro ni christie na dai nin dedikasyon,0
an peryodiko pagsasadiri kan community news group incorporated asin may opisina kaidto sa dychiao building mayon avenue syudad nin naga,0
so mga dai pinili jan pwede na kamu mag karaturog,0
si widodo na namundag sa sarong gilid nin salog na erokan kan mga tios sa surakarta nginaranan man solo sa probinsya nin central java iyo an pinakamatuang aki ninda noto mihardjo asin sujiatmi notomihardjo asin may dating darang pangaran na mulyono,0
su mga papansinon na arog mong kupal na an igkakaon hale sa ayuda puro pa nanggad reklamo,1
patalon ka renz tangina mo,1
mga dangag an rts ngane na worth right million dae ninda binalik last year november pa ito,1
sa baguio kaya wheel ako so baka pulutan ako arog kaan tangina tas ulok ulok lang tas iisipon after,1
sya associate director sa laverre national laboratoryo asin fellow sya american association for the advancement of science,0
nagklase asin nagtapos siya sa muntinlupa elementary school dangan sa saiyang sekundarya sa philippine christian university,0
medyo patal patalon ka part nag wawallet ka tapos mayo man kwarta arayku tuminablada sako,1
igwa siya ngunyan nin sarong makuapo,0
an las pias nababanga sa barangay,0
an kaagid na mga kamugtakan ibinubugtak man an saindang pinakadakulang danaw si balkha na namemeligrong biyong maalang,0
an mga nagsunod na parte iyo an kuwesto ni labaw donggon pagbalos ni humadpanon sadiring kuwesto ni dumalapdap asin an pagpapadagos kan kuwesto ni humadapnon,0
kan periodo na grabi an pagtios huli sa makuring depression maski pa siring si ina niya pirme man siyang natatawan balon asin panggarogastos sa bado asin pagruruluwas kan mga barkada,0
sarong kongregasyon na yaon sa laog kan distrito o na ini saditon sana para magin sarong ward an puwedeng pagorganisaron bilang sarong branch kan simbahan,0
nababanga an bangui sa barangay,0
si jeannemarie lanvin enero hulyo sarong pranses na tagadisenyo nin gubing,0
may laman na malumoy berde asin malumhok na baludbod an namit nakaagid sa maalsom na berdeng mansanas,0
ako na sana talaga mahiling na sulo puta,1
bilogon an dahon an poro matipanas asin may gariging pino,0
ibinunyag niya man na duwang bulan matapos an saindang kasal nagpagibo siya nin dungo onose job kun sain siya tulong bulan na nagpaumay sa saindang harong,0
kan pigpili an tagalog komo basehan kan nasyunal na tataramon kan national language institute,0
pag pigdagdagan nin tuldok an ibabaw kan titik ang tunog ka ini ay magiging tanog na te o ti habang pag pigdagdagan man nin tuldok an irarom kan titik an tanog ka ini ay magiging tanog na to o tu,0
sa ibang parte kan pilipinas an bagyong betty nagdulot nin lakop na pagbaha na nagbunga nin grabeng destruksiyon,0
nagdesider si halili na magdalagan sa pagkaalkalde tanganing ipadagos an trabaho kan saiyang ama,0
an saiyang sadiribg harong nagserbi bilan sarong dance studio kun saen pigtutukd dangan pigsasagib an pangalay asin an iba pang tradisyunal na mga bayle,0
nagadan siyang dai nanagkamalay sa edad na kan desyembre oras am,0
makatakuton ka bwiset ka,1
an pagkakalaen sa pagdistribwir an penolohiya asin kadakoldakol na klase magiya pasiring sa dai malilikayan na mga pagbabago sa medyo abundang klase asin sa saindang mga interaksion,0
catalina an busay nin bantakay,0
nagpapahiling nin makusog na inpluwensiya nin papuanong substratum an mga tataramon kan mga isla nin raja ampat ini bakong malinaw na an mga ini totoo na austronesyo bilang kabaligtaran sa relexified na tataramong papuano,0
duwang rehiyunal na kasunduan an african charter on human and peopless rights saka an american convention on human rights an kapwa naggamit kan karapatan sa marhay na kapalibutan,0
