sentence,profane
an syudad sursubangan kan manila sursubangan kan cebu asin sursolnopan kan davao,0
patalon ngunyan ko lang nahiling na nag taram ka palan na jutay tangina ka ano mata mo bungog,1
tanga dae ko man po ini barkada,1
opisyal na nabilog ini kan hulyo bilang kasalihid kan organisasyon kan pagkakarasaro nin aprikano oau,0
an papel ni dumbledore ikinawat ni richard harris sa enot na duwang pelikula,0
puon kan pagbukas kan hong kong disneyland,0
an mga orig tiubong tal sa kontinenteng eurasia asin aprika,0
tomas nagkaag rebulto ni angeles duman sa baryo ninda sa pagtaong onra kan saiyang mga naginibohan,0
bilog na harong parong asu ki sulo punyeta,1
sige haragad ki jersey bakong minapatahi ta,0
napalagda kan saiyang pamilya sa tabang ni francis t nacianceno jr asin saiyang pagiriba,0
ini napagkukuan nin tabla gamit sa konstruksyon asin nin mga awat na pwede gibohon lubid asin an mga burak napupugaan nin asayti nagigibong olor,0
igkikilig ako sa sadiri ko pakshet,1
sinasabing ini an pinakadakulang edipisyo relihiyoso sa bilog na kinaban,0
an bersyon kan orihinal na kanta grimmie na find me iniluwas sa itunes kan hunyo asin nakaabot sa enot na pahina sa katapusan kan hulyo,0
pageleksyon kan sa edad pa sanang siya nagdalagan bilang alkalde asin nakaluwas,0
an ciudad mismo nakabanga sa treseng distrito o mga partidong administratibo,0
maitom partner iwalon kapag banggi dae nanggad kaya kaan magpaliwanag,0
an pagdurungan kaining mga reaksyon naresulta sa sintomas nin hapo asin nataong kasakitan sa normal na paghangos,0
bako ini an bagay na ikinakaogma kong akuon minsan sinabi nya alagad kan ako pito walo o syam na taom na patawara ako kan dios nasusupog ako huli ta kami mga orthodox jews,0
an saiyang pagganap digdi pinagmidbid kan mga kritiko asin nanggana siya nin sarong gawad bulawan na globe para sa best actress in motion picture musical or comedy,0
sarong sadiri asin pigmamanehar kan gobyerno local tourist destination an amuris resort an papakarhayon man tanganing magin dagdag burabod nin revenue kan gobyerno local,0
ini man an kapitolyo kan riyadh province asin kabali sa historikal na rehiyon kan najd asin alyamama,0
nagtao man nin saindang mga kataga nin pakikidumamay an mga embahada kan intsik pranses filipinas asin belgyano sa hapon,0
nag aadal sia sa collge norredame de la paix sa namur,0
an pinakagurang na mga libro kan tanakh bibliya na isinurat kaidtong ika na siglo bce iyo nagrereplekta kan iriwal na ini arug sa libro ni hosea asin libro ni nahum,0
nasa para inom ang true love buro bangi ki lab lab,0
pinangarap niya na magkaigwang ingles na tataramon sa programming,0
sa paagi kan impluwensya nin budismo an kami iyo nadepiktar nin antropomorpiko asin nailaag sa kosmolohiya nin budismo,0
dakulon talagang kupal sa na ankaaplibot saimo,1
luwayluway na pinapapa an aboyabos asin an aso kaini garo mansana arog kan sa katol na padulag sa namok,0
kan ginawadan kan cfda si spade nin americas new fashion talent in accessories para sa saiyang mga klasikong desinyo,0
an agusan del norte nababanga saa sarong syudad asin banwaan,0
igwa nin pirang mga ebidensya na an regular na paggamit nin suplemento iyo pwedeng magpababa kan durasyon nin sipon pero dae ini minaluwas para malikayan an impeksyon,0
nagkua pa siyang dagdag na adal sa engineering pakagraduar niya sa west point kun saen natapos asin nakamit niya an masters degree sa civil engineering duman sa university of illinois,0
kaya gayod pigngaranan na an lugar na batalay,0
putangina ki dora phase ko kandati kan gari gago,1
maski totoo parati an inalang asin pinulbos nang unod kasini an gamit sa mga resipeng asyano an iba man labas na unod an inaatsara,0
igwa pa man siyang sarong padalan sa tv an inapod na idol sa kusina na pinapasale sa channel gma news tv kun banggi,0
si disney nanggad an kagpoon kan mga pelikulang kartoon asin siya igwang rekord na may pinakadakul na academy award nasikwit bilang indibidwal huli ta nagawadan siyang na oscar hale sa nominasyon,0
nabuntog siya tolos sa lantad nin pulitika asin sa serbisyo sa gobyerno na nagpoon kan siya nagin piskal sa probinsya kan capiz,0
ini alagad nagdadakul pag an panahon maalingahot asin mainit dangan an kublit malanalana,0
tinutubod na sobrino pa kan sarong pintor si simn flores y de la rosa,0
city of naga philippines,0
an istorya niya asin kan saiyang maestra na si anne sullivan nagin sikat sa autobiograpiya ni keller the story of my life dangan sa adaptasyon kaini sa pelikula asin teatro the miracle worker,0
tangina hiribian na naman kita kaini huhu,1
an pagepekto nin baksinasyon iyo mahiwas na pigaadalan sagkod pigbeberipika halimbawa an mga bakuna na probadong epektibo iyo kabali an sa influenza an bakunang hpv sagkod an para sa otos,0
anuman delikado pa mananggad sinda,0
iyo ika burak tapos sokolet pero sigurado ka ba ika tinawan,0
sa saiyang byahe pirang mga karakter pa an nakaulay ni steven,0
kan si joseph smith nagsimbag sa mga minasunod na mga kahaputan habang nagbibiyahe gikan sa kirtland pasiringon sa missouri siring sa minasunod mga abolisyonista an mga mormons,0
bersyon ni balmaceda santos asin ni caballo na piggamit poon duwang taon pagkalihis kan pagtao kan kasarinlan sa filipinas kan estados unidos kadtong sagkod,0
namundag sa baryo menr kan marso siya aking babayi kan mga paratukdo kan eskuwelahan na si msrr zarifullina asin ftxelbayan agumovs,0
minsan ngani an pagbago nin klima puedeng magkaigwa nin positibong mga epekto sa nagkapirang parte kan kinaban sa ibang parte iyan may negatibo nang epekto sa mga sistema nin ekolohiya,0
si michelangelo pinadara siya kan saiyang ama na magadal nin gramatika sa humanistang si francesco da urbino sa florence kan siya solterito,0
pag ako talaga naghiling ki game ninda masuriyaa talaga ako duman ki makusog tapos lang dae na kaiba nexplay total kupal su mga tawong nasa paligid niya,1
hala haha ikirilig ako putangina,1
pagkatapos kain masunod an huring paghuhukom,0
pigbukasan an jr east kadtong ika nin abril pagkatapos na magsuway ini sa nasyunal na agihangriles kan hapon na sarong pagkagsadiri kan gobyerno,0
igwa siya nin tulong tugang na lalaki,0
an hinabyog boot sabihon ipigduyan siring sa nagtatarotabyon arog kan duyan na kawayan,0
bosulachi o ipigsusurat man bilangboslachi sarong klase nin surkoreano na parodiya o satiriko na gikan sa tataramon na boji vagina and byoseulachi bureaucrat,0
tinawan sya nin gold medal for creative writing asin naggradwar sa hayskul bilang honorable mention,0
si dela torre nagperporm nin saiyang mga solong kanta sa duwang opisyal na soundtracks kan mga romatikong pelikulang camp sawi asin love you to the stars and back,0
tangina talaga kan mga iresponsableng members kan research group dai sana maikaag name nindo sa final research paper putangina nindo,1
sa mga lideres sa partidong ini saro si sergio osmena na ngapit iyo an manombra saiya sa korte suprema,0
an saro sa saindang mga ninuno saro man na nanginginot na aktibista sa irish national land league kan mayo asin sa irish republican brotherhood,0
alagad dae pwedeng doblehon kaini an silyabaryong katanog kan na ni nu ne no,0
magtimpla ka ki sadiri mong kape lmfao pakyu,1
siring man an paraoma pwede man idtong nagaasikaso sa mga paghahayop arog kan bakahan manokan o origan,0
si christopher mark chris algieri namundag marso sarong amerikanong boksyador na dati sarong kickboxer alagad ngonyan sa presente boksyador na propesyonal sa dibisyon na light welterweight,0
pirmi ining ipigtutukdo na pigtatawang doon kan listahan an mga bukid sa ronang chbu,0
sexyhon si lino pakshet,1
gago mga be naeexcite na igkukurab talaga ako puta dae ko man birthday baynte na si belle mariano,1
tolong araw pagkatapos kan pasko naglala an kasaludan asin nagadan siya sa bisperas kan bagong taon kadtongg sa edad na tolo an saiyang sertipiko nin kagadanan nagtatao nin rason kan suppressed scarlatina asin laryngitis,0
dakulon tlga tao maski piday sige papansin bakong minahanap ki iba ta tigpapara gulo piday wara kamo maginibo buhay nindo paglukso ta maugma ka pa maka uyam lamang,1
manta na siya aktibo sa pagkaabogado pagkamoot niya man an magadal asin magsurat dapit kan mga bagay na historiko asin kultural,0
dakul an saiyang mga komposisyon na nagsikat na gayo arog kan bohemian rhapsody killer queen somebody to love dont stop me now crazy little thing called love asin we are the champions,0
an coal o karbon na gapo iyo sarong kombustableng maitom o malakayumanggiitom na sedimentaryong gapo na nabibilog bilang gapong istrata na inaapod na coal seams,0
gikan sa eksperyensya ni dr,0
an kampana mismo nagtitimbang na tonelada,0
si villame iyo an inot na nagpamidbid kan saiyang musika bilang novelty tanganing maiba sa saiyang mga kakontemporanyo na nagmaigot na marhay tanganing magtingog arog ni perry como o frank sinatra,0
an dinagyang nagpuon pagkatapos ni rev,0
an magtugang na maute may saro pang tugang na si hashim asin ini nakukulong alagad kan kariribokan sa marawi an huri nakadulag sa preso,0
an mga lider kan lds na simbahan pinaghingohang mabawasan an mga pagkakaiba kaini sa amerikanong kristiyanidadamerican christianity,0
kan kan panahon nin komonwelt pigtindog ni soriano an commonwealth insurance company sarong kompanyang pansegurong nonlife,0
kinaputan niya an poste kan halangkaw na komisyonado kan tonga sa australya poon kaidtong agosto,0
an aldaw nin saod domingo na inaapod igdi na tabu kun saen hinahakot igdi an mga prutas mga gulayon bagong buno na karne asin mga manok o itik man,0
termporaryo syang naglingkod puon kan hunyo sagkod kan agosto kan sinayumahan an pagkatalaga saiya kan commission on appointments,0
patalon ka putangina mo utak mo manyakis kung ano anong kadustaan iga isip sa ibang tawo wara man kamong ebidensiya tandol nindo payo nindo sa paril tutal wara man na pakinabang,1
william cameron forbes sa carnival grounds sa malate manila,0
nababang an marinduque sa ng banwaan,0
si magayon iyo na ngonyan an mayong na tuminubo sa lugar na gayo kun saen ilinubong siya,0
hahalaton taka pakyu haha,1
an mga minerals na iyo purong selenide o selenate na kompuwesto iyo aram pero bihira sana,0
an kapitolyo kan nasyon iyo an kathmandu,0
nagkaigwa nin film debut sa saiyang fantasy comedy na north asin nanominar para sa independent spirit award para sa pelikulang manny lo,0
kan oktobre an negosyong kinaag iyo an vigilant investigative and security agency kun saen siya an pamayo asin nakasikwit siya kan kontrata sa pagmato kan seguridad sa philippine amusement and gaming corporation kan,0
an martilyo de bola ingles ballpeen hammer ballpein hammer ball pane hammer sarong klaseng martilyo na may katambal na pamukpok na bilogon an hitsura,0
an presenteng gabinite iyo an ikang gabinite kan turkiya,0
nakaimbento siya nin nagkapirang klase nin kakanon para mapadikit an pangangaipo sa mga imported na produkto sagkod para mapakakan an mga filipino,0
kan pigmukna ni maguire an nonprofit educational charity childrens literature new england inc asin codirector sa laog nin na taon,0
kan enot pa kan hulyo siya ginawadan sentensyang taon pagkakapiot sa karsel federal kan siya magako sa mga akusasyon na child pornography,0
pigtala an tolong katanog bilang a i u,0
saindang naokupar an banwaan nin candor alagad nabawe man giraray kan mga espanyol,0
an misyonaryong trabaho iyo an saro sa mga susing aspeto kan lds na simbahan asin sa pinakaenot na taon kan organisasyon an simbahan nagpadara kan enot kaining misyonaryo si samuel smith tugang ni joseph smith jr,0
an lugad dapat mahugasan nanggad na marahay asin anoman na mga kurukublit sa palibot haraleon,0
naelehir siya liwat kan asin naotro ini kan taon,0
sa saiyang relasyon ki lee malinaw na si hohoff nagtatao sana nin maninigong giyang editoryal,0
sarong maluyang raraan an nagdara kaiyan paamihanan kun saen an marang aire asin bertikal na kamalig nagpangyari na iyan mawara sa marso,0
sosog sa nasyunal na komite sa tradisyunal na kasanayan kan ethiopia an mga gawing ini iyo an basehan kan kan pagagoman sa nasyon kan,0
sa enotang wala kaini iyo an chili peppers sarong inominoman asin binibistong nagpuon na nagkaag nin siring na negosyo sa tinampong ini,0
para sa mga grupo na dae nagrerekonosir nin sarong pagkasaserdote distinkto gikan sa ordinaryong mga paratubod an mga serbisyo heneralmente pinapangenotan sa paagi nin sarong ministro tagapagbalangibog or pastor,0
kan an ika na koalisyon sururog na nasupil an saiyang pwersa sa leipzig sunod na taon piglusob kaini an pranses mismo pinerswa siyang maghilig sa trono asin pigdestierro siya sa isla nin elba,0
mas maray pang mag saro na sana ako kesa makaiba kamo mga maribukon ampota dakulon kamo masyadong sisabe naturingan pang mag mag kakaiba kita sa harong inaniyo,1
nakalist sa bab an pirng bakong sistema nin panurt na base sa latin,0
hanggang nuaren pa ba ini tangina,1
si lea namugerwa namundag sarong aktibista pang klima nin mga hoben sa uganda,0
an buhay sa misyon sarong panahon nin pagpapangadye pagaadal nin mga kasuratan pagtutukdo asin paghahanap sainda na nagmamawot na magin makusog an pakipagrelasyon sa diyos,0
pakyu ka oy haha,1
an paraataman an saiya sanang kontrolado an estaran kaini an anira o anoman na kagamitan alagad an mga alimbubuyog naglalayawlayaw sa kahiwasan nin mga katatamnan sa paghanap kakanon pero pwede maghubong estaran,0
igwa ining sukol na kilometro kwadrado na kadagaan asin namumugtak sa solong distrito,0
si vega pamangkin inlaw kan grammy awardwinning singer na si juan luis guerra asin agom kan nba player al horford,0
siya an executive chairman asin chief creative officer kan saiyang brand na tory burch llc,0
ka patal inuragan lugod sir,1
pigtatantya ining supplay nin sira para sa mga sibugaynon na nageerok sa lugar,0
dati siyng profesora kan departmento kan humanidades kan institute of arts and sciences kan camarines sur state agricultural college,0
putangina sisay na naman an,1
dangan nagklase na siya sa beverly hills high school pero nagbalyo asin nakatapos siya kan sa pacific hills school na dati inaapod na bel air prep,0
alunan ko na sana ang makulog tangina tapos ining abo na ini,1
ngonyan talagsad bihira nang gamiton sa mga tinampo kan mga syudad liban sa mga panturistang lugar asin sa mga baryo,0
pinagreport na sarong padi an pigkidnap magkapirang kristiyano an ginaradan asin magkapirang mga edipisyo an sinurulo,0
siring man ini nahugas sa anoman na mga toxin sa hawak,0
putangina mo pakyu pasalamat ka dae ako pwedeng magmuda sa english or punyeta ka baka nakadanggog kana ki dakulon na muda bwiset kang hayop ka seramon ka palayugon sa mars,1
naghahanap ki acads accountability partner ta putangina wara na akong gana,1
lalo ko sinda na miss i think pakyu,1
malay baga hayop kidnapper itong holdapper,1
igwa ining hiwas na km asin,0
kan abril tulong aldaw pakalihis maaresto si liliosa nakaresibi nin apod si mrs,0
an polimerisasyon iyo nangyayari sa ribosomo,0
binunyagan bilang sarong kristiyano asin pinaadal sa royal school siya asin an saiyang mga tugang asin mga pinsan pinagpanigo na magtukaw sa trono ni hadeng kamehameha iii,0
igwang natatadang na aldaw sagkod kan katapusan nin taon,0
susog sa senso kan igwang katawo na nageerok igdi,0
ikapidayon na su nasa sayout ko haha tanginang an,1
publikasyon kan kabikolan okt,0
igwang natatadang na aldaw sagkod kan katapusan nin taon,0
the furies sarong amerikanong dyaryo kan the furies collective na may intensyon na magtao nin boses sa separatismong lesbian asin naging aktibo poon enero hanggang sa tahaw kan,0
an hitsura kan anira,0
duman nasumpongan niya si louis mayer na iyo an nagtangro saiya nin konrata sa pelikula para sa hollywood kun saen siya nagin lataw na artista poon mga abot mga taon,0
an mga tagabrazil nginaranan an seksyon na ini salog solimbes sa bandang itaas kan pagsarapong naman kaini,0
nagibo nya ini pasiring sa st,0
sa elementarya niya nagklase sa unibersidad kan san carlos,0
garo mansana ini mani o pisog,0
papilion man arin mas malanit lanit su biyo baga nag irihe pag nilapdusan salikod,0
siya nagtugdok nin sarong enklabo nin wokou hapones asin tsinong mga pirata sa pangasinan,0
clownshit ining si aryan eh dangag dangagon man,1
haros gabos na mga kristiyano nagbubunyag nin mga umboy kadakol man na iba na dae,0
c clment michelangelo poon abot si michelangelo nagatender sa humanistang akademya na tinogdas ni medici na nagaayog sa impluensyang platoniko,0
pigagamit an duwa sa sublitaramon na espanyol,0
puta cringeon man haha,1
si august friedrich wilhelm orth hulyo mayo sarong arkitektong aleman,0
alagad kan magadan saiyang aki na sarong signalman duman sa batalya nin matanikau kan siya nagdesisyon na maglaog man sa coast guard kan estados unidos asin siya nadestino sa united states coast guard womens reserve,0
an up primer iyo sarong pagtiripon asin urulayan para sa mga estudyante sa senior high school na mawot may maaraman sa manlainlain na kampus nin unibersidad kan pilipinas na sistema asin man an lambang kurso kaini,0
tarantado ka trashtalking ka ha,1
kan mga si fonda nagpayngotob nanggad sa katakottakot na pagumaw saiya bilang mahusay na aktres apesar kan mga gawegawe niya dapit sa pagbuntog niya sa aktibismo,0
bilang sarong romantiko sa saiyang kajovenan nagganap siya sa mga kritikal na karakter arog kan pagiging ina asin mga mas nakakagurang na papel sa pelikula,0
an saiyang ambisyon iyo na liwaton an sosyodad sa paagi kan saiyang pagigin parasurat asin iladawan an kamugtakan kan klase nin pagtrabaho asin siring man an personal na pag uswag nin mga babae,0
sinda asin an iba pang aktibistang hoben pigtugdas an zero hour,0
naribayan an tataramon kan sarong pigkreoleng malay na pigaapod na malayo na ambones,0
nababanga an dingras sa barangay,0
tv mi raot lamang pero lintias cardo dalisay hanggang ngunyan buhay pa nanggad,1
huni ha as a demonyo buhay nindo huni maaadvise gabos garu isip aki pag nakakainom dumangog kamo,1
igwa ining sukol na kilometro kwadrado na kadagaan asin namumugtak sa ikaduwang distrito,0
igwa ining sukol na kilometro kwadrado na kadagaan asin namumugtak sa solong distrito,0
next time padarhan man akong maray maray burayninaniyang pinapadara sakuya hamag,1
si maggie de la riva aki ninda pilar torrente mestisang espaol asin ni juan de la riva german swiss,0
an aleppo iyo na an pinakadakulang siyudad kan nakakadakulang sirya asin ikatolo sa imperyong ottoman sunod sa constantinople saka cairo,0
haha tarantado ka bestfriend forever,1
ito ay magbubunga ng pagkakaisa magpakailanman sa puso at magtatatag ng katarungan at demokrasya,0
sarui pa ining kulapos ini oh,1
iyan an rason kung nata habo ko sabihon saimo na hayop ka,1
igwa nin duwang bagyo sa solnopan na pasipiko kan,0
tangina mo talaga cy hayop ka,1
kaya lang mga taong nakalipas kan si whitmer nakapagsabi na sa sarong tagapagbareta na an pangyayari nangyari sa manchester whitmer,0
para sako dae matagot duwa kami pagka dotdot saro ih dotdot sako,0
an pelikula na nakikitungo sa karahasan sa istaran nakabatay sa gro dahle asin libro nin ladawan ni svein nyhus kan parehas na titulo,0
an resulta kan pagsap mapulang liwoy upa na kinukusp daw saen na sana,0
an saindang intensyon iyo na magkaigwa sinda nin sarong konstitusyon sa irarom nin paggogobyerno ninda mansana,0
igwa ining sukol na kilometro kwadrado na kadagaan asin namumugtak sa inot na distrito,0
sa lusatan sa habagatan yaon an isla nin el fraile asin medyo sa luwas kan daratangan kaini pasiring sur iyo an isla nin carabao,0
kun labon mas maray sa koron ta an paglabon kaipuhan asinan na magnamit nararaot an pundidong kaldero kan asin,0
siya man an ina ninda labaw dongon humadapnon asin dumalapdap,0
an saiyang tugang na lalaki naagom ni catherine charlotte de la gardie asin kan bayawon ni hedvig taube,0
siya an enot na premyado kan enot na famas hall of fame bilang pinakamahusay na aktor kan taon,0
si delas alas saro man sa mga tagapagpamidbid na komedyante sa pinakabagong komedya an sunday pinasaya kaiba sina marian rivera asin an magkaparehang komedyante na sina jose manalo asin wally bayola,0
buahaon ka talaga maski nuaren jah,1
sa lokal igwa nin halos sarong dosenang partisipante kan anyos si kianni iyo an pinakanguhod asin saro sa duwang babae,0
an perthbased mineral commodities limited mrc na sarong kompanya nin pagmimina na nagpaplano na minahon an lugar dai inako an anuman na takod sa paggadan,0
orihinalmente an rawit mayong titulo,0
an pagbayad utang kan nasyun para sa naturang planta an nagin kasarosarong pinakadakulang obligasyon kaini digdi,0
an pwerle sa tataramon na anmatyerre o apwerle sa alyawarr sarong kublit na pangaran saro sa na piggamit tanganing maipaabot an mga subskripsyon o subgrupo sa sistema nin pagkaparyientes kan katutubong tawo kan katahawan na australya,0
an ronang bicol nagsapo nin sa raraot na mga eskwelahan na apektado an na kaakian nagkaklase,0
pinalmente an korte suprema sa desisyon kan division i kan mayo na ginuhit ni hon,0
hoy gari ka dangag,1
sinasabing si ayman alzawahiri sana an pamayo kan pangkinaban na organisasyon alqaeda an sinapawan nin milyon na papremyo,0
nababanga an calubian sa barangay,0
an toga gibo sa pranela asin an tunic sa irarom parati gibo sa linen,0
sya man an ilustrador sa librong ang diablo sa filipinas na ipigsurat ni isabelo de los reyes pati man kan saiya man mismong sadiring nobela na ang banal na aklat ng mga kumag,0
si george catlin uulyo desyembre sarong amerikanong pintor kagsurat asin parabyahe,0
nagluwas siya sa manlaenlaen na pelikula na pirming igwang aquatic themes asin bida sa a daughter of the gods na enot niyang pelikula bilang artista na nagluwas siyang huba sa hollywood production,0
an kahawakan kan pili nasirbing pasagi lumber asin gamit na maray sa pagtogdok nin harong asin ginigibo man na tabla sa kun anoanong konstruksyon,0
sa suminunod na taon saro pang pelikula an ginibo an isputnik vs,0
dae talaga ako nangingiturog punyeta,1
an palis sa ingles kan mga titulo na saklob nin kaldit boot sabihon mayong pagpalis mismo kan obra sa ingles na naiisihan,0
punyeta pagal na ako umasa,1
dae ta masasabing ako lang ta iba man baga daa si kaiba mo kang sarong aldaw,0
kan tinogdok niya an moshav kan merchavya nagayog sa saiyang desenyo,0
committee to review the us climate variability and predictability clivar project office national academies press p si curry nagretiro sa akademya kan sa edad na,0
si steven allan spielberg kbe omri cincinnati desyembre sarong amerikanong paragibong pelikula direktor prodyuser asin screenwriter,0
an obispo kan panahon na iyan iyo si obispo teopisto alberto,0
nanggana an saiyang american debut novel na gun dealers daughter nin na onrang penopen book,0
pasobra ta pasluon ka,0
an sadiri kaining poblacion an sentro kan komersiyo sa banwaan,0
ikakadagit pa kang multo kampusanto mas takot akong mawara ka,0
mga an idinistribwir sa alang na mga nasyon,0
sa namit an ngutaon na ini masarosakrot asin maharohaldat sa dila ta an mga ingredyente may darang kagat sa pagnamit,0
unity man giray mga dangag haha,1
nagbukas pelikula na nakua an numero unong pwesto sa box office asin nangagin pangarogan sa popular na kultura,0
an provincia ipinagaran sa pinakadakolang isla kaini,0
igwa ining sukol na kilometro kwadrado na kadagaan asin namumugtak sa inot na distrito,0
an katagang kalamanthana minabaybay na kalmantan asin pigayos ini kan mga katutubong tawo sa klemantan,0
an amerikanang parakanta na si lady gaga nagpaluwas nin tolong video albums asin nakaluwas sa trentang mga music video,0
salag ba saimong harong saday bubuyog an elepante naghapot,0
nakapirang gago palaa ako huhu,1
sarong distinkto na karakter nin likidong istado an surface tension na minaresulta sa wetting na penomena,0
igwa ining sukol na kilometro kwadrado na kadagaan asin namumugtak sa inot na distrito,0
sa surat na ini na ikinaag niya sa saiyang kompyuter nagtogon siyang suloon na magin abo an saiyang bangkay,0
putangina ka edi jan kana,1
yati haha nalilibong na ako pakyu pre,1
pero madalion lalo malowbatt haha bwiset,1
an editor pinili an nellie bly sunod sa karakter sa popular na kanta na tmay titulong nelly bly ni stephen foster,0
nasunudan pa ini nin tolo pang pelikula kun sain si santos man giraray an darna,0
sa mga luto an mga dahon kan romero pigsosoksok bilang pangnamit sa mga kakanon arog kan roast lamb pork manok asin pabo,0
an tinanom na ini maray magtalubo sa hararom na daga na mayaman sa organikong pataba asin natubang sa mga bakilid ta suno ninda an maray na bulos kan tubig,0
si eder namundag asin nagdakula sa milwaukee wisconsin,0
siya binabansagan man na hade kan rock and roll o simple komo hade,0
pagkagadan kan saiyang ama nagbalyo sya kaiba an saiyang amaon na si mvelase mdluli sa palasyo sa ludzidzi sa ezulin valley sentral swaziland,0
punyeta dai ko na mabukasan su saro kong account patalon ka kaya beh dineactivate pa puta,1
puta urag mo man nagseselos ka pero bako na dahil sa kaiwal mo dahil na sa tigliligawan nindo kang kaiwal mo haha,1
base sa kapangaranan kan librong ini an mga naenot na mga tagasunod kan pundador na si joseph smith jr iyo an pinagapod na mga mormons asin an saindang pagtubod pinagapod na mormonismo,0
hanggan ngunyan an programang ini pasige,0
an mga minasunod an kompletong pilmograpiya kan aktres komedyante parasurat producer asin parasurat nin dula na si tina fey,0
an enot na pagkapurisaw na ini nakaabot pasolnopan sa laog nin nagkapirang aldaw inot na sinaliot kan mga eroplano an sistema nin paglayag na kilometros sa timog sulnupan nin yap,0
kun manlainlain an tataramon papano mapipirit an sarong ortograpiya,0
siya an ikatolong henerasyon kan pamilya manalo na namomoon sa simbahan sunod sa saiyang ama na si erao g manalo asin lolohon na si felix y manalo,0
tagal kan refund sako edi sana binakal ko na ito ki papel bwiset magka lbm ka sana,1
gibo kaini si bolivar iyo an saro sa nagturuwang na matogdas an enot na kaburunyogan nin mga independenienteng nasyon sa latin amerika na pigngaranan gran colombia,0
