sentence,profane
good morning danceracha huhu pogion kamo gago pakyu,1
si ronald allan kelley poe httpwwwimdbcomnamenmbio agosto desyembre mas bisto sa pangaran na fernando poe jr,0
tangina maray sana tapos na ang second semester shit makaka trabaho na giray ako namiss ko mag work so much,1
an mga tugang ni josefa iyo sina florencio luisa elvira rosario purita asin eufrocina,0
nakabilang sa sentro nin arte asin kultura ini nakabuo nin dakulang industriya sa turismo,0
tarantado ka talaga sophia,1
nagiisog an panahon dinugangan niya an mga basa niya sa walo sa lambang tagbo asin ta ini nagdara nin malaen na epekto sa saiyang buhaybagsik,0
may mga pagkakaiba an mga diyalekto pero bako man na labis na igwa pang na pagkasinabotan,0
an rawit na ini nagi man nin titulo kan saiyang saro pang libro pinagrok mga piling rawitdawit ateneo de naga university press c asin ini nagkaigwa pa nin animated adapatation,0
an sinisismong ini iyo an nagtaong rason tanganing magdistansya sa mga tawong muyang magkaigwa nin koneksyon saiya,0
meliton ignacio asin jacinto ursua,0
nagiimplementar man sinda nin mga ley sa sa inihinyeriyang pangkapalibotan arug kan pagadal sa impak nin mga gigibuhon pa sanang mga proyekto sa kapalibotan,0
putangina ka talaga eh,1
sa pagbababa asin pagkahulog kan romanong emperyo sa sulnupang an papasya nagin sarong politikal na parakawat enot na nahiling ki papa leo na diplomatikong pakikibagay sa mga huns asin vandals,0
dangan pinirit sindang maglakaw sana haleng libmanan pasiring nueva caceres,0
kan dai pa naguerra an korona ni ina sinasabing may mga tampok na diamanteng nagkakahalagang php,0
sa dikit na panahon siya nagtrabaho ki karl doflein sa berlin asin poon abot sa opisina sa munisipyo dapit sa konstruksyon kan charlottenburg na sarong independienteng syudad hanggan,0
an chromolaena odorata o kun sa bikol inaaapod ining lagonoy sarong ttopikal asin pangirarom na tropikal na espesye nin namumurak na palumpong sa pamilya nin mirasol,0
makulugon na ang alintak ko pero dae pa ako ipirot puta man,1
siya an pinakamatuang aki kan magagom na si dating primer ministro kan pakistan si zulfikar ali bhutto asin si mrs,0
huli sa manlainlain na pagpakarhay asin pagbabagong ginibo sa simbahan sa mga nakalihis na taon asin sa kawran nin plano sa pagpangataman nasanglian na an ibang parte kan simbahan asin nawar an historikal asin kultural na kahalagahan kaini,0
igwang natatadang na aldaw sagkod kan katapusan nin taon,0
dangan nagin siyang dekano sa centro escolar conservatory of music,0
pagatubang miembros kan media sinabi kan jefe kan ltfrb bicol iguang total por ciento hale gabos klase nin pampasajerong vehiculo rehiyon,0
nagtrabaho siya bilang mensahero sa lokal na padi nin castilian,0
an gamot nagagamit na pampapugol pagariya o pagbugris,0
nagsurat man si westwood asin nagin coawtor kan mga libro arog kan fashion in art the second empire and impressionism ina kun saen tinukar niya an koneksyon kan moda asin arte,0
an resulta kan mga pagbabagong ini posibleng marhay na magparikas sa padagos na pagkapara,0
sa enot pigsasayod an tanggomo arog kan pagbabasa nin rawitdawit na mayong kaibang sarong kagamitan,0
si warmbier nagadan kan hunyo anom na aldaw kan siya ibinalik sa estados unidos,0
hugakunon talaga ako puta may quiz palan kami ngonyan,1
si monson agom ni frances beverly johnson monson asin sinda may tolong aki,0
kaya kan nobyembre naglayag siya haleng san francisco paagi honolulu diretso pamanila kun saen nasabat niya an sarong bagyo,0
siya nagadal sa unibersidad nin santo tomas asin sinuportahan ni padre sabater,0
naggikan sa kapinunan an mga kristiyano iyo an subheto kan persekusyon,0
sa laog nin mga distrito an mga opisina kan pagkasaserdoteng melchizek sa laog kan indibidwal na mga branches pinagpapayuhan kan branch president pero pinaghihiling kan district president sa irarom kan direksyon kan presidente kan mission,0
an enot niyang gabinete inoyonan kan asamblea nasyunal asin siya nagsumpa kan mayo,0
siguro dae inaki ni mama wara gayod maitsura pamilya mi,0
grabe madali ko nang imine pucha malapit ko nang imine pucha,1
an mga oportunidad nin negosyo kan jakarta na iyo man an potesyal na matao nin halangkaw na estandarte kan pagbuhay nagaakit nin mga migrante gikan sa bilog na kaiislahang indones na pinaghalong dakol na mga komunidad asin mga kultura,0
sa kadagdagan si dod naglaban sa manlaen laen sa isports kabali na diyan an golf field hockey asin archery,0
tinuturuan tayo ng mga tulang ito na makipagtitigan sa mga labi gaano man karahas gaano man kalala ng pinsala gaano man karumaldumal ang makita walang nalalabi kundi labi,0
an alternatibong pangaran kaito iyo an iau bakong parehas sa tataramon na iau mantembu mora turu asin yapanani,0
parati duwang aki an nakawat kaini na an gana iyo idtong enot nakaubos kan taya,0
si charlie puth nakipagtabangan ki gomez sa we dont talk anymore,0
exciting part patalon man ini si lexie habong mag tubod na tig gagamit man sana siya ni david,1
pigganap an kantaon na home sweet home kan koloratura soprano na si amelita gallicurci,0
an lisboa pinatutukaw an magkapirang ahensya kan bunyog europa an european maritime safety agency emsa asin an european monitoring centre for drugs and drugs addictionemcdda,0
tatawan kaining duon idtong mga bagyo na nagin dakulang kabtang kan satuyang kasaysayan asin nakaapekto sa pagtalubo kan ekonomiya,0
yudeputa tapos ko na imop ang bilog na harong may gibuhon na namang bago,1
maray pa so aki crush aku,0
kauragon ka hayop haha,1
igwa ining sukol na kilometro kwadrado na kadagaan asin namumugtak sa inot na distrito,0
apwera makinaryang pan agrikultura para grupos nin paraoma camarines sur nagin ayuda man kan opisina ni presidente bongbong marcos nagkapirang organisasyon nin parasira probinsya an nagkapirang units nin motorized baroto fingerlings asin iba ekipahes pansira pormal pigresibe an ini kan resipyentes kan nakalihis biyernes ika kan hunyo luwas kan kafuerte sports palace cadlan pili camarines sur,0
dangan siya nanombrahan sa magkapirang posisyon sa gobyerno ni chavez asta ginibong ministrong panluwas kan,0
bumalik kana sako lintian,1
garo mga patal wara pa ngani nag rrate na tulos,1
an tirana manunumpungan sa sentro nin is located in the albania asin napapalibutan nin kabundukan asin hills na dajt sa subangan asin lambak sa norteng sulnopan na mahihiling an adriatic sea sa harayo,0
kan hunyo inanunsyar kan cube entertainment an pagsuruwayan kang grupo na minute,0
harus nin mga hidrokarburo iyo mayong kulay asin hidropobiko hydrophobic na igwa sana nin maluyang parong,0
putangina nindo ang pogi sisay an,1
siya dae na nagestar sa nauvoo asin nagsirbe sa sarong lokal na pamayuhanan kan simbahan sa pittsburgh pennsylvania,0
huli kan pagbistong ini nagin iskolar kan ateneo de manila university si remoto,0
ini gabos isinaysay ni gng,0
dawa malipot lipot uso man mangarigos,0
an siring na mga insidente bunga kan hararani an nagboborokbokan asin ta ini daa komun na gayo kan enot asin ikaduwang gerang pankinaban kun saen an mga tropa nagdadalusoan asin an pagasinta bako pang nalalagartong gayo,0
an sukol kaini kabang sa sukol kan bicol mail,0
puta ta na ground ako haha bobo,1
gayunpaman nasa mata kan naghihiling an grasiya asin an sadiring katangian asin sa bilog na historiya kadakol na mga alamat an naiwarak manongod sa mga bukid sa bilog na rehiyon kinki,0
haha bwiset na yan,1
tangina mo dae puta ka pag ako nasisi,1
patanaw nin paghiling sa chungking mansions,0
saro ini sa mga primero nyang istorya kun sain yaon an saro sa mga miembros kan glass family,0
agnes kan hunyo sa pagpapalakaw ni sr,0
an paha sarng kasulotan sa hawak,0
si carl ng namundag marso sarong aktor asin modelo na taga hongkong,0
makagulo gulo ka ning maray nono,0
siya siguro an pinakaimportanteng boses sa pagheras kan ideya nin malay na lahi o nasyun na dae limitado sa etnikong malay kundi kaiba an mga tawo sa dakula pero dae ispesipikong parte kan sursubangang asya na arkipelago,0
si zanagee artis namundag o sarong amerikanong aktibista sa klima,0
ini man puwedeng ibanan nin disosasyon kan molekular na takod maski ngani an prosesong ini iyo risang iba sa mga prosesong kimial nin interaksyon kan mga likido o sa paguugali kan pigtaong ion sa mga metal,0
patal talaga kamo si leni na ang ipalead the prayer,1
mga putangina nindo masyado,1
inaapod na paroy ini kun tinanom o an bunga an tinotomoy bagas kun namolino na asin maluto kun sinapna na alagad an sarosarong maluto inaapod na hima,0
kapag kinasal limang orig bangot pansit,0
ini iyo nagin most viewed debut music video sa sarong kpop na grupo,0
asin dating terminong konsehal sa enot na distrito kan siyudad,0
punyeta ka bulay adjust ki sleeping sched lence at five oclock don ako nagkaturog pa,1
nagin matrayumpo an selebrasyon kan ika taon na anibersaryo kan parasurat bikolnon inc sa pangengenot kan presidenteng si buboy aguay asin pinagpartisiparan man kan mga minasurunod na mga miyembro na sinda marissa redburn irvin sto,0
huli kaini an asido nitriko iyo an sanghiran kun baga an sarong metal tunay na bulawan,0
pakyu na sana gayod,1
nagtapos siyang sekundarya sa siyudad nin quezon asin nagkua siyang adal sa pagluto culinary arts sa center for asian culinary studies sa san juan metro manila,0
an kabesera niya iyo an syudad nin cebu an pinakagurang na syudad sa filipinas na nabilog kan inaapod na cebu metropolitan area kasararo an mga kadolon carcar city danao city lapulapu city mandaue city bogo asin talisay,0
gago jhope na naman kahuron ko tas nakahuron niya man su ex kan saro haha,1
kun magluwas an siring na mga sintomas haros daing liban an pagkagadan kan biktimang naulakitan,0
inot man syang lady of fiji puon sagkod bilang agom ni ratu epeli naitikau an presidente kan fiji,0
ay hayop na gayon kan nag butwa naman para kay nasu na kidnap su piday,1
gago hayop ka ig educate din kita na tarantado ka mga binalon ta raot na alangan itao mo pa nya raot na,1
an asayti pinuga sa burak napapakinabangan kan industriya nin kakanon,0
siya an first successful black woman novelist na nkaistar sa britain pakatapos kan,0
sorry cancelled guna pakshet sinda haha,1
warang pinagkaiba alak buda lalake parehas makulog payo,0
pinaluwas niya an saiyang debut album titulado kan pangaran niya mismo pagkasunod na taon,0
an sawa pwede man magtimbang kg libra pero parati natimbang ining abot kg abot na libra,0
an dwop mhz nasaere bilang boom fm sarong barita and tugtugon na fm na estasyon nin radyo na kagsadiri kan sol broadcasting sarong firm na pagsasadiri kan multiawarded broadcaster sonia o leano,0
pakaparatos na matilaba pero bilogon an hitsura dinudupil an duwang pinatos asin binubugkos sa tig aporo,0
asa ka pa kupal habo kan diyos sa dangag baka agawan pa siya ki pwesto ika ba su nag sign of the cross sa stage ng rally ni santa leni,1
tuguti na an lengguwahe kan librong ini an magtaram para sa sadire,0
an kahoy na ini nabunga sa bulan na marsoabril asin sa bulan na oktobre,0
kadtong mayo an pagraralabanan dangan pagrerebolusyon na pinunan kan kontrahan sa tanga kan mga elemento nin militar an naging sanhi kan dakulang pinsala sa syudad dangan uminabot sa interbensyong militar na ibalik an kaayusan,0
patal pantalon tudo dalagan,1
wara na alam na nindong medyo pasaway ako,1
kauragon puta dae ako maka focus maribukon kamo haha,1
tungagon ba an avarest,1
kan an mga kastila may dinarakop na mga rebolusyonaryo nakadamay an saiyang ama na si antonio arejola asin an saiyang tugang si ludovico,0
igwa ining sukol na kilometro kwadrado na kadagaan asin namumugtak sa inot na distrito,0
si entisar elsaeed o entessar elsaeed sarong tagaehiptong aktibista para sa mga deretsos kan babayi dangan pamayo asin direktor man kan cairo foundation para sa pagpapatalubo asin batas,0
tahaw kan dakulang tabang economia an turismo padagos sustenido kan local gobierno kan banwaan ini an programa dapit turismo arte asin cultura,0
an general santos city sa may kosa kan sola nin sarangani iyo an pinakadakula asin pinakaimportanteng syudad kan south cotabato asin mayor na pwerto,0
siya an nagdesinyo nin mga american sportswear,0
si gertrud virginia adelborg setyembre sa karlskrona enero sarong paratukdong sueco feminista asin pangenot na miembro kan mobimyentong deretsos kan mga babae,0
korteng obal an sarong sadit kaini asin an kapal nasa cm cm an laba asin cm an lakbang,0
lintian dae baga kita nagkakabata,1
maigot an urulay dapit sa anoman na papel kahulogan asin motibasyon kan pagsasaray nin pinugot na payo,0
may karma man na maabot saimo patal,1
an prutas kan lemonsito nakaagid sa sadit matabilog na lima parati mm an diametro dawa totoo naabot sa mm,0
dai pang sarong taon nakadulag siya sa elba asin nakabalik sa poder pero nadaog siya sa batalya nin waterloo kan hunyo,0
sabi ni wolfenden mga menor asin saradit na dyalektong masbatenyo an yaon sa islang ticao,0
kapag nauuyam partner suyoon bako itong kapag nauuyam sya nauuyam kaman lintian ka,1
hinayupak ka arturo makabwiseton kang pakshet ka,1
si lafayette dakula man an papel sa rebolusyon pranses kan asin sa inapod na hulyong rebolusyon kan,0
puta nata may bata si crush ko maray na sana ang aga ay bako pangako,1
an pinakamarhay na paagi tangarig malikayan an reaksyong alerhiya iyo an pagkaaram sa mga kakanon na ikokonsumo,0
nuebeotso porsiyento kan nageerok sa rizal mga parataram nin malaweg asin bistado an munisipalidad sa an pinakaenot na munisipalidad kan malaweg,0
bugay over the bakod man giraray pagpaluwas,1
igwang natatadang na aldaw sagkod kan katapusan nin taon,0
an inot na agom ni tapang na sarong comradeatarms nagadan kaiba an saiyang grupo sa sarong enkwentro sa candaba,0
siya kinakatakotan nanggad sa kinaban nin salamangka asin binabansagan na siya na dai dapat mangaranan o siya na iyan,0
puta gare gingham check realness talaga,1
an komunidad internasyunal nagreparo na ki comneci,0
siya nagestar duman poon mayo sundo,0
nakakapagulakit an mga birus sa gabos na klase nin pormangbuhay hale sa hayop asin tinanom hasta sa mga mikroorganismo kaiba an mga bakterya asin arkeya,0
pucha pag dakulon na crush ako tulos,1
nababanga an san fabian sa barangay,0
dae na mag mag myday punyeta dae mo man sana mahihiling,1
ini ngonyan an ikatolong pinakahalangkaw na torre asin an ikalimang pinakahalangkaw na nagtitindogsasadiri niyang estruktura sa bilog na kinaban,0
namundag si lucie pinson kan sa nantes,0
an teoretikal na gastronomiya iyo minasuporta sa praktikal na gastronomiya,0
siya an representative kan gyeonggi province sa miss korea beauty pageant kan dangan naghanap nin trabaho bilang aktres,0
igdi niya kinua an apelhyido niya,0
pagkatapos kan seremonya an mga simpleng meryenda pigtatao sa mga batang nagiba sa debosyon,0
an atomo iyo pigbibilog nin positibongkargadong nukleyus na may urap nin negatibongkargadong elektron na nakapalibot saiya asin iyo pinagsasaro nin elektroistatikong pwersa,0
tita hilinga aki haloy haluyon magreply sabihi an,0
halat palitan ko bio ko mga pakshit kamo,1
eva macaraeg kan pangasinan asin may apat siyang aki igdi si cielo,0
sa tol kan minasunod na tolng dekada kan siya nagbisita sa sulu nagadal siya nin kulturang muslim kan sur na parte kan filipinas particularly in the sulu archipelago,0
igwa pang salong na nalibot sa habayan ngane dai maghulog an koteka,0
palibhasa kadakulan kan saiyang pinintura hinakot pabalik sa lebanon an mga obra niya asin an tagom kaini daing gayo nareparo sa solnopan,0
sabi pa niya kan kun ika naggigibo nin mga ilegal na aktibidad sa sakong siyudad sagkod na ako an alkalde ika lehitimong target nin asasinasyon,0
gago narumduman ko na naman su message ko kay shaiman putangina haha sorry na ngane,1
piggagamit ini primero bilang sarong prekursor sa paghimo nin mga kimikal na may mas komplikadong istraktura arug kan ethylbenzene sagkod cumene kun sain bilyon na kilogramo an nagigibo kada taon,0
sarong bagay saiya na kaomawomaw iyo ta kan piskal siya gabos na kaso nagagi saiya natapos na maray an resulta mala ta gabos nasentensyahan,0
yudeputa ka talaga kiana haha,1
sa ibang pagkakataon an regular na pakasurunod minapadagos na daing untok o putol siring sa mga dyamante kun sain an lambang sarong dyamante saro sanang kristal,0
an tataramon na tuwali sarng natibong tataramon na katutub sa ifugao,0
gikan an pangaran kan probinsiya sa sinobietnames na boot sabihon sa sur kan salog,0
an mga tribu asin an ibang mga filipino harale pa sa ibang lugar medyo nagraramas na asin maski ndara pa ninda an pamanang kultrura may timbre na an saindang buhay nin masabing mindanawon na kostumbre,0
bago magbalik ulit sa bahrain nagkua siya nin sarong semester sa university of santo tomas sa manila,0
nanggana man siya sa british ladies amateur golf championship duwang beses sa england womens national field hockey team asin nanggana nin silver medal kan summer olympics sa archery,0
igwa ining sukol nin kilometro kwadrado kadagaan asin namumugtak sa ikaapat na distrito,0
tarantado ka palan ang pinaghuhurunan su ngonyan saro kang bua buda kanbangag tangina mo dae ka dapat iespeto ta salot kamo sa banwa,1
dae ka magpasensiya sakuya pasensiya ka sadiri ta ika man nagpasupog sadiri mong patal ka,1
pucha may plano na mag outing pero su pagcocommute pangiton,1
alagad huli ta siya sarong katolikong serrado nagin siyang maigot na myembro sa mga organisasyon kan simbahan arog kan penafrancia association asin kan catholic womens league kun saen pareho siya igdi nagin presidente,0
nakalaog siya bilang senador sa ika na kongreso kan asin kan ika kongreso kan,0
tangina kan kupal na ito guna mo gwapo magayon takot nganeng magkaag ki pandok,1
maezawa ysaku namundag nobyembre sarong hapon na entrepreneur asin parakolekta nin mga kontemporaryong arte,0
bako ka man natong pero lintias iba saemong gatol,1
an nobela magayagayang inako kan publiko asin ini sikat pa sa ngunyan bialng sarong nobelang pangaki ni man nagibuhan na nin mga pelikula,0
haros mga apat na pulong species an mga lumod,0
bobo haha buahon ka doc,1
kabaligtaran sa baybayong borneo na kadaklan pigeerokan kan mga etnikong malayo dangan banjares madudugangan an mga grupong dayak sa probinsiya nin kalimantan,0
nababanga an calayan sa barangay,0
mas masiram daa kun ini pahaponan ta lataw na an hamis saka nagsasarosagitsit pa pagkinalokago,0
sinda sayod man na tataong magawit kan mga maririkas nagoroolaptik na togtog kan mga kantang espanyol arog kan rancho grande besa me mucho quien sera el buro su carbon solamente eres tu asin la ultimo noche,0
kun mayo an siyang mga imbensyon sa pagkakan ribong katawohan an pigsasabing magagadan sa mga intermentong kampo ospital asin sa mga kalye,0
halawig na mga taon si fonda sige an pagballet ngani esterado pormado an hawak kundi kan nabari niya an saiyang bitis durante kan nagpepelikula kan the china syndrome dai na siya nakakapartisipar,0
an halaga kaini iyo an bunga niyang berde na matilaba mapanas saka napatos sa mga pisogpisog kaini,0
sinasabing dai man nagpaluwas nin mga takal na moneda an hapon gibo kan maipo an mga metal,0
nata ika sana bahala kaan ta dae m man san palan padangat,0
an duwang iba pang mga tawong interesado babaye,0
an saditon na kantidad nin asidong sulpuriko sagkod minsan iyo asidong posporiko iyo harus ginagamit pirmi bilang kataliko,0
an lehitimong bukid nin madiaas nagin kabtang kan kultura kasaysayan asin literatura ni antiqueo,0
si rachael heyhoe flint baroness heyhoe flint obe dl ne heyhoe hunyo enero sarong ingles na cricketer negosyante asin pilantropo,0
puro ka tuga na patal ka,1
an marker na itinao kan kaidto philippine historical research and markers committee ngunyan national historical commission taon bilang paggirumdom sa mga agiagi kan parokya asin bilang pagbisto sa kultural asin historikal na halaga kan simbahan,0
si kant an nagdepinir nin panliwanagan sa saro niyang ensayo na huli ta para saiya dapat libre an tawo na makaisip nin sadiri asin dapat warang nagpopogol na autoridad sa luwas,0
si winton nagadan kan umagahon nin hulyo sa edad na sa wexham hospital sa slough huli sa respiratoryong pagaberiya,0
nagluwas siya sa pangenot na kobre kan mega magazine na isyung pang marso,0
tangina swerte ang magiging bata kaini sa future puta swerte ko,1
si diego guevara osa baeza espanya,0
nagsusunod man sya sa sarong modernong estilo nin arte,0
an saiyang ama nagadan kan,0
the historical and cultural heritage of the bikol people,0
kan an magasin na briton new statesman piglista siya bilang ika sa an pinakamaimpluensyang mga tawo sa kinaban,0
si mccardell an matua sa apat na aki ni eleanor asin adrian mccardell safrederick maryland,0
hi po tbh nabubua na po ako saimo,1
pigtutukdo na an huchi na boot sabihon gurang na babaye asin ape na an taramon para sa kalayo ape huchi kamuy bilan an kagurangnan kan kalayo,0
tinogdok ini haros gabos kan mga taon,0
an ikaapat na kabtang kan libro iyo an mga desenyo para sa grotto mga hardin asin mga kamalig,0
tinutuka kaining mga pagkakan iyo an mga bagas mga pisog mga prutas asin mga tinanom,0
putangina niyo magayunon bye puta,1
nagadal siyang elementarya sa cavite asin binondo manila,0
ang mga primerong eskwelahan sa nueva caceres ay nabukasan sa paagi kan mga amerikanong paratukdo na mas bistado bilang thomasites,0
an bagong single sa album na clich ipinaluwas kan marso,0
alagad kan agosto sa pwersa kan akta republika binago an pangaran,0
an barmm nababanga sa na probinsya,0
di ko na kaya maglaro nito bobo ako,1
siya an kagsadiri kan programa sa adiksion kan mga teen challenge asin kagsadiri pastor kan nondenominational times square church sa syudad nin new york,0
tangina tamed dashed dae ko na ikaraya pakshet kamo,1
hayop pakitapok sa outerspace,1
sako kana sana tangina,1
pinapanginotan kan presidente an sangay kan gobyerno pangehekutibo asin siya iyo an pamayong komandante kan armadong kusog kan filipinas,0
an komunismo sarong ideolohiya na nagmamawot nin sarong sosyodad na mayong estado asin mayong tanggatanggang dibisyon sa kabuhayan,0
kaso dangagon su subject,1
ikaapat siya sa mga filipino na nakakua kan korona kasunod ninda gemma cruz kan aurora pijuan kan asin melanie marquez kan,0
si loida nicolas lewis namundag sarong filipinoamerikanong negosyante pilantropo lider sibiko autor parataram parasurat asin abogado,0
an kabesera asin pinakadakulang siyudad kaini iyo an barcelona an ikaduwang pinakadakul sa populasyon na munisipalidad sa enterong espanya,0
halat kaya gago gari hininghingan kalag ko,1
an suplay nin tubig sa banwaan hale sa sistemang patubig kan pili water district piwad,0
mainiton ang payo ko puta,1
ulol tangina nindo binayaan nindo ako,1
an video pigsangat kan abril asin pwede pa ngane ngonyan madalan,0
kan septyembre an aki na babayi ni macapagal an dating presidente gloria macapagalarroyo pinaginaguraran an president diosdado macapagal museum asin library na makukua sa saiyang istaran sa lubao pampanga,0
dae bwiset ining tugang ko,1
kan taon sarong naglilibot na hipnotista nagngangaran hart naisihan na siya dai na nakakataram asin inalok si cayce na bulongon,0
pakatapos kani nagdiretso siyang london kun saen nagkua siyang subspecialty training sa optalmolohiya sa western eye hospital,0
si hayat mirshad namundag sarong lebanese na feminista journalista aktibista asin saro sa nagtindog kan nonprofit feminist collective na female,0
an mga kristiyano naniniwala na an ikaduwang pagabot ni kristo mangyayari sa katapusan nin panahon,0
nagtutok siya sa moda kan an sarong parabakal sabloomingdales nagtaong suhestiyon na labaan an blusa na pinadara saiya hali sa pilipinas,0
sa patal na gigiray ako,1
hayp arog palan kaito naghanap pa akong toothpick,1
digdi bicol makakanos ngani lalaki maururag pa mang babaye,0
feeling ko kinarawan sana kami kan mga photographers na an hayop sinda gabos may kulog ki boot,1
mas maluya ini sa sisi asin an pagdugo kun igwa man bakong grabe,0
an koprasan sarong klase nin paltok na pigbabalahan nin laman kan niyog,0
binuksan sa publiko an pagak nin mga partisipante kun sain kagduwang katood na mga parasurat o fellows an napil para tulongaldaw na hunglonan sa rawitdawit rawitdawit panak halpot na usipon asin usipon na panak,0
sarong milagro na naulian pa siya,0
sisay dangag nag pauto,1
siya kinoronahan bilang miss peru universe ni miss peru universe lola sabogal morzn,0
digdi niya inadalan an kasaysayan community development asin man public administration,0
dae ko na ata kakayanon an next episode makulugon pucha,1
an enot na agm ni antonio iy si ester mejillano asn an pagsasar nind nagbnga nin anom aki sind teresita anita gregorio sr barazel santos asn rafael,0
hilngon sa doktrina asin mga tipan nin huli sa banal na pagsugo tanganing mapoonan an pagsalin kan bagong tipan,0
arog kaining panahon garu dudusong brown out,0
nababanga an palawan sa banwaan asin ciudad,0
nagtukaw siyang alkalde sa naga kan enero,0
mas kaya makahiling ning maligno,0
an vocalist uminabot sa posisyong numerouno sa oricon weekly album charts na nagin saiyang numerounong album sa taon asin bulan,0
mahibi talaga akong tangina nindo,1
mantinido ining ginagamit sa manlainlaing instrumento asin eksperimentong pang,0
may hiwas ining ektarya asin an namamayo digdi iyo an pamayuhan kan intramuros ia na namokna sa paagi nin presidential decree no,0
habo ko na maki iwal sa patal putangina mo sobrang patal mo sa part na an,1
ini kinakakan asin linuluto sa ibaibang paagi,0
ginaba man kaiyan an dinosenang baroto nin paninira asin ginaba an mga kahoy,0
si jaime nonell saro pang jesuitang iskolar nagsurat nin halipot na treatise sa mga obserbasyon na ini asin pigimprenta sa diario de manila,0
an sagid kan tagiti nagigin masulog na salog,0
sa pirang kulturang pantawo an sistemang pagsurat iyo dae piggamit hasta sa ika na siglo asin sa pipira dae pa nanggad hasta sa ngunyan,0
duwa an panahon sa nasyon an tiguran na panahon asin an tig init segun sa kadakolan nin uran,0
nagtapos siya sa kurso sa pagsurat kan thesis niyang study on plywood consumption in final consumption in surakarta municipality,0
