sentence,profane
cruz an hanapbuhay iyo an paggibo nin mga bayong asin abaniko gibo hale sa bulos o anahaw,0
tangina tulo pa napasako dae ko na kaya pakshet,1
binayaan kan pamilya kaito pakshet ka soren marauton kang tawo,1
sunod kaini sa eleksyon kan napili naman siyang magtukaw sa shadow cabinet asin itinalaga saiya an pagasikaso kan populasyon asin imigrasyon,0
tamang tama su brownout mauran uran kurupuan naman kaan,0
pwedeng igwa man ining kuwarsong nakalaag arog kan nainot na tulang o pwede man na saro ining pangkapot,0
daog ka sana nakaabot si patal,1
pigalok ni layne na marhay pa daa logod na an abilidad ni cacyeng ini itangro niyanng serbisyo sa publiko asin kan enot nangutiil siya alagad sa huri nagtugot siya basta libre ini para sa naghahagad kan serbisyo niya,0
kabali sa festival an mga karosang pigsamnohan nin mga burak asin pagsayaw sa dalan,0
ew tangina mo ka,1
kan opisyal niyang rinibayan an saiyang ngaran na kim minsun naging kim gyuri,0
igwa sindang walong aki vicent reynaldo myrna greta eugenio yolanda armie asin barbie httpsluisgdato,0
dgdi sa bicol kapag mahigos ka dadagdagan ang trabaho mo,0
cambridge harvard university press,0
an pagtubod niya mayo nin pagkapantay an mga lahi asin ta an lahing superior iyo an dapat mangimbabaw susog sa eternal na pagboboot kan natural na pagkarinsay kan uniberso,0
hinuhuna na an mga boklod nagbibilang poon na pwede umabot sa,0
sabi ko pa naman makaogmahon magstan ng wayv ta walang military service ang members pero puta haha,1
si katharine igwang pirit na relasyon sa saiyang ina,0
pareho kamong toxic ulol mag ama ngane kamo,1
sa parehong taon siya itinalaga bilang un women goodwill ambassador sain nagtabang na mailunsad an kampanya kan un women na heforshe na nagaapod sa gabos na kalalakihan na magadbokasiya para sa pagkakapantaypantay kan sekswalidad,0
an kaktus sarong pananom na kaibahan sa pamilya kan cactaceae,0
nag huron kamo kan ate mo sa port tas gari kamo patal haha,1
putangina nindo igagaibo ko na ang gabos tapos sasabihan lang nindo akong warang modo porke sinabe kong pagal na ako,1
kapag nakahiling ka ki duwang babaeng magtugang tandaan pinaka sadayot dyan iyo ate,0
nagluwas man siya sa mga serye nin telebisyon arog kan children of the th century asin one spring night,0
an alkalde kan lisboa ngonyan iyo si alfonso costa elegido kan partido sosyalista asin an kapyestahan kaini natama sa hunyo aldaw ni san antonio,0
pakatapos si madonna nagpirma sa pinakaenot na kontratang solong kanta sa sire an solong debut niya everybody pinaluwas kan oktobre asin ikaduwa burning up kan marso,0
an dakul na praktis iyo an pagkaag nin sarong putariya kun saen natitipon an mga pokpok asin dinudumanan kan mga naghahanap nin kaogmahan sa laman,0
nagtatrabaho an saiyang ama na si albert grimmie sa verizon communications kan,0
nagadan siya sa manila sa edad na,0
an islam nakaabot daa sa aceh kahadean nin fansur asin lamuri mga ad,0
an komunidad kan ward or branch puwedeng mageskedyul nin pansosyal na mga aktibidades sa harongmitingan kabali an pagsarayawan pamamanggi mga holiday party asin panmusikal na mga presentasyon,0
habo ko mag bukas ki fb punyeta puro piriday na sana nagluluwas sa timeline ko hayop,1
kinoronahan sya kaiba kan saiyang agom sa uppsala katedral kan,0
nagin writing fellow siya sa up national writers workshop kan asin iligan national writers workshop kan,0
nababanga an banate sa barangay,0
arog palan kaini feeling na igloloko buda pinagmumukhang tanga ka kan padaba mo,1
sagkod yaon pa an kinaban magkakaigwa nin panahon nin pagtanom asin pagani nin lipot asin init nin tiginit asin tiguran nin aldaw asin banggi,0
igwa ining sukol na kilometro kwadrado na kadagaan asin namumugtak sa solong distrito,0
kan taon nagin writer in residence sya sa ginibong ika international writing program sa university of iowa,0
mainiton naman maray kisay kasalan ini,0
haroskumulang ini nin kilometro milya nortepasur asin kilometro milya subanganpasulnupan,0
an polangui iyaon sa nortesirangan na kagapatan kan ikatolong distrito kan albay na igwang kadagaan sa hiwas na ektarya acres,0
wara talaga akong pake maski paghirilingon ako na naghihibi sa bus puta nahiling ko su igtutukawan mi ni ella sa moa,1
nagtao nin opinyon an duwang mga eksperto na an sihang o mandible sarong australyano sa pisikal na tipo asin pinakaharani an mga sukat nin kopyang bungo sa mga tawong ainu o tasmanyano,0
nagsirbe siya bilang house minority whip poon sundo,0
an sekreto sa agrikultura naggagamit nin kan populasyon na nagtatrabaho asin nagpoprodusir nin kan gdp kan,0
kan siya naging saro sa pinakamayamang babayi sa inglatera kan mamana niya an yaman kan saiyang lolo na nasa haros nasa miyon katumbas na kan sunod sa pagkagadan nin saiyang madrastang lola harriot mellon,0
nag ruluha ako pakshet,1
an mga nawawarang numero iyo an tambon na sa ngunyan minamukna kan distrito nin sila lat,0
mala ta siya solosolong namuhay harayo sa saiyang pamilya,0
paglaog sa basilica duman tinatapos an ikasiyam na nobenaryo asin may misang seniselebrar sa pagkabangging iyan,0
tangina igsasabe ko saindo ini an pinaka malalang kurab na namamati ko ngonyan,1
may class observations sa aga and here i am nagbabasa huhu punyeta tatapuson ko ini bago magkaturog hibi malala haha,1
imbis na sa tulay nin aioi mabagsak an bomba ini suminabog nin direkta sa shima hospital harani sa genbaku dome,0
an saiyang ngaran nangangahulogan na sarong magayon na daraga,0
luh pakyu ka may tinaram ako,1
sa filipinas usong gayo na an kinaros na abukado tinitimpla sa gatas asin asukar rinurunot asin rinaramas,0
alagad kan mga panahon na idto duman naaraman niya na siya palan may kabatiran sa paghula asin pagtood pero dai siya naghaloy sa lugar na idto ta naghanap nin trabaho,0
igwang natatadang na aldaw sagkod kan katapusan nin taon,0
nababanga an hilongos sa barangay,0
huli ta nababaya na sa makuring kompentensya sa industriya nin imprentahan an bagong pagrorogaring nagdugang nin offset sa dati nindang lumang letterpress ngani makadakop nin mas dakul na kustomer,0
ulol gago ka cornetto,1
ini enterong likos nin kadagaan,0
an mga amerikano pinatogdok liwat an mga eskwelahan asin mga tulay na nagkagaraba,0
nagagamit man ining materyales sa pagharong o sa muebles pero magisik asin madaling magsilak,0
huy yawa kaining nayeon pakshet,1
an ikog niya prominente asin sobra sa laba kan kahawakan,0
nagadan siya huli sa pneumonia sa singapore general hospital kan marso,0
hindi ko pag aaksayahan ng oras pagpapansin sa inyo mga ulol,1
dangan kan taon siya nagbutas na bilang editor asin nagsalida nang editor saiya iyo si nonong trivio aki ni juan trivio,0
ikinakaag kuta siya sa sarong harong amponan alagad mayong bakante,0
kun ini may tarayaan na ganahon na kwarta tinatawan halaga an bawat dyolin halimbawa dos pesos lambang dyolin,0
madudugangan an sumita sa sarng basin sa sursubangang prepekturang iwate sa sur na kabukidan kitakami na napapalibutan kan mga tuktok na nasa elebasyon na natatang sa dangan metro sa gabos na gilid,0
an haloy na pagtago o pagluto pwedeng magpababa nin kontentong bitamina c sa mga pagkakan,0
pira nang ribong tan nang inaatman an kanding huli ta pigkukuann in nin gatas karne kublt asn buhok,0
gari man ini patal,1
sa ingles apod pa kaini palaen kan purple yam greater yam guyana arrowroot tenmonths yam white yam winged yam o simpling yam,0
an tubig kan ibaba kan antarctik abw klase nin masa nin tubig sa timog na ocean na nakapalibot sa antarctica na may temperatura na nag iitok puon habanggan c f sustansia puon haggang psu,0
sa edad na siya nagin nang reporter asin sa edad na nagin nang editor nin peryodiko dangan sa edad na saro nang sayod na kagpublikar nin peryodiko,0
an bako gayong magayon na pribadong buhay ni monroe nagtao saiya nin dakulang atensyon,0
an raffles hotel iyo an saro sa pinakaenot na hotel sa siyudad nin singapore,0
parati ini nakukua na aripumpon maliban sana sa mga bulan na marso abot hulyo ta sinda yaon sa panahon nin pagsusugok,0
ulol wara kong pakiaram saimo,1
ini an rason kun napano ta naapod an kalye diyan na padian ngunyan kalye caceres na boot sabihon gibohan nin mga padi,0
si philip francis reazon bersabe fr philip francis r bersabe namundag sa bagumbayan sur ciudad nin naga kan septyembre,0
bobo kulang ki duwa,1
ini parati sa porma nin tukawan na may duwang nakagakot o nakatakod na halabang kahoy o kawayan asin pinapasan nin duwa o apat katawo,0
oh yan patal patalon ka bati,1
ipinangaki siya sa london dangan pagkatapos kan pagaadal sa islington amihanan na london asin heidelberg alemanya kinasal siya ki samuel orchart beeton sarong ambisyosong parapublikar asin paraliwat nin magasin,0
tolong estudyante man an nagadan sa busanga palawan pagkalamos sa sarong salog,0
putangina may lawa sa paril haha,1
sinasabing sa ibang parte kan aprika asin tangang subangan sarong klaseng tinanom an pinagaataman na an mayor na tuyo iyo an paggutol kan mga dahon asin ogbos kaini bilang pagkakan mantang an awat mayong importansya igdi,0
inuuyonan kita asin sinasabi an satong mga isyu sa sarong tingog,0
an kalibo iyo an aram nanggad na inaagihan kun mapasiring sa bantogkinaban na islang resort nin boracay paagi sa pantalan kan caticlan,0
nagkaigwa nin disturbance sa sulnopan na caroline islands asin nagpadagos sa laog nin duwang aldaw sagkud na iyan manutaran sa significant tropical weather advisory na pinaluwas kan joint typhoon warning center jtwc,0
an pwesto niya sa katongdan na ini nagabot,0
si house speaker ramon mitra jr igdi namundag,0
an saindang harong kaatubangan kan manila cathedral,0
igwa ining halangkaw na daybersidad na diyalektikal na kun saen naglalaog nin mga diyalektos kan ulu mamaq akit talang asin sakei,0
sya kagtulod kan adbokasiya para sa mga tawong nangangaipo nin espesyal na atensyon sa deretsos kan mga kaakian pagkasilag kan gobyerno asin dyurnalismo,0
pinulbaran ni roy na gadanon si colin,0
siya enot na nabantog sa saiyang librong kitchen confidential adventures in the culinary underbelly na saro sa pinakamabentang basahon kan taon,0
an kadaklan na lugar sa pilipinas maheheling an hababang oran poon marso sagkod mayo mantang si luzon asin visayas makaheheling nin nag oorog na makosog na oran,0
an grupo musikal na ini hiniling na iyo an pinakalataw asin pinakamaimpluensyang pagiriba sa lantad nin musika sa mga dekadang idto,0
an an pagtabang ni san miguel an pagtabang ni san miguel an enot niyang sarsuwelang waray,0
university of the philippines,0
an mga bagay na an gravitational field iyo makusogon na maray para an liwanag dae makadulag iyo enot na pigkonsidera kaidtong ika na siglo ni john michell asin pierresimon laplace,0
siya nagadan kaining oktobre sa springfield pennsylvania kun saen siya nakaestar na,0
an mga modernong kompyuter na nakabase sa mga integrated circuit iyo milyon hasta bilyong mas may kakayahan sa mga suanoy na kompyuter asin minaokupa nin sarong praksyon kan espasyong kaipohan kan mga ini,0
nasabi na saro sana an biograpong nasurat manongod ki cayce an sinurat ni thomas joseph sugrue tituladong there is a river,0
an invisible children nagtatangro online nin mga poster sa pagmawot na makakua nin mas mahiwas na suporta,0
nagpadagos siya kan saiyang postgraduate sa antropolohikal na pagaadal sa harvard university bilang iskolar sa winthrop,0
kan ini an ika na nirereseta sa estados unidos na igwang with more than milyong million preskripsyon,0
an paaging ini iyo harus pigtutukdo sa mga pangtukdong laboratoryo,0
nag sumiter sya nin tula para sa sarong publikasyon kun sain nakasurat na i saw myself the wonder of my schoolmates a little local celebrity,0
punyeta si youngro naman nag hulog kan earbuds ko sa ibabaw kan printer tas dae ko aram na ito palan su nahulog ta naghihiling akong vlog kan aespa kaya hunto dinulag na palan ni ali su sarong pair buda medyo ig ngatngat pa gago maray ta dae hinalon ni bonak kahibion mga punyeta na alaga,1
naglakop sa barangay santa cruz an industriya kan pagbahan huli sa nagdadakol na parabakal sa laog asin luwas kan banwaan,0
an paghabol nangyayari sa pagsulok pabalagbag kan pugawa ingles weft sa lindog ingles warp an mga nakahotay na torsidong tindido sa habolan,0
ngane dai magtaralsik an pigkokodkod ini may taklob na sim sa ibabaw sa tuyong maghurulog sana an kinodkod sa salod na yaon sa tongod kaini,0
alagad sa mga aki bakong sugal ini asin an kaogmahan yaon sa makatipon nin dakul na dyolin imbes ini bakalon pa sa tindahan,0
kan abril nagpuon an tropikal depresyon w na mabuo sa tahaw kan chuuk asin pohnpei,0
nagsakat atop sinigwahan nindo tulos ki asin,1
magkagat nin saro kun malomoy asin luto na,0
mga na estruktura an naraot asin katawo an naerido,0
lininaniya huni naman an hayop ini,1
nagigibo ninda ini huli ta an bukobuko sa tuhod kaini napapaitok ninda nin degree kaya an mga kamoy pabaliktad asin nakakatakma sa mga ubak kan kahoy,0
an gamgam na ini an pigkakan mga prutas sana,0
mala ta nasaksihan an mga batalya sa ibaibang lugar sa pagagaw armas asin sa tuyong mapaluya an pwersa kan mga amerikano,0
an ekonomiya kan ehipto sinasabing saro sa pinakawarak sa tangang subangan na may sektor sa turismo sa agrikultura industriya asin serbisyo sa haros parehas na lebel nin produksyon,0
an enot na pigpublikar na materyales na buong pigsurat sa tataramon na lun bawang iyo an pagpapalistaramon kan bibliya kadtong na kun saen pigaapod ining bala luk do,0
gigibuhon na naman nindo akong akbit pakyu kamo haha,1
hindi po promise pang gago man sana po tweets ko,1
an naagom niya iyo an sarong nagngangaran na bibiana isaac,0
nagkua man siya nin mga halangkaw na panginhinyeriyang klase asin kan iyo nagin pinakaenot na itom na babaying inhinyero kan nasa,0
an saiyang agom si maria laarni lopez cayetano iyo an presenteng alkalde kan taguig city,0
sinasabi sa mga mainit na klima mas gamit an mga rekado orog na sa mga karne ngani haloy magraot o magaya,0
panhistorikal na sarng syudad nin kalakal,0
an tore mismo iyo an ikatolong pinakalangkaw na torengrelo sa bilog na kinaban na nagsosolong nakatindog,0
magpoon pa kan an kamiyembrohan sa pagkasaserdote pinagbukas sa gabos na mga rasarace,0
binanga sa apat na pitak an museo an sentral na galleria an archival library an seksyon filipiniana asin an hernandez memorabilia,0
sa mainit asin maambon na kondisyon an kjikin spores naggegerminate asin nagluluwas nin ensima na an apud amylases na iyo nagliliwat sa starch kan bagas pasiring sa glucose,0
an siplingan na makuri nagresulta sa pagkabuag kan saiyang pamilya na an solong nakaligtas buhay iyo si caligula,0
siya pakahaloyhaloy kaini nagin konduktor kan socit nationale na sige niya itinotolod an mga obra kan mga kagurubay niyang mga kompositor na pranses,0
lagi siyang may nakikitang kakaiba kahit sa mga istoryang alam natin,0
urualdaw na ini putangina,1
nalilibong na bilog na katauhan ko yudeputa,1
kan hulyo siya nagpalayog sa kalangitan nin mediterraneo asin iyo na sanang ultimong nahiling siyang buhay,0
nakagrupo an filipinas kaiba an bulgaria puerto rico asin uruguay sa fiba world championship,0
sa sorsogon mahuyong boot na siya naglapigot nin na taon asin pinahiling nya an pambihirang kakayahan sa pagadministrar sa tiniwal saiyang kargo,0
nagpublikar siya nin sarong pitong dakol na koleksyon nin mga epikong imekanu kaiba an saiyang sadiring mga palistaramon sa hapon kadtong,0
an pangaran kaini pinasabngan siyang kuanon sa nobelang sinurat ni victor appleton kan tituladong tom swift and his electric rifle saro sa seryeng paborito niyang barasahon kan siya aki pa,0
sabi ni soriano agosto an periodikong la correspondencia kan madrid nagbareta na si tomas arejola kaiba sa jose oriols asin francisco colon dinarakop,0
igwa ining sukol na kilometro kwadrado na kadagaan asin namumugtak sa inot na distrito,0
si granadas inot na ikinasal ki geryk genasky kan,0
pinanongod an pangaran na ini kan an kampanaryo kan munisipyo pinagisog sa presenting nalulugaran niya,0
didgi nakamogtak an katedral ni san basilio an katedral ni hesukristo salvador asin an mga sieteng hermana,0
napabayaan na dai na nagagamit,0
kan naging bubuyog boboy biglang nagbago an itsura kan reyna,0
punyeta urualdaw na sana talaga ako kikiligon saindo,1
tangina ang buhok jud ni jeongin huhu,1
iyo maogmang kan saday bubuyog harong iyan,0
nagpapel man siya sa pelikula ni jim jarmusch kan an tituladong down by law,0
maartehon sinda sa security haha hassleon na grabe hayop,1
takuton talsik kang mantika pero talsik kang pisot ugmahon,0
kan oktobre si sanger nagpoon nin proyekto na may pagkaagid sa wikipedia na iyo an citizendium na dai man ngane nagin popular asin dai nagkaigwang mahiwas na suporta sa mga paraambag na mga editor,0
masabi na an gera sa europa nagtapos sa paglusob kan mga alyadong subangan katuwang an unyon sobyet sa derotado nang alemanya mala ta nasakop mismo an kabiserang berlin ta nalaog enot kan mga pwersang sobyet asin tropang polako,0
naging sarong tutor si zobel dangan nagtabang sa mga karera nin mga magpipintang kastila na an pira iyo sina antonio lorenzo eusebio sempere martn chirino lpez antonio saura dangan dakol pang iba,0
antonio arejola sarong midbid na taga naga,0
siya man nanombrahan na sekretaryo kan interior sa administrasyon ni gobernador heneral leonard wood,0
maski na an kayamanan nin dubai nagtubo sa pagkua nin petrolyo sa nguyan na panahon sana an kontribusyon kaini sa enterong ekonomiya,0
hoy donny patal ka dae na ako nangingiturog ngonyan,1
sige dae kana mag balik pakyu ka,1
bwiset ka bako man ngane ako kaito,1
juan daeng kuldas nagadan katangahan,1
nagtutubod kami sa mga nobleng kaisipan kan mga amerikano asin oyon sa proklamasyon kan komisyon samuyang idinuduhol an samuyang kooperasyon paagi kan la democracia para sa pagtolod kan matanos na mga kamawotan kan satuyang namamanwaan,0
an ulonan na ginagamit na datogan kan tabay sa pagturog inaapod man na sandayan o sangdayan,0
dakulon na scenarios sa payo ko pakshet man oh,1
pero an mga taon na ini iyo an nagtaong dalan magkabistohan si murdoch asin an ikatolo niyang naagom si wendi deng sarong intsika,0
dai taka man wawaraon,0
nag gibo man si blench nin pagsasaligsig dangan pagsusuri kan mga internasyunal na aktibidad sa paguswag sa bilog na kinaban bilang sarong consultant dangan bilang dating sarong research fellow kan overseas development institute sa london,0
igwa ining sukol na kilometro kwadrado na kadagaan asin namumugtak sa ikatulong distrito,0
sya an chief water protector para sa anishnabek nation asin pagbansagan man sya bilang water warrior,0
siring man baga sa kadakoldakol na tataramon na satuya nang naisurat o baga nasambit sa aroaldaw,0
kun winter o sobrang lipot na klima sinda naturog garo daing hirohiro ngane malampasan an sobrang lipot,0
siya enot na aki kan saiyang ina asin ikaduwang aki kan saiyang ama,0
segun pa ki malanyaon,0
an panahon nin mga bagyo sa pasipiko kan aktibong marhay iyan naglawig nin sarong taon alagad an kadaklan na tropikong buhawi may tendensiang maporma sa nortesulnopan na kadagatan nin pasipiko sa pagitan nin mayo asin nobyembre,0
nagtrabaho man siya komo junior computer sa bureau of lands asin property clerk sa manila police department,0
si stacey park milbern mayo mayo sarong amerikanong disability rights activist,0
an pangenot na etnikong grupo sa rehiyon subangan na visayas iyo an mga waray,0
sa saiyang pamomoon aktibong saiyang pighihingoa na maimpluensya an ibang mga gobyerno manta na pinupondohan niya an mga organisasyon na paramilitar asin an mga terorista,0
isipon mo pinag bayad ka para maghiling tapos pinag custome ka na garo dangag tapos pinahibi kapa haha handang maging ulol for soshi,1
siya nagtukaw sa pwesto nin duwang beses,0
kan siya nagedad an pamilya niya nagpakanada,0
dae pa ngani kita kasal chuchu ano hahalaton mo pang ikasal bago ka mag bagong deputa ka,1
gabos mananggad na jason sa mundo ay kabangagng patal buda kabangagng dangag,1
an mga poon kan ngipon nakalubong asin napupugolan kan inaapod na ngaros namomogtak sa itaas asin ibabang kabtang kan salang,0
an pagigin transedental kan iyo nagpapahiling na imposibleng masimbag an suanoy na hamon na pagkwadrado kan bilog gamit an kompas asin straightedge,0
an mga babae pwede sanang latobon na hayaghayag sa publiko o bitayon sa anoman na paglapas kan ley,0
an korona ni in saka an saiyang aureola iyo an pinakamahalaga na parte kan imahen,0
dangan an saro niya pang tugang si joaquin kaiba niya sa ralaban kontra amerikano sa filipinoamerikanong gera,0
kadakol ngane pogi liga patalon man karawat,1
an susunod na pagpinturaotro kan torre nin tokyo tower pigpaplano sa,0
maray ta igkakaraya ko na mga igsasarabe ni santi pucha ka,1
nagluwas ini kan taon,0
mantang an ladawan ni robredo sa takop kua man ni nio jesus orbeta,0
napili man siyang lalawgon kan online store na sk planet,0
puta na lamaw lugod ako kang chirismisan,1
pakshet kaya tugang ko nagkuha,1
ipinagsaysay ni blust na an sentral asin sur na filipinas igwang hababang lingguwistiko na pagkakaibaiba,0
masabi pa siya an kagrogaring man kan china banking corporation,0
mahihiling ini sa subangan na parte kan lesser sunda islands asin kaiba an sulnupan na timor,0
tangina nagpaturo ako kung pano iluwas su aso sa dungo inulukan ako kan gago nagpara abo lamang ako,1
huli sa abilidad na ini siya nabansagan na an propetang natuturog,0
uruutro kaman adi habo taka ngani iconfirm,0
manonotaran ginigibong traditional kasalang bayan manibaibang lugar nawawara an solemnidad kan okasyon huli presencia asin pakikisawsaw kan politico nagmamawot nin publicidad asin interes personal,0
nin huli kaiyan ang gabos na klase tigokupar na ang bagong edipisyo,0
an pantanom mansana kaini iyo an tinabas sa unod niya o an ala mismo pakataras kan laman,0
kapalon pandok mo kupal ka,1
lord last naba ini please lang mahirak ka sako,1
si victor dennis t nierva an kagdisenyo kan intirong libro mantang an ladawan sa takop gibo man ni bernadette de los santos,0
an pwersas armadas kan filipinas afp kompwesto kan philippine army philippine navy asin philippine air force,0
mga sarong polo nin taipei an pinasabongan nin tubig baha asin an mga pasyente sa ospital pinirit na mag ebakwar pasiring sa okinawa pakatapos kan sarong kompaniya kan military assistance advisory group na naapektaran kan makosog na oran,0
maliputon kana magchat saku maray na ba kamo kan ex mo,0
sinasabing an mga paborito niyang mga artista iyo sinda pugo asin togo asin an parabayleng benny mack asin bayani casimiro,0
sa saiyang pagdiskurso sa radyo pinakiulayan niya pa an mga amerikano na dai na maglaban ngani dai na magkawsang ratak sa mga bagongtawo kan pilipinas,0
tarantado ka napaka racist mong hayop ka,1
patal ka talaga dan,1
sagkod ngonyan kaaayon pa siya sa bupeteng ini,0
siya patrona nin pampanitikan kaiba sina wace benot de saintemaure asin bernart de ventadorn,0
nagabot an oportunidad na ini kan an mga kastila ibinalik an mga riple sa mga gwardya sibil huli ta dakul na maray mga tawong nagtitiripon na sa caceres huli kan piyesta,0
an sarong pur kan puting bituon nakatukdo sa walang kanto kan bandera,0
mga tala nin lamigtis kan lahar sa mt,0
si zheng namundag sa pangaran na ma he sa muslim na pamilya gikan sa kunyang,0
wara nang pag asa puta,1
dai nahaloy pinonan na kan pdrrmc an mga initiatibo sa pag ebakwar pabalyo sa probinsia nin albay na may populasyon na na nag eerok sa barangay bilang paglikay,0
doomingo kan abucay ipinagtiwala sa mga dominikano an pagaataman kan buhay espirituwal kan mga tagaigdi poon kan taon,0
putangina sarong dagdag stress pa su certificate ko sa on job training,1
ulol ika kung saen saen mo ako igdadara kaito haha,1
sinda igwa nin mga kalag asin mga pinanungdan nin kaligtasan,0
pucha mapresent man palan ako,1
si sycip nakua an kurso sa komersyo sa unibersidad nin sto,0
dai nagtapos an karera publiko ni lukban sa pagkadakop saiya,0
nababanga an sibuco sa barangay,0
nagadan si ali kan hunyo,0
an soundtrack ginibo kan the chieftains asin mga seleksyon digdi nagluwas sa saindang film cuts album,0
hayp na kababluy ngonyan na aldaw huhu dakulon pa akong gibuhon pero dae lamang namomotivate mare,1
kan autumn natapos niya an inapod na generic and specialtotype helicopter training ngonyan yaon na siya nakatoka sa raf valley sa squadron nu,0
gari dangag pirmi na sana ako nakakaidlip,1
su masisugon ka magtaram sa socmed duwag ka man sanang kupal ka,1
an sur sulnupang duros nagdadara nin makusog na uran sa kadaklan na arkipelago poon mayo sagkud oktubre,0
an pagbangga kan paglakop kan mga siring iyo an paggamit kuta nin condom ngane daing kontak sa mga wisik sa laog kan organo alagad dakul an habo maggamit kaini ta naiinaan an girok daa,0
an mga armas kan sarong pintado iyo an mga darakulang pakurbang sundang arug kan cutlasses spears asin caraas,0
sinasabi na si pagbuyagyag kan boston globe asin huli man sa mga kaso sa korte iyo an nagbiklad kan korupsyon asin mga ilegal na aktibidad kan mga ahenteng federal na nadamay ki bulger asin ini iyo nagin dakulang kasosopgan kan nasabing ahensya,0
dai ko aram pano mag react punyeta,1
hamag man kadakol na pweding mawara su palda ko pa sa iskwelahan kauragon,1
gago ka ba dusta pakyu,1
an master of arts degree niya nakua niya kan sa up man,0
lininaniya makataram ka kala man talaga aram ka relationship,1
dangag ako sa pag tagalog ih,1
tinogdas kan taon enero kan mga amerikano bilang sarong institusyon sa pagpaadal nin mga paratokdo sa kusog kan akta nu,0
an enot na aldaw kan salog naga o inaapod man na aldaw kan salog nin buhay pigselebrar kan marso sa syudad kan naga,0
saiya man na kinaugalian na magsulot nin filipinianang bado sa saiyang mga pagtukdo para lalo pang maging interesado an mga dayo sa mga bagay patungkol sa pilipinas,0
haha putangina talaga ni pldt,1
pogion si heeseung puta nahihibi ako,1
sabi na tarantado ka talaga maski nuaren,1
an pondo kan foundation hale haros sa kaban kan yaman ni doa consuelo chito madrigal dawa totoo nagaako nin katampad na pondo para sa mga proyekto hale sa ibang mga pilantropo mga amigo organisasyon asin mga indibidual,0
