ang hatagas nga kabukiran maoy alang sa mga kanding nga ihalas ang mga pangpang nga lungib maoy dalangpanan sa mga conejo,0
ang mga lingkuranan sa kapihan didto pula,0
ang konstitusyonal nga endothermic adunay naay gamay nga kusog niini,0
wala ko gi uhaw,0
ug kong makita pa kini diha sa bisti,0
maong masking kami natingala pagingon na mao na to,0
gi tudloan ko sa akong tatay mag luto,0
anaa ang maayong mga asperidad sa dorsal,0
dili ba sila atua sa unahan sa jordan,0
kaila ko atong mga babaye,0
matinunglo ang imong alat ug ang imong dolang nga masahan,0
wala mi nadayon sa among plano nga magpiknik,0
ang mga kamot sa mga saksi mao ang una nga idapat kaniya sa pagpatay kaniya,0
ug kong masayup kamo ug dili kamo managbantay niining tanang mga sugo,0
ang tagsatagsa ka buotan nga tawo magabuhat uban sa kahibalo apan ang buang magapagarbo sa iyang binuang,1
makatulo duslaka si tom sa dughan,0
apan sa kahoy nga sa pagila sa maayo ug sa dautan,0
ug siya miingon kaniya umadto ka karon,0
ang mga anak ni zachai pito ka gatus ug kanuman,0
trabaho sa akoang anak nga babae ang pagpanilhig sa kwarto,0
kinsa man to si mona lisa,0
gisulayan pud namo ning buhaton,0
ginahunahuna niyang moadto sa tahiti,0
ug nakadungog niini ang mga sacerdote nga punoan ug ang mga escriba,0
gihigugma pod niya ang mga libro,0
ang matag usa adunay koneksyon,0
hangtud sa tuhod ang isnow,0
manganak na siya inig ka hulyo,0
tungod niining maong hinungdan gidakop ako sa mga judio sulod sa templo,0
adunay gipangutana si tom kanimo,0
ug si moises miingon sa mga anak ni gad ug sa mga anak ni ruben mangadto ba sa gubat ang inyong mga kaigsoonan,0
murag dili naga larga,0
ug kini mahitabo nga kong sila dili motoo kanimo,0
naa ba dinhi ang kabalo og hapon,0
sila nagapusa sa mga itlog sa mga bitin,0
naa ba mo kaila nga usa ka g green,0
taas ang iyang buhok niadtong milabay nga tuig,0
natingala ko kon kinsa sila,0
tinuod ang milagro ug kami mutuo ani,0
gihigugma ko ang akong anak nga lalaki nga nahigugma sa nasud gipasigarbo ko siya,0
managlahi ang ilang mga opinyon,0
ga inom ug kape nako,0
adunay tulo ka mga tawo sa litrato,0
ang bintana sa atubangan sa tamnanan kay bubog na berde,0
ug sa paghisulod na niya,0
mao kini ang igaingon ninyo kang jose gipangaliyupo ko kaninyo,0
ug nagpuyo si jacob sa yuta nga gipuyan sa iyang amahan,0
naa ba tamatama nga kwarta,0
nangaon og puto ang mga bisita ni linda,0
nipaspas sa makadiyot ang lihok sa typhoon julian nga nagpundo sa kadagatan sa pilipinas,0
naa siyay suot nga sunglasses,0
nagabasa ko og libro,0
gusto ko nga mustorya ka og sinultian nga pranses,0
hilom tiguwang na kami,0
nakalimot kag patay sa suga,1
unsay oras inyong ulian,0
kinahanglan nako og asukar,0
ug si jacob miingon kanila mga igsoon ko,0
naa ba kay kwarta,0
ayaw paghukum sa mga tawo base sa ilang hitsura,0
walay pulos imong mga gipanulti,1
nagkaon si karl og kalamay sa kusina,0
adunay mga tanom sa saging kilid sa sapa sa kastilyo,0
sa akong uyuan nang balay nga pula,0
upang umunlad ang bayan disiplina ang kailangan,0
wala mi klase karong adlawa,0
adunay abilidad mag estorya ang tao,0
giguba nimo ang tanan,0
palihug ug naug sa radyo,0
ug siya ilang gigunitan ug gidakop,0
adunay lainlaing mga porma sa gobyerno,0
gibalita usab nga namatay tungo sa linog si retirado nga police colonel gilbert sauro,1
dapat dili na ka manigarilyo,0
gi ingnan na nimo imong mama,0
gusto nila mupuyo sa kaulohan,0
murag naay sakit ang iro,0
pila sa imong mga estudyante ang ania dinhi,0
unsa man ipaingon nimo nako niya,0
ug siya magabarog sa atubangan ni eleazar,0
adunay picasso sa bong bong,0
ang anyos nga shooting guard kauban si ginebra ug san miguel adunay ka mga titulo,0
dili nato angay buhian ang mga piniriso karong taknaa,0
asa nimo sila gina pakaon,0
kini ang akong bokabularyo,0
ug sa makapito magasablig siya sa ibabaw niini sa dugo nga anaa sa iyang tudlo,0
nagadagan ang bata nga lalaki,0
kay samtang kami buhi,0
ug ako magahatag niining katawohan ug pagpahimuot sa atubangan sa mga mata sa mga egiptohanon,0
nindot ba ang tambal,0
ug ang gubat mikusog niadtong adlawa ug ang hari gibilin sa iyang carro atbang sa mga sirianhon,0
apan nahitabo sa diha nga ang maghuhukom patay na,1
ug diha kaniya hingkaplagan ang dugo sa mga profeta ug mga balaan,0
asa na ka dapit,0
wala koy masulti kon dili ang henyo nako,0
lakip sa ka patayng lawas ang nga nakuha sa philippine national police gikan sa unom ka rehiyon,1
ug kong ang tibook nga katilingban sa israel mangasayup,0
kinahanglan kong kanselahon ang akong tigum,0
ug sila mingtubag pumahawa ka diha ug miingon pa sila mianhi kini dinhi sa pagpuyo ingon nga usa ka dumuloong,0
naay adlaw pero init,0
sa nagbasa ko og libro nitingog ang telepono,0
magkaparehas ang tanan ninyong mga bulak,0
nakasulob si tomas og kalo,0
paspas nga nidagan si lynn,0
busa biyaan ta na ang nahaunang mga tuloohan mahitungod kang cristo ug managuswag kita ngadto sa pagkahamtong,0
nagamping siya kaayo busa dili siya kanunay masayup,0
ug ang sacerdote magahalad sa usa ka book alang sa haladtungodsasala,0
ang sacerdote nga magahalad niini tungod sa sala,0
dili ka mawala sa akong panumduman,0
ug si arauna miingon nganong mianhi ang hari sa iyang sulogoon ug si david miingon aron sa pagpalit sa giukan nimo,0
busa ang sa dios ginahiusa sa tawo ayaw ipabulag sila,0
ang balay nga naay lunhaw nga atopan kay akoa,0
ginapakaon sa amahan ang bata og biko,0
hinaut nga di makalimot hunahunaon nato nga magigsoon ta,0
ang kabaskog kinahanglang kondisyon alang sa kalipay,0
ang kadaghanan sa mga pulis kay nawadan og tarbaho,0
pirme kang maghunahuna nga ikaw ang bright pero sayop ka,0
ug ako mokunsad ug makigsulti kanimo didto ug ako magakuha sa espiritu nga anaa kanimo,0
walay tawo nga magaprenda sa galingan,0
ang mga ginikanan ni tom kay si john ug mary,0
niadtong panahona ang bantayanang torre giorganisar ingon usa ka pueblo,0
murag nipis nga sopas ang anaa sa imong ulo,0
nadungog ko ang gisulti ni tom kay mary,0
ayaw pagpakahilum oh dios sa akong pagdayeg,0
ayaw palabi kaon og keyk,0
kahibaw nga tomboy si dora,0
ginapangita nako ang usa sa akong mga amigo,0
ug si moises mitubag ikaw usab kinahanglan maghatag sa among mga kamot ug mga halad,0
gidili ang pagbisita sa mga patay sa adlaw sa mga minatay,1
ug nakita sa dios ang kahayag nga kini maayo ug gilain sa dios ang kahayag gikan sa kangitngit,0
unya miingon si sedechias kang jeremias ayaw pagpahibalo kang bisan kinsa niining mga pulonga,0
dili gayud ako makalangoy,0
iingon nako sa akong amahan,0
miuyon ang mga klasikal nga liberal uban ni thomas hobbes nga ang gobyerno gilalang sa mga indibidwal aron mapanalipdan ang ilang kaugalingon gikan sa usag usa ug nga ang katuyoan sa gobyerno kinahanglan nga mapaminusan ang panagbangi tali sa mga indibidwal nga mahimo nga motindog sa usa ka kahimtang sa kinaiyahan,0
sigurado ko nga human na siya,0
wala ko nag dahom na buhaton gyud ni tom,0
siya miuyon sa akong opinyon,0
ug ang tanan nga mga katawohan sa yuta makakita nga ikaw ginatawag tungod sa ngalan ni jehova ug sila mangahadlok kanimo,0
nawadan og asawa si tom,0
nagaluto ug pasayan si leo,0
bakal ang ginagamit sa paghimo ug bapor,0
naay duha ka dalunggan ang tao,0
dunay tinta nga narangha ang kaligrapiya ni casper,0
ang cebu mao ang naguna nga kaugalingog pananagatan sa pilipinas,0
lasa kini nga tsa,0
si roger kay nagatrabaho gikan sa buntag hantod sa gabii,0
ug pagakuhaon sa sacerdote gikan sa kamot sa babaye ang haladngakalanon sa pangabugho,0
ug ang tanan nga mahikapan sa ginapangagian ug dili manghunaw sa tubig sa iyang mga kamot,0
wala pako nahuman og kaon,0
bakgrawni ako inigtabok nako,0
gusto nako masayran kon kinsa ang muuban sa atoa,0
ang asul nga bestida igu ra kaayo niya,0
ingon usab ang makahikap sa unod sa ginapangagian pagalabhan niya ang iyang mga bisti,0
tinuod nga sexy ang imong mga batiis,0
gipanganak siya sa aprika,0
di ka kabalo mosunod ug simpleng instruksyon,0
magluto og tapsilog si quincy,0
ug sila miingon kong kami nakakaplag ug kalooy sa imong mga mata,0
unsa sa imong tanaw,0
walay motuo sa imong mga sulti kay puro ra mga bakak,0
kinsa kinsa imong mga tapad balay,0
ug iyang gidakop ang dragon,0
ug sa tanan nga mananap sa yuta,0
ayaw sulayi sa panimalay kung unsa man ang inyong mga nakita,0
ug si jehova miingon pagatagoan ko ba gikan kang abraham ang akong pagabuhaton,0
pirme kang nagapas sa uban kay wa kay kaugalingong plano,0
ang sakit nga nakapatay sa usa ka dako nga bahin sa kini nga giinfect,1
naay nag tanaw sa imo,0
tagas ang mga kasagbutan sa lugar ni casper,0
wa kay abilidad nga makadala ug maayo nga plano,0
ang tawong maalamon nahimulos sa iyang mga sayup,0
apan ang tinuod mao nga si cristo gibanhaw gikan sa mga patay,1
usa ang patay ug upat ang angol samtang ang usa ka girder sa amihanan nga bahin sa skyway nahulog kaniadtong sabado sa buntag,1
iyagyag ko sa imong sekreto,0
ang mga balyena sa sperm gilista sa apendise i ug apendise ii sa convention sa conservation of migratory spies of wild animals cms,0
aguroy gipaak ko sa buyog,0
ug ikaw kinsa ka,0
isulti mo ngadto sa mga anak sa israel,0
wa kay paki sa mga problema nga imong gibuhat sa uban,0
kinahanglan ka sa imong pamilya,0
ang ihap sa mga mananambal ningtaas sa sa kinatibukan nga,0
isulti mo sa mga anak sa israel ug ipamulong mo kanila sa diha nga ang usa ka tawo magabuhat ug linain nga panaad kang jehova,0
nikalit siya ug hilom,0
gipugos niya kami nga moadto una,0
di masolusyonan sa siyensya ang tanan problema sa kinabuhi,0
kini kinahanglan nga usabon,0
nangutana ko niya sa iyang bagong libro,0
ug miingon si moises kang aaron dumuol ka sa halaran,0
sumpok nga ilusyon ba ang tibuok laniakea,0
nganong ganaugan ka niya ug telepono,0
ang kolor sa kini nga koral mao ang kolor de letse o luspad nga brown ug ang mga tumoy sa sanga usahay nagapula,1
ako magahatag ug ulan sa inyong yuta sa iyang panahon,0
dili sila magapangasawa sa usa ka babaye nga bigaon,0
sa higayon nga ang mga pawikan moabut sa pagkahamtong,0
kani nga lamisa kay para sa unom ka tawo,0
ug ang mga sirianhon nangalagiw gikan sa atubangan sa israel ug si david nagpatay gikan sa mga sirianhon sa mga tawo sa pito ka libong carro,1
ug miingon kanila si ruben dili kamo magpatulo ug dugo ihulog siya niining gahong nga anaa sa kamingawan,0
modagan ning mga tawo,0
dili kamo magakaon niini nga hilaw,0
unya ang hari sa sodoma miingon kang abram ihatag mo kanako ang mga tawo,0
kung naa lang koy panid maluwas unta nako siya,0
gikapoy na ko sa imong mga reklamo,0
busa tungod sa pagkadinalian sa sugo sa hari,0
usa ko ka babae,0
kay sa tawo nga manggialamon,0
dakua anang simbahana uy,0
ug akong ligonon ang mga bukton sa hari sa babilonia,0
ug sa nahurot na ang salapi sa yuta sa egipto,0
ang utok sa usa ka dugong kay adunay gibugatan nga maximum na g oz,0
akong gi botar si tom,0
ug sa mga camello si obil nga ismaelnon ug sa mga asno mao si jedias ang merotenhon ug sa mga panon sa carnero si jasis ang agarenhon,0
ug kong niining tanan dili pa kamo magpatalinghug kanako,0
bahin sa mga bituon ang ug planeta ang astronomiya,0
si ira ang ithrihanon si gareb ang ithrihanon,0
nagatuon ba ka og ingles,0
wa ka kabalo sa imong ginapangsulti,0
ug gipatawag niya si moises ug si aaron sa gabii ug miingon siya kanila bumangon kamo,0
nakahuman na ba ka ug basa sa libro,0
nawadan na mi ug salig sa iyaha,0
si nephtali maong lagsaw nga baye nga binuhian,0
nakipagkamayan ko sa iyaha,0
nagtuon si yaroslav sa pagsusuwat og akademiko sa ingles,0
dili nila ignon ang tinoud saimoha,0
sa diha nga ang tawong matarung mobiya gikan sa iyang pagkamatarung,0
ug nahitabo nga sa mingagi na gayud ang duha ka tuig,0
ug sa nangalisang sila ug nanagduko sa yuta,0
si pedro miingon kaniya,0
karon iya nang napasiguli ngadto kaniya diha sa iyang tawhanon nga lawas pinaagi sa iyang kamatayon,0
paghilom mie ang pulong ni nanay,0
ug naa kay kalamano dapat imong tanawon iyahang mga mata,0
ug ang mga kalungsoran nga inyong igahatag ngadto sa mga levihanon,0
ang sigarilyo kay tambal,0
ug kong adunay tawo nga motipon sa paghigda kaniya,0
tagahokkaido siya pero nagpuyo siya karon sa tokyo,0
ang tanang mga kalungsoran nga inyong igahatag ngadto sa mga levihanon mamahimong kapatan ug walo ka lungsod kini igahatag ninyo uban ang mga kaumahan niini,0
naay nangita sa imoha sa telepono,0
pagkamaanyag ug pagkamatamis nimo oh hinigugma alang sa kalipayan,0
usahay madaog ang mga dili maayo,0
ako kay usa ka amigo ni roberts,0
unya gitugotan nila sa pagpalakaw si rebeca nga igsoon nila nga babaye,0
kinahanglan magpuli ka og tren sa shinjuku,0
wala na bay hangyo,0
kun tungod sa pagdumot siya makasamad kaniya pinaagi sa iyang kamot,0
ug si nadab ug si abiu nangamatay sa atubangan ni jehova,0
ug magahatag ako ug balili sa imong kaumahan alang sa imong kakayupan ug magakaon ka ug mabusog,0
paninabuhi kita ang gamugna,0
patyun tikaw irua ka,0
naugdaw ang tibuok lungsod sa sunog,0
ginabuhat nako akong asaynment pagkahuman sa klase,0
ug si moises nagdala sa tanang mga sungkod gikan sa atubangan ni jehova ngadto sa mga anak sa israel ug sila mingtanaw,0
ug tanan kining imong mga alagad manglugsong nganhi kanako,0
nagpahimo siya sa iyaha ana,0
ug si jehova misulti kang moises,0
bisan kinsa nga magpakighilawas sa mananap pagapatyon gayud siya,0
unya si job mitubag ug miingon,0
nakitan na nako na siya sauna,0
pirme kang gaingon nga ikaw ang sakto bisan klaro nga sayop ka,0
ug didto pagadadon ninyo ang inyong mga haladngasinunog,0
maingon sa usa ka nabuang tawo nga nagasalibay sa mga agipo,1
og masadan ka ipapriso ka,0
kay kon ang mga nangamatay dili man pagabanhawon,0
kon ang usa ka tawo magaputli sa iyang kaugalingon gikan sa butang nga talamayon,0
sa banay ni benjamin,0
iyang gibusog ang iyang pana ingon sa usa ka kaaway,0
wala akoy gibuhat nga sikreto kanimo,0
ug ang adoraim ug ang lachis ug ang azeka,0
nasuko siya sa akoa kay gidaot nako amoang relasyon,0
adunay mga hayop diri,1
ugma nganong dili ka mu anhi diri ug magdula,0
hawod sila sa gitara,0
mahimo usab kini mahitabo sa ngitngit nga tubig,0
ang mga opisyales ng custom nga gitanggal sa puwesto mao sila naia customs operation officer lomontod macabando,0
nakitan namo si gng brown sa teatro,0
duol ra ba ang hotel sa paluparan,0
wa kay klarong plano bisan unsa imong buhaton,0
sagulsagol nga tinood ug sayop ang kada opinyon,0
ug ang mga anak nga lalake ni gomer si ashkenaz,0
gitawagan tika gabii aron ihatag sa imo ang maayong balita,0
paspas ra kaayo siya nag istorya sa mga estudyante,0
lami anf turon de kasoy sa tindahan ni dindin,0
gipangayo ko kanimo nga itugan mo kanako,0
ug sila gipanalanginan niya niadtong adlawa,0
ug maghalad ka sa pasko kang jehova nga imong dios,0
dili nimo kailangan nga pasalamatan ko,0
kini ang mga lamao forest reserve sa bataan,0
kanunay ra kang walay klaro nga buhaton,0
talagsa ra ang mga klase napulogduha ka mga hayop ang naagaw sukad pa sa,1
kapin sa katunga sa isla ang sakop sa kalasangan,0
kay ang pagkasukihan sa mga tawong walaypagtagad mopatay kanila,1
luntian og asula ng kalo,0
sa panagway sa bisan unsang mananapa nga ania sa yuta,0
gihimo niya ang kape alang sa tanan kanato,0
panginom usa kamo og salabat didto sa sala,0
ug nangutana siya sa mga tawo niadtong dapita,0
mahinungdanon ang kooperasyon sa rehiyon tungod sa kaylap nga pagapodapod sa mga hayop ug kaniadtong,1
kinsa ang nagagamit kaniadto,0
ug mitungha kaniya si jehova,0
gitawagan ni tom si mary,0
milabay ang mga tuig,0
kinahanglan ka namo karon,0
busa karon wala kamo magpadala kanako dinhi,0
nagtuon og gamayng sulat sa hapon si weena,0
niagayay ang tubig sa pangpang,0
aron sa pagtudlo sa diha nga kini mahugaw na,0
tinuod nga moderno gyud ilahang balay,0
kini siya sa sinugdan uban sa dios,0
ang mga anak ni azmaveth kapatan ug duha,0
namili ko og bagong kalo sa tindahan,0
gusto nako nga mokanta ka og usa ka kanta,0
giangkon ni kim nga nagbangutan gihapon sila sa pagkamatay sa ilang lola ug kini ang usa sa labing dakong hagit sa ilang pamilya karong tuig apan nagtuo siya nga ang tanan maayo ra usab,0
ingna ko kun si rosi motawag,0
gusto nako mamahaw nga kauban ka,0
nagsirit siya samtang naglakaw,0
permi tika mahunahunaan tungod anang tugtuga,0
nagbasol ko sa pagkaon og kinason,0
ug si esau miingon pagabiyaan ko karon ang uban sa akong tawo nga mikuyog kanako ug siya miingon unsa ba ang kinahanglan niini makakaplag unta ug kahimutan sa mga mata sa akong ginoo,0
sa imuha na ang desisyon kung unsa ang himuon,0
gibutangan nako ug gatas ang akong kape,0
ug siya mitubag kinsa ba ang nagbutang kanimo nga principe ug maghuhukom kanamo nagahunahuna ka ba sa pagpatay kanako ingon sa pagpatay mo sa egiptohanon unya si moises nahadlok,0
wala koy labot kung unsa ka katigulang,0
kinsa ang nagtukod niini,0
kini ang akong opisina,0
ug ang sacerdote magahalad sa usa alang sa haladtungodsasala,0
wala tuy laing buotpasabot,0
malipayong pasko sa pagkabanhaw,0
tinood yata ang iyang istorya,0
gipalitan nako siya ug relo,0
wa nimo gipahulam sa iyaha,0
ug bisan ang vaca nga baye kun ang carnero nga baye,0
masiradi ang tindahan karong alas onse,0
ang dumanquilas bay alternatibong ispeling nga dumanguilas bay usa ka bukton sa goro sa moro sa habagatang bahin sa zamboanga peninsula sa kasadpang mindanao isla sa pilipinas,0
gidudahan sa mga awtoridad na ang grupo ng nipatay sa usa ka pulismaynila ug gikuha ang naa sa p milyon nga kantidad sa kwarta ug alahas sa usa ka sakyanan sa sta cruz,1
apan ang pulong sa ginoo magapadayon hangtud sa kahangturan,0
nagaluto ug pansit buko si leo,0
gihatag niya ang iyang kinabuhi alang sa iyang nasud,0
ug dili ka magkuha ug asawa nga uban gayud ang iyang igsoon nga babaye aron pagabuhaton siya nga kailog,0
nganong mahadlok ang mga tawo nimo,0
itarong ra ko sa plancha,0
pagdala mo ug pagkaon,0
tungod kay wala siyay mga manununod,0
kaslon pa kaha ko,0
bago ra mi nanglimpyo ug mga kubeta,0
ang karne kay simbolo sa sekso,0
nganong nag maoy man ka,0
ang mga estudyante kay gihatagan og mga libro sa eskwelahan,0
walay nakatabang sa imong mga plano,0
naa ba kay igsoon nga laki ana,0
walay motuo sa imong mga saad kay pirmi ka lang bakakon,1
moadto ko sa inyong lugar,0
ug ang butang nakapahamuot sa mga mata ni faraon ug sa mga mata sa iyang mga alagad,0
gusto lang niya nga ilaron ka,0
ug kini mao ang mga naisip sa mga levihanon sunod sa ilang mga panimalay sa kang gerson,0
ug mahitabo nga sa panahon sa tingani ihatag ninyo ang ikalima ka bahin kang faraon,0
ginasayang ra nila ang oras,0
ug ang nazareo magapaalot sa ulo sa iyang pagkabinulag didto sa pultahan sa balongbalong nga pagatiguman,0
ug sa ibabaw niya iyang gipandongan siya sa iyang mga kamot,0
mogahi ang lawas inigkamatay,0
kon buot ka hala layas karon dayon,0
naga sulti siya ug maski sa kasamtangan sa pagtulog,0
si jehova dili magapasaylo kaniya,0
kini gigikanan sa amihanan sa dikatayan river,0
ang mga hagit sa pamuhunan naglakip sa mga ispekulador nga nagbid sa mga presyo sa kabtangan sa lugar,0
nag jogging si jose sa dakbayan,0
magsulti kamo sa mga anak sa israel,0
adunay kalamay sa ref si karl,0
halos kadaadlaw ko niya ginatawagan,0
kamatsile ug lumboy sa akong panumnduman,0
apan kong ang sacerdote magahiling sa sakit sa pono,0
walay sulod ang lata,0
basaha palihog og usob,0
patayon nato ang telebisyon,0
unsa kadto nga saba,0
unsa atong lutuon karon,0
daghan sa mga ofws ang nagantus sa pagpanlupig,0
ubay ubay napud ang nagahulat,0
bisag asa ko moadto mouban ko nako,0
ug ang mga anak nga lalake ni bilha,0
ug nagdamgo pa gayud siya ug lain na usab nga damgo,0
ang ganghaan sa watermark sa italya ang pagsulod sa york house,0
nagsulat ko og sulat para kay jim,0
ug siya miingon dakpa sila nga buhi ug ilang gidakup sila nga buhi,0
kasunod kini sa kambal nga pagbuto sa jolo,0
kadako sa bunal ni tom,0
nahulog nimo ang imong pluma,0
nagaestudyo og ingles si yumi gabii,0
ang pila sa namatay mga bata,1
kay bisan kinsa nga tawohana nga adunay ikasaway,0
gibuhat kini sa kazakhstan,0
dili lalim ang covid tungod ky nakamatay kini,0
gitistingan nako ug sulat gamit akong tuo nga kamot,0
ug ang bisti usab nga adunay sakit nga sanla,0
kinsay nanihanglan og kompyuter,0
ayusa ang inyong pamatasan samatang wala ko,0
naglihok usab ang pnp sa pagpanguna sa bagong hepe sa pnp nga si gendebold sinas aron masulbad ang pagpatay sa mga tigbalita,1
giingon kini sa senador tungod sa angal sa usa ka miyembro sa philhealth nadiskubre nga lima ka tuig na siyang patay sa dihang nagpa update sa iyang membership sa ahensya,1
pirme kang nagapilapil bisan walay mangutana nimo,0
nadungagan usab og ang mga bagong naulian aron sa katibukang ihap nga,0
nagasudlay siya sa iyahang buhok,0
mas gihigugma ni jack si ben kaysa sa iyang sarili,0
ganahan ka ug baseball,0
kinsa ko sa pananaw nimo,0
nakitan ang patay nga lawas sa barangay talayan human nihupa ang grabe nga ulan aning lunes,1
ug gipanalanginan sila sa dios,0
tungod sa pagkaparehas sa phylogenetic,0
aron sa pagsalikway sa tanan nimo nga mga kaaway gikan sa atubangan mo,0
ug gikan sa bukag sa mga tinapay nga walay levadura nga diha sa atubangan ni jehova,0
unta mokaon kami sa restawran sa chinese,0
himuon mo ang gisulti ko sa imo,0
si jehova wala mahigugma kaninyo,0
ug gikan sa katungangbanay ni manases,0
ang mga principe sa zoan nangahimong mga buang,1
kay ang lawas dili usa ka bahin lamang kondili daghan,0
ug gikuha niya ang tambok ug ang ikog nga matambok,0
makitan ni silvestre ang sayantis sa suroyanan,0
nga gipatay mo man ngani ang akong mga anak ug gitugyan mo sila,1
ug ang batanong lalake wala maglangan sa pagbuhat niadto,0
dili makitan ni tom ang gisulat sa bord,0
kakita si tomas kay maria sa telebisyon,0
kauban sa peninsula sa korea,0
ug pagahinumduman mo nga naulipon ka sa yuta didto sa egipto busa ginasugo ko ikaw nga buhaton mo kini,0
ug ang tagsatagsa ka anak nga babaye,0
ug nagatumbas niadtong mga nanagdumot kaniya sa ilang nawong,0
pagihap mo gikan sa uno hangtod sa usa ka gatos,0
ug nga nagtuman si jacob sa iyang amahan ug sa iyang inahan,0
alang sa tanan nga pasko nga milabay,0
pirme kang naglikay sa mga responsibilidad nga angay nimo buhaton,0
ayaw poagbasa og ing ana nga libro,0
nagtanom si isabela og mga milflores sa luyo sa balay,0
naay kaestorya si tom sa telepono,0
wala kay buot nga tawhana,0
matinunglo siya nga wala mahigugma sa ginoo maranatha,0
dili kamo magbuhat sa pagkadilimatarung sa paghukom,0
nagtindog si tom duol kay mary,0
ug ang iyang panon,0
gusto niya nga magtenis,0
apan kong kini dili ninyo pagabuhaton,0
kawayan ilang karaan na templo,0
ug si rebeca nagsulti kang jacob nga iyang anak,0
gitangaan ko niya kay dugay kasabot,0
tiya kani si tomas,0
pobre siya pero di matinuoron,0
wala pa ko nakapuyo sa boston,0
naghilak ang batang gamay tibuok gabii,0
dili ko mabuhi kung wala siya sakon,0
daghang pintura si silovestre sa balay niya,0
wala siya na sayod sa iyang buhaton,0
ug si jose gikuha sa iyang agalon,0
magkuha gyud ako sa katigayunan ni caius plinius nga magulang,0
ug kong ang imong igsoon nga anaa kanimo,0
ug magahalad ka ug mga haladsapakigdait,0
sa akong hunahuna panahon na nga mu lungtad ako,0
ug sila mingpanaw gikan sa harada,0
nagkaon si zax og hopia nga baboy,0
walay mutuo nimo kay pirmi kang nagpataka ug sulti,0
kini mao ang mga kaliwatan ni noe,0
pirme kang naghinambog pero wa kay angay nga ipakita,0
gitinguha namo nga makabot ang katuyoan,0
sa pananaw nako kay mali ka,0
ug kong ang mga adlaw sa pagpaputli kaniya matuman na tungod sa anak nga lalake kun tungod sa anak nga babaye,0
bantug rang dili kasulti kay amang diay,0
kini mao ang balaod sa halad ngasinunog,0
ug miingon siya tanawa,0
kong madugmok ko ang pala sa tinapay,0
daghang guyam didto sa parke,0
ang kaalam nga kinaadman naghimo sa bantog nga mga tagaatenas nga sa publiko gisukitsukit niya nga buangbuang,1
ang pagtukod sa lainlaing mga task force kung adunay mapatay sa hanay sa ligal nga propesyon mahimong usa ka maayong lakang aron masentro ug dali nga masulbad ang mga masaker,1
wala koy masyado nabalan mahitungod sa alemanya,0
posible nga muulan na sad,0
way mutuo sa imong mga pasalig,0
sa pagkadungog ni esau sa mga pulong sa iyang amahan,0
ug pagadadon niya ang lakeng vaca sa gawas sa campo,0
ug nahitabo sa human niining mga butanga,0
ug sa banay sa mga anak ni neptali usa ka principe,0
salaba ug barkilyos ang ginakaon ni og sa beranda,0
nasayod ka ba ato,0
ug ang tibook nga israel nga diha sa libut nila,0
di ka kabalo molihok ug ikaw ra pirme ang masayop,0
ang mount banahaw usa ka potensyal nga aktibong bulkan sa luzon sa pilipinas,0
namatay ang lima human matabunan og landslide samtang galunsad og clearing operation sa nueva vizcayaifugaomt province road,0
ang pagpanigarilyo kay usa ka daotan nga buhat,0
mga pila ka libro anaa ka,0
kini nga balay kay mas nindot pa kaysa sa iyaha,0
ug siya nagbuhat ug maayo kang abram tungod kaniya ug siya may mga carnero,0
ug unya sa pagkakita ni josue ug sa tibook israel nga ang mga nagbanhig nakaagaw na sa ciudad,0
endimiko kini sa pilipinas,0
wala pa ka naghugas og kamot dili ba,0
sa diha nga ang usa ka tawo nga matarung motalikod gikan sa iyang pagkamatarung ug magapakasala,0
usa pa ka botilya sa ilimnon diha beh,0
naa siyay nakita nga usa ka barko sa lagyo,0
mu adto mi sa lubnganan karon dayon,0
ug nahibato sa tapus niini,0
walay mga anak si tomas ug si maria,0
kaning isa nako ka ngipon saki tkaayo,0
sa inyong hunahuna tigulang na kaayo kamo,0
sigurado ka nga tabangan ta niya,0
kabalo ba ka kung asa maadto ang tawo kung mamatay na siya,1
buhi kaayo ang mga iring sa gabii,0
ug ang gusok nga gikuha ni jehova nga dios gikan sa tawo gibuhat niya nga usa ka babaye,0
ug gibuhat ni jacob sa ingon niini,0
mahadlok sila sa mga anito ug anino sa gabii,0
sila ang mga tawo nga gipakadiyos,0
unya gipalit ni jose ang tanan nga yuta sa egipto alang kang faraon kay ang mga egiptohanon namaligya ang tagsatagsa ka tawo sa iyang yuta,0
ug kini gisugilon niya sa iyang amahan ug sa iyang mga igsoon ug ang iyang amahan nagbadlong kaniya,0
ang caloocan kasa naglangkob sa mas dako kasikbit nga lugar,0
