si bela nga anak ni beor,0
kung mahanaw naang oras dili na mabalik pa pagusab,0
bisan kung ulahi na ug maayo mahimo usab kini paggukod,0
unsa ang ilang gusto,0
murag nakaila naman ko nimo sauna pa,0
maayo ang marka nako sa ingles,0
himoa nga mabuhi unta si ruben ug dili mamatay ug dili unta magkadiyut ang iyang mga lalake,1
gidala niya ang iyahang bike sa tindahan,0
ug si david ug ang iyang mga tawo nangadto sa keila,0
ug iyang gipatay ang usa ka tagaegipto,1
daghag istorya walay lihok,0
pula ang puti apan usahay mahimong dalag,0
kini mao ang katungdanan sa mga panimalay ni gerson,0
gilista ni tomas ang mga lugar na gusto niya adtuan,0
maayo kaayo ang iyang mata,0
nagasar ang tindahan inig alas onse,0
ang mga buang magatiawtiaw lamang sa haladtungodsasala apan sa taliwala sa mga matarung adunay maayong kabubuton,1
siya mitanaw kanako diha sa nawong,0
nakitan ni silvestre ang elepante sa parke,0
dili ba kini mao ang ginaimnan sa akong agalon,0
akoa na imohang mga papeles,0
kinsa ang kontra nato,0
busa hingabutan ni laban si jacob karon gipatindog na ni jacob ang iyang balongbalong sa bukid,0
dili ka makahalad sa pasko sa bisan diin sulod sa imong mga ganghaan nga gihatag kanimo ni jehova nga imong dios,0
ug sa pagkakita sa tibook nga katilingban nga si aaron namatay nanagbalata sila alang kang aaron sa katloan ka adlaw,1
hapit imposible na mabuhat na,0
undangi na kanang sige ug panigarilyo,0
si tom ang pinakauna nga nihalok kay maria,0
adunay daghang binuhing kanding si totong sa bukid,0
nihunong siya sa panabaku,0
gipabukalan niya ang ube sa kusina,0
patay ang tulo sa mga suspek ug nakaikyas ang drayber sa sakyanan,0
ang mga sakop gihinganlan george matthai,0
wala koy ni kwarta ni amigo,0
ug gidala ni esau ang iyang mga asawa,0
milflores ug gumamela ang tinanim ni quincy sa iyang balisbisan,0
niadtong nilabay nga bulan,0
tagai kog usa bi,0
sulati ang porm gamit ang usa ka ballpen,0
pastilan naa ang akong ugangan,0
kini aron mapanalipdan ang inyong kinabuhi taliwala sa nagpamatuod nga ang mga namatay sa covid,1
naninda ko og sago ug gulaman sa plasa,0
ug si jese ang amahan ni david nga hari,0
tabang pud gamay ayos ba,0
kini mao ang mga fiesta nga tinudlo ni jehova nga inyong igamantala nga mabalaan nga mga pagkatigum,0
paliton nakowala koy labot sa presyo,0
sa tanan nga adlaw sa iyang pagsaad sa pagkabinulag walay navaja nga makaagi sa ibabaw sa iyang ulo,0
ug gilaglag sila niya sukad sa aroer hangtud nga midangat ka sa minnith,0
pirme kang nagpatuyang ug yawit bisan walay kasayuran,0
ginoo ikaw mao ang among dapitngapuloyanan sa tanang mga kaliwatan,0
unsay ngalan niining karsadaha,0
nilingkod si tom ug naghulat,0
nag storya si tom,0
gusto namo ug sakyanan,0
ug si faraon nagaingon sa iyang mga alagad,0
ug si jacob mipadayon sa iyang paglakat,0
tinood kini nga istorya,0
ug makadungog kamog mga gubat ug mga dungogdungog mahitungod sa mga gubat pagbantay kamo nga dili kamo makuyawan kay kinahanglan gayud kini nga mahitabo,1
nagaluto ug pintos si leo,0
ug nahitabo sa ikatolo ka adlaw,0
gisuginlan ni tom si mary bahin sa kawat,0
pagkahuman sa pagsulong sa iyang lungag sa kainta sa kataas sa covid,0
sulatan ko nimo dayon,0
sa ingon niana gibuhat ni moises ingon sa gisugo ni jehova kaniya,0
malipayon kami sa gabie sa pangangaluluwa tungod daghan ug handa,0
naa rako sa balay tibook adlaw,0
ulahi na nga niabot si tom,0
naa pud dira si tom,0
nagbahisbahis ang babae atubangan sa balay,0
ug ang dana ug ang chiriatsana nga mao ang debir,0
nikaon si nestor og suman,0
dili sa kanunay utukan ang mga maayong tawo,0
ibaligya nako ang akong balay,0
giunsa pagbaybay nimo ang maanyag,0
nanganak siya og kaluha,0
ug midangat sila sa yuta sa atad nga pagagiukan sa trigo,0
unsa ang imong pinalabi nga panimpla,0
kahibalo ko sa tibuuk nga istorya,0
ug siya miingon kaniya isulti mo,0
wala kay kalibutan unsa ang angay buhaton,0
nagapamahaw mi sa sulod sa katukuran,0
sa kilid sa zamboanga sibugay ang mga isla sa muda,0
milangoy siya padulong sa atbang,0
nagasipilyo ko kada buntag,0
ug kini mao ang mga anak nga lalake ni levi sa ilang mga ngalan si gerson,0
ingon nga mga wala hiilhi,0
didto siya sa awstralya nagdako,0
ug ang tawo miduko ug misimba kang jehova,0
ug si jehova miingon kaniya tungod kay ang pagtuaw sa sodoma ug gomorra daku kaayo ug tungod kay ang ilang sala mabugat sa hilabihan gayud,0
gusto ba ug tsa ang imong higala,0
sa kadugayan mahibalan usab niya kung unsa ang akong gipasabut,0
duol ra ang estasyon,0
nagpuyo ko sa lungsod,0
kinsa ang misulat sa basahon,0
ug sa banay sa mga anak ni aser usa ka principe,0
pula og dalag ang baso,0
kanunay siyang moabot og sayo,0
taga canada sila tom ug mary,0
milugsong silang ondoy gahapon sa lungsod,0
ang mga ingon niana nga mga tawo nakalimot sa kaimportante sa simbahan o panimalay sa diyos sa atong kinabuhi nga kristiyano,0
kinahanglan palipayon nimo ang imong mga ginikanan,0
apan ang mga balay didto sa mga balangay nga wala libuti ug kuta,0
naay dakong kuwadrados nga salamin didto sa kapihan,0
tubigi ang wiski ug isog ra,0
naka adto na ba ka sa paris,0
ang pagkuha dili gituohan nga mameligro ang lokal nga populasyon,0
sa ikanapulo ug duha ka adlaw,0
pintalan niya ang iyang bisikleta og pula,0
morag dili ka kaayo malipayon nga makita ako,0
naugmad sa pranses ang latin,0
basin wala mauhaw si tom,0
pirme kang nagpakaaranaran bisan way kasayuran,0
hunahunaa sa imong kaugalingon,0
nag ampaw si tonya sa kusina,0
nia mi sa balay,0
wala na kay laing pangitaon samtang buhi pa ko,0
ug si aaron ug ang iyang mga anak nga lalake nanagbuhat sa tanang mga butang nga gisugo ni jehova pinaagi kang moises,0
ug si silpa ulipon nga babaye ni lea,0
ang nara usa ka kalma ug matahum nga balangay,0
ug gisuginlan ni abiathar si david nga gipamatay ni saul ang mga sacerdote ni jehova,0
hilig nako ug maminaw ug mga tugtog,0
ug sa pagkasayud sa dakung panon sa mga judio nga didto diay si jesus,0
naginom si maria ug tuba pagabot nako,0
ug nanamkon si lea pagusab,0
ang ubos nga bahin sa matag corallite kay naupaw gamay,0
unsay buot pasabot man ani,0
imong gikuniskunis si rahab,0
si pablo ug si silvano ug si timoteo,0
ang pagdawat ni socrates sa iyang silot sa pagkamatay human sa iyang kombiksyon makita usab nga magsuporta sa kini nga pagtanaw,0
rilihiyosa ko ug matinamdanon sa mga pista sa simbahan,0
ang iyang amahan gipatay sa mga gwardya nga sibilyan sa espanya sa wala pa matawo si manuel,1
nadunggan niyang nihilak siya,0
pirme kang naglikay sa mga butang nga kinahanglan nimo buhaton,0
ang maong panghitabo ang nagpasikat sa iyaha,0
ug si moises naghubo kang aaron sa iyang mga bisti,0
magkanawong sa ako ang bayk nimo,0
nagkaon og tokwa ug babo si lester,0
ug nagaalagad si jacob ug pito ka tuig tungod kang raquel,0
ug nahitabo nga sa gipagawas na sila,0
pwede ra pud mi maghulat diri kung gusto nimo,0
giingon niya nga lami gyud ang nilupak,0
gusto mukaon og karot ang kuneho,0
unsa inyong gusto imnon,0
ang tibuuk nga baryo sa ticad kay napatay sa kalayo,0
ang kasingkasing sa tawo nga manggialamon anaa sa iyang too nga kamot apan ang kasingkasing sa usa ka buangbuang anaa sa iyang wala,1
ang ecron lakip ang iyang mga lungsod ug mga balangay,0
kay ang imong ulipon migikan nga maoy nangako sa bata sa akong amahan nga nagaingon kong siya dili ko igabalik kanimo,0
nidawat og tag p,0
tanang tanum kinahangalan ang tubig ug adlaw,0
sumala ni police lieutenant colonel alejandro espiritu,0
duha ka gidudahang myembro sa usa ka grupo sa krimen ang napatay human gipusil sa pulisya didto sa barangay inarawan,1
sa diha nga pagapadakuon ni jehova nga imong dios ang imong utlanan ingon sa iyang gisaad kanimo,0
buhaton ko gyud na,0
ugma buhan ang mga gipakitaming,0
ug ang mga anak sa israel nanlakaw,0
asa ba ang sa banyo,0
busa mao kini ang giingon ni jehova mahatungod sa mga tawo sa anathoth,0
daghang ginaingon ang mga tawo sa imoha nga dili tinuod,0
ug siya miduol kang agar,0
tungod lamang sa panimalay ni jehova nga atong dios magapangita ako alang sa imong kaayohan,0
labut pa ang kamot ni jehova diha batok kanila aron sa paglaglag kanila gikan sa taliwala sa campo,0
ug sa pagabut niya sa pikas nga daplin,0
tawagan tika pagabot nako sa istasyon,0
kini mao ang pagalagad sa mga panimalay sa mga anak nga lalake ni merari,0
dayegon ninyo si jehova dayega si jehova oh kalag ko,0
nga mao ang magantos sa inhustisya kung wala ang gahum sa pagpanimalos ug ang hustisya,0
ang jose rizal memorial protected landscape nagokupar sa usa ka mabungahon nga peninsula nga nagaatubang sa dapitan bay sa zamboanga del norte,0
unya miingon si jacob kang simeon ug kang levi nagpagubut kamo kanako sa pagbuhat kanako nga dinumtan sa mga pumoluyo niining yutaa,0
ug siya miingon kanila pahulay kamo dinhi karon nga gabii,0
giingong misurender ang utok sa pagpatay sa usa ka abogado sa palawan kaniadtong nobyembre,1
ug kong unsa ang gibuhat niya kang dathan ug kang abiram,0
wa kay abilidad nga magdala ug saktong plano,0
ug miadto ang mga anak ni israel aron sa pagpalit ug trigo sa taliwala niadtong uban nga miadto kay ang gutom didto sa yuta sa canaan,0
ug ang mga panimalay sa mga anak ni coath,0
biyai ng trabaho sa mga hanas,0
mura siyag naay lain sa iyang ulo,0
naay hapit magpito ka libo nga sinultian sa kalibutan,0
ug nagsugo ako sa inyong mga maghuhukom niadtong panahona,0
way pakialam sa mga kinahanglanon sa uban,0
sa isla sa volcano bugos ang pagkaguba,0
dalha ko palihog sa grand hotel,0
akong edad kay kinse anyos nganong napangutana nimo kana,0
ang tukbonon kasagaran nga ginaatake sa taas nga bahin,0
niadto sila sa daplin sa dagat,0
humana siya og kaon sa iyang pamahaw,0
ug sa diha nga si isboseth,0
ug ang sacerdote magkuha gikan niadto nga haladngakalanon,0
unsa kalagyo gikan diri paadto sa sunod nga baryo,0
ug kadtong mga naisip sa mga panimalay sa mga anak nga lalake ni merari,0
gusto nako og gitara,0
pirme kang nagbuotbuot bisan ikaw ang hinungdan sa gubot,0
dili ka kaayo siyentipiko apan relihiyoso kaayo,0
sa diha nga si jehova nga imong dios magapasulod kanimo sa yuta nga imong pagaadtoan sa pagpanagiya niini,0
ug pagakuhaon ko kamo ingon nga akong katawohan,0
daghang pato didto sa parke,0
makalingaw nga gipatulog ko ni ining kantaha,0
pagsuot mo ug tsinelas,0
aslom kini nga mga ubas,0
dili makita ang tympanum,0
kadaghanan sa katipuneros mga ordinaryong tawo apan adunay usab mga adunahan nga mga patriyotiko nga miapil sa katipunan ug giila ang pagpanguna ni bonifacio,0
nganong di man ka mukanta,0
dali rang mutubo ang mga sagbot ug gadhon lang,0
ug ang sacerdote magakuha niadtong dugo pinaagi sa iyang tudlo ug igabutang niya sa ibabaw sa mga sungay sa halaran sa haladngasinunog ug igabubo niya ang tanan nga dugo niini diha sa tungtunganan sa halaran,0
oras na sa pag tulog,0
pamatia ninyo kining pulonga nga akong gisugdan batok kaninyo alang sa usa ka pagminatay,0
maingon sa usa ka magpapana nga nagasamad sa tanan,0
anak sa gawas ang duha ka anak ni rosi,0
luspad nga asul nga kurbata ang gisoot niya,0
ug sila mingpanaw gikan sa hasmona,0
magandam ka alang kanimo sa dalan ug pagabahinon mo sa totolo ka bahin ang mga utlanan sa imong yuta nga ipapanunod kanimo ni jehova nga imong dios,0
dili mi ingon niato,0
ug miusab sa pagpanganak siya ug usa ka anak nga lalake,0
ug ang mga anak nga lalake ni eliab si nemuel,0
naghagal siya kay sige siya ug dagan ganiha,0
daghang mga pulis sa siyudad ni silvestre,0
nakita nako sila dana ug corina,0
daghang unggoy didto sa parke,0
naa ba kay nakitan,0
ug ang mga tawo manulod sa mga langub sa mga bato,0
tinuod bagyud nga siyam ang kinabuhi sa iring,0
prosekusyon sa tigulang nga makahatag dakong katagbawan ba,0
kanta og bisan unsa palihog,0
wala pa nako siya gihagkan,0
unsa ang kolor sa kalibutan,0
ug hingkitan ni juda didto ang anak nga babaye sa usa ka tawo nga canaanhon,0
ngano kaya niya gibuhat kadto,0
hawod muchupa ug oten si tom,1
wala koy balay nga mapuyan,0
ug migula si moises,0
gipakaon si antonio og tinutong,0
ayaw lamulamoag bungat aron makasabot ko,0
nagskwela ko ug istorya ug arte,0
ang pagkuha sa mga hayop alang sa panukiduki hinungdan sa usa o duha nga namatay ang mga dugong mahal nga ipadayon sa pagkabihag tungod sa kadugayon nga maguban ang mga inahan ug mga nati,1
daghang kabaw didto sa parke,0
kung kuhaan kaya ko nimo og usa pa ka ilimnon,0
mura ra og mga amerikano karon ang mga tagaeuropa,0
karon ang gahong nga gibutang ni ismael sa tanang mga minatay sa mga tawo nga iyang gipamatay,0
ug gidala niya ang vaca nga lake sa haladtungodsasala,0
gusto ka ug salida,0
sa iyang pagkamatay sa,0
asta imong relihiyon kay babaye,0
mahitungod sa mga bituon ang kani nga basahon,0
wala gyud ko magdahom nga magviral kini tungod kay gusto gyud niya ang mga hayop,1
naga simbahon si tomas kada dominggo sa buntag,0
ug gihatag ni laban kang raquel nga iyang anak nga babaye si bilha nga iyang ulipon ingon nga iyang sulogoon nga babaye,0
dili jud nako masabtan kung ngano,0
sila wala magkinitanay ang usa ug usa,0
palihog pahuram sa imong libro,0
padayona nang inyong gibuhat,0
usa ka hinulad sa sulat nga ang pagbulotan ipahatag sa tagsatagsa ka lalawigan,0
gusto na kaayo niya isulti ang sikreto,0
daghang mga iskina sa siyudad ni silvestre,0
nganong di man ka mutabang,0
ug ang mga pabiyon sa sawang,0
di ka makatapos bisan sa pinakasayon nga trabaho,0
pangutana ang misunod sa pangutana,0
ug nahitabo sa mipanaw sila sa sidlakan,0
pila ka oras siya gapuyo sa kusina,0
mahimo kini nga hinungdan sa duha pa nga walay nalista nga mga lahi gikan sa sibuyan island ug greater negrospanay,0
ug iyang pagapabalikon kanimo ang tanan nga mga sakit sa egipto,0
gihawa siya sa listahan,0
ang mga dautan nanagibut sa pinuti ug nanagbingat sa ilang pana,0
wala siya makigilaila ni duterte,0
ug gikuha nila ang tanan nga bahandi sa sodoma ug sa gomorra,0
naay mga mina sa anthracite niining lugara,0
tangtangon nako ang kisami,0
sa imong pananaw magustohan ba ni niya,0
ang simbahan sa bagumbayan orihinal nahipatik sa black nazarene,0
nagatuon siya ug matematika nga multidimensiyonal,0
sila nahigugma sa usag usa,0
kaya buhaton sa kompyuter ang tarbaho ug paspas,0
si leanardo ibarra ingon sekretaryo sa panimalay ug mariano trias ingon kalihim sa pananalapi ang secretary sa foreign relations,0
tulo ka tuig ang milabay,0
gatuo ba ka sa ginoo,0
ang mga lingkuranan sa kapihan didto itum,0
mao kini ang giingon sa ginoong jehova tungod kay ang mga filistehanon nanimalus,0
makitan ni silvestre ang aleman sa suroyanan,0
bata pa kaayo ka aron mobiyahe nga ikaw ra,0
sa unahan sa jordan sa yuta sa moab,0
wala kay disiplina sa imong kaugalingon,0
ang hunahuna niya nga siya mao ang bayani,0
ug namulong si cain kang abel nga iyang igsoon ug nahitabo,0
malipayon kami nga nagdala kalipay sa mga panimalay bisan niining gamay nga regalo gikan sa among kasingkasing,0
wala gidahom ni tom nga naay makaila sa iyaha,0
ug siya migamit sa iyang sambingay,0
luntian og puti ang kalo,0
kay ang mga buhi nasayud nga sila mangamatay apan ang mga minatay dili mahibalo sa bisan unsa,0
ganahan ko sa lasagna,0
walay mopasalig sa imong mga gipanghambog,0
dili ka kasabot bisan sa mga klaro nga butang,0
ihunong sa nato diri ug ipadayon na nato ugma,0
manhid ug gahi ang iyahang kasingkasing,0
ang bukid sa fuji natabuna og niyebe kung ting tugnaw,0
ang kilid sa salamin kay kolor pula,0
wala gayud hiulii si jeroboam sa iyang kaligon pagusab sa mga adlaw ni abias ug gisamaran siya ni jehova,0
mikaon na ba ka sa restawran nga ikaw ra isa,0
gamay ra nga tsa palihog,0
mahalon ang iyan piyano,0
ug si jehova miingon kang moises ania karon,0
wala ko panahon aron magluto,0
kinsa toy nakakita nako,0
walay mopaminaw sa imong mga gipanghambog,0
gihatag sa sundalo ang iyang ngalan,0
dili ko moadto sa panagtapok nga gipatawag ni tom,0
sa imong kaluwasan nagahulat ako oh jehova,0
usa ko ka kusinero,0
salamat sa imong tubag,0
grabe nga pagkaguol sa mga kapamilya sa biktima sa dihang nasayran na lang nga nangamatay kini sa nadugay na sila nga wala na nagatubag sa mga tawag,0
giihaw na isda ang among giulam ganinang udto,0
gikaon ni edwin ang pan,0
gikaon sa mga indiyo ang iyang kasingkasing,0
ang mga alagianan sa sion nanagbalata,0
ang thai usa ka opisyal nga wika sa thailand,0
kinsa ang nag buhat sa telepono bell o meucci,0
kang dan si ahiezer ang anak nga lalake ni ammisaddai,0
ug sila mitubag kaniya maayo man ang imong ulipon nga among amahan buhi pa siya ug miduko sila ug naghatag sila ug katahuran,0
ug siya miingon kanako si jehova,0
maayo ang iyang sans rival,0
duol ang among eskwelahan sa estasyon,0
nganong dili ka mouban kanako,0
samtang nagahigda kini nga biniyaan,0
si tiquico akong gisugo nganha sa efeso,0
tanawa lang gyud ko,0
pinauyon sa inahan sa biktima nga wala siyay hibalan kung unsa ang hinungdan nga gipatay ang iyang anak giingon nila nga wala sila kaila sa kaaway niini,1
gitawag sa amerikano nga naturalista nga si roy chapman andrews ang fin whale nga ang greyhound sa dagat alang sa matahum,0
kanunay siyang ginakasaban sa iyang asawa,0
unya mitubag si eliphaz nga temanitanhon ug miingon,0
ug ang ubang mga judio nga diha sa mga lalawigan sa hari nanagtigum sa ilang kaugalingon sa pagtingub,0
init kaayo ang sopas,0
unya ang iyang igsoon nga babaye miingon sa anak nga babaye ni faraon molakaw ba ako sa pagtawag kanimo ug usa ka iwa sa mga babaye nga hebreohanon,0
gilauman sa national task force against covid nga sa tungatunga sa sunod nga tuig hangtod sa sayong bahin sa makuha ang bakuna sa pilipinas,0
tungod kay ang mga adik nagtuyoktuyok sa pagdula sa makina sa yawa matag higayon nga makapanimaho sila og droga ug kung mawala o mahurot ang ilang gipamalit nga shabu,1
ang hayop adunay pito ka cervical vertebrae,1
iyahat ang inyong mga mata sa kalangitan,0
nagpakita sila og usa ka bagong produkto sa telebisyon,0
lain ang gibati o paminaw ko,0
murag siyag nang luspad,0
wala silay saksi sa krimen,0
walay motuo sa imong mga saad kay walay padulngan,0
kung gikapoy naka sa katre na ka,0
mamalit ko ug mga duga sa groselya,0
daghang gatus nga mga tawo gipatay sa ilalum sa kung unsa ang mahimo nga usa ka ex post factoligal nga kahikayan,1
pildihon nato ang mg hapon,0
lambo ang ibanting sa tabanug,0
nahutdan kita og krema,0
sumasama ang nawong sa acropora parahemprichii ug acropora sekiseiensis,0
ug kini anha sa ibabaw ni aaron kong siya magaalagad ug hidunggan ang tingog niini kong siya magasulod sa dapit nga balaan sa atubangan ni jehova,0
ang mineralized tissue niini gilangkuban ug aragonite calcium carbonate,0
ug mao kadto nga sa paghiabut nila sa taliwala sa ciudad,0
ug gipatugbaw ni esau ang iyang tingog ug mihilak siya,0
ug sa ikanapulo ug lima ka adlaw niining bulana maoy usa ka fiest sulod sa pito ka adlaw pagakanon ang tinapay nga walay levadura,0
kuha palihog og taxi,0
unya ang pulong ni jehova midangat kanako nga nagaingon,0
ipiyong imong mga mata sa sulod sa tulo ka minuto,0
gikundina ni obispo gerardo alminaza ang diyosesis sa san carlos ang pagpatay sa mga sibilyan ug lokal nga opisyal sa syudad,1
busa karon dili unta ang akong ginoong hari magpahiluna sa maong butang sa iyang kasingkasing,0
ug gihalad niya ang haladngasinunog,0
ug siya giapas ni simon ug sa iyang mga kauban,0
wala koy mabuhat aron mahibawan,0
pasayloa ko napakuratan tika,0
ug mitoo siya kang jehova,0
naghimamat kami kaniadtong domingo,0
giilia usab kini nga home of historical and natural treasures,0
busa sila gibutangan nila ug mga tinugyanan sa buhat,0
ug kamo mingtubag kanako,0
ug ang sacerdote magabuhat sa pagtabonsasala alang kaniya sa atubangan ni jehova,0
migawas sa pagtuon bago ra sa commission on human rights ug australian national university nga kadaghanan kuno sa mga pilipino uyon sa silot nga kamatayon,0
kahimo ug lugar nga pirme gilampaso sa balud,0
endemiko kini sa pilipinas,0
kay si jehova nga inyong dios magalakaw uban kaninyo sa pagpakigaway alang kaninyo batok sa inyong mga kaaway,0
hain man dapit ang inyong balay,0
adunay maibug sa pagkahakog gayud sa tibook adlaw apan ang matarung nagahatag ug wala magatungina,0
pwede na nimo himuon,0
nagkilaw sila wally ug jerry sa baybay,0
sunda ko sa kuwarto,0
walay mopasalamat nimo bisan unsa imong gibuhat,0
nakalista kini sa apendise i tungod kay kini nga species giaklas ingon nga nameligro sa tibuuk nga bahin niini o usa ka mahinungdanong bahin sa ilang populasyon ug ang mga partido sa cms ang maninguha nga istrikto nga maprotektahan kini nga mga hayop,1
naghuwat diay si tom,0
kini ang bugtong simbahan o basilika nga puthaw,0
ug sa pagtanaw ni raquel nga siya wala makahatag ug mga anak kang jacob,0
nagaluto ug tsitsaron ug tosino si leo,0
dili niya madawat kung unsa ang nahinabo sa mayor,0
klaro nga gikapoy na siya,0
kon ako kay usa ka langgam molupad ko paadto nimo,0
ug si cos nanganak kang anob,0
apan si sarai apuli,0
ang ofw nga inahan ni fabel pineda,0
ug kamo nanghibalo nga sa bugos ko nga kusog nagalagad ako sa inyong amahan,0
apan kong ang iyang bana magapugong kaniya sa adlaw nga siya makadungog niini,0
kinahanglan ni ken nga modagan og paspas,0
palihog og hulat nako,0
nahadlok ka tungod sa imong ginooginoo,0
nadamgohan niya iyang balay,0
ug ngano nga gipatungas mo kami gikan sa egipto aron sa pagdala kanamo niining dautan nga dapit kini dili mao ang dapit alang sa uma,0
kalamay ug duga sa kalamansiang among esnak sa balay,0
adunay kalahian ang ingles sa britaniko ug amerikano,0
binubulay na pundador sa ulahi nga astronomiya si nicolaus copernicus,0
mahadlokon sab sa astronomiya,0
iunsa man nimo ang kwarta,0
ngano nga mikalagiw ka sa tago gayud,0
ang mga tawo ang modagan,0
mas lami ang sabaw sa butong,0
gikawatan ko niya g kwarta,0
ug si arphaxad nanganak kang sala,0
bisan kinsa nga tawohana sa kaliwatan ni aaron,0
walay gusto magpakiguban nimo kay way ayo ka,0
ug ang iyang ngalan pagahinganlan sa israel ang balay sa binadbaran sa sapin,0
ug miingon si faraon kang jose ingna ang imong mga igsoon buhata ninyo kini luwanan ninyo ang inyong mga hayupan,0
ginatawag nga seine ang sapa nga nagaagos sa paris,0
maong niwang si tom kay bitokon,0
nagadula ako katong nakabati ko sa linog,0
sila usab mao ang pito ka mga hari,0
ganahan siya nga tabang ang iyahang pagkaon,0
ngano naay gusto mopatay kay tom,0
nakasabot ka sa buot ginapasabot nako di ba,0
naka hinumdom ni tom,0
muadto mi didto apan wala kay labot,0
ug sa nanaglugsong sila sa bukid,0
nakakita ka og usa ka buotan nga lalaki,0
ug si jehova miingon ikaw may kaawa alang sa tabayag,0
dili sa atong mga amahan gibuhat ni jehova kini nga tugon,0
dili pa masiguro kung kanusa dalhon ang patayng lawas sa mayor sa municipal hall sa los baos para sa paghatag og pasidungog niini ug para mas daghan ang makahatag og ulahing pagrespeto niini,1
kapila nami wala tug ani sa tinuod,0
ug siya miingon manumpa ka kanako ug siya nanumpa kaniya unya si israel sa iyang kaugalingon miyukbo didto sa ibabaw sa ulohan sa higdaanan,0
gisuportahan niini ang lainlaing mga ihalas nga hayop,1
natapulan ang mga tawo,0
kini nga mga hayop mga crepuscular,1
minyo na siya ug adunay duha ka mga anak,0
dunay tinta nga kolor bulawan ang kaligrapiya ni casper,0
ang maong sugo nga nagsaad ug kinabuhi nasuta nga nagdalag kamatayon alang kanako,0
ug sa diha nga mangutlo kamo sa uhay sa inyong yuta,0
usa ka hayop ang nakita sa habagatan sa sydney,1
kini mao ang kasugoan sa diha nga ang usa mamatay sulod sa balongbalong bisan kinsa nga magasulod sa balongbalong ug ang tanan nga anaa sa balongbalong,0
dili ko gustog ing ana kadugayg pinaabot,0
lunsay ra ang pamuyo ni og,0
ibalik ra nakao ang basahon sa labing dali na panahon,0
ug si isaac mipahawa didto ug gipatindog niya ang iyang mga balongbalong sa walog sa gerar,0
ginakaon sa lalaki ang dakong puti na tosokoleyt keyk,0
mura kadto ug tinood,0
ganahan ko nga moatend og parti,0
ug iyang gitudloan sila sa agianan sa pagsulod sa ciudad,0
kambyuon nato atoang mga relo,0
ug sa katilingban sa mga anak sa israel,0
unta ikaw anaa sab sa maayo,0
pagpundo kung asa man ka,0
sa tanan nga adlaw sa iyang pagkabinulag,0
unsa ang labaw nga importante,0
naggimata si tom sa iyang iro sa tungang gabii,0
nagpakaaroningnon siya nga natulog,0
dili kaayo gakaon ug karne si tom,0
mao usab kini ang panimalay saberrot nga nawong nga parrotfinch ug monitor sa kalasangan sa northern sierra madre,0
parehas nga tomboy si risa og yolanda,0
ang pagbago bulawan sa mga motibo sa baroque,0
ug si balac miingon kang balaam wala ba ako magpasugo kanimo sa pagtawag kanimo ngano nga wala ka umahi kanako dili ba ako makahimo sa pagpasidungog kanimo,0
ug tungod nga grabe kini nga sakit,0
gusto ko malipayon ka,0
iyang ginabadlong ang dagat,0
dali ra kaayong maadto sa barko ang pulo,0
nasayud ako sa dapit nga imong gipuyan,0
sa mga dios sa katawohan nga anaa nagalibut kaninyo,0
ang northern negros natural park usa ka panalipod nga lugar sa pilipinas nga nahimutang sa amihanang bukirong kalasangan nga rehiyon sa isla sa negros sa kabisayan,0
ginalimod ba to nimo,0
kanimo oh jehova bayawon ko ang akong kalag,0
dili mi matayog niini,0
ug silang tanan mga napulo ug duha ka tawo,0
ug miingon si laban tanawa,0
dili ko alerdyik sa penisilin,0
nangayo siya og daghan nga kwarta,0
pagkahuman sa kusog nga ulan nibaha og grabe,0
dili ko sigurado kung kanusa siya mobalik og adto,0
naulahi mi tungod sa bagyo,0
palihog ayaw kamo og tanaw og telebisyon,0
way mopasalig sa imong mga plano,0
ug si gera ug si sephuphim ug si huram,0
kini tanawon tinuod nga batanon nga magtutudlo namo,0
ug kanuman ug usa ka libo ka asno,0
ug miingon siya dili ka magduol dinhi huboa ang imong mga sandalias gikan sa imong mga tiil,0
kadto kay mahikang bilang,0
daghang keso daghang buslot,0
mga igsoon pagampo kamo alang kanamo,0
kabalo ko sa kostumbre,0
daghan mga paniki galupad pag hapit na mugabii,0
kini usa ka daan nga libro,0
katong mga milabay nga tuig naminaw ko sa radyo,0
kinsay nag butang ug baki sa akong katre,0
ay ilahang ginagamit ang manwal sa sikolohiya,0
busa didtoy nahatag gikan sa mga linibo sa israel,0
kinsay nag suwat aning libroha,0
