apan siya hingkitan nila didto sa halayo,0
layo pa ang ugma maoy atubanga ang karon,0
grabe ang sakit ni tom,0
natog gihapon akong igsoon nga laki,0
giangkon nako nga tama siya,0
hinumduman mo ang gibuhat ni amalec kanimo sa dalan,0
siya ra ang niabot sa parti,0
dili na maayong rason,0
nahimong storya online ang usa ka surprise birthday party para sa usa ka opisyal sa zamboanga kay gibuhat kuno kini pila ka adlaw mahuman nga naay nagpositibo sa covid sa ilahang opisina,0
karon nahitabo sa tapus ang kamatayon ni moises,0
pagapasidlakon ni jehova ang iyang nawong sa ibabaw kanimo,0
alang sa ex new zealand ug maine,0
pipila ka tuig ang milabay,0
ug sa mga tawo,0
ug ang ilang mga haladngailimnon pagahimoon sa tunga sa hin nga vino sa usa ka lakeng vaca,0
ginahugasan nako akong kamot tungod kay hugaw,0
bitaw naa koy suliran kaninyong amerikano,0
unta gipamati mo ako,0
daghang mga iru didto sa parke,0
ang gi kaon ni andong kay tinapay nga naay ube,0
usa ka libo gikan sa tagsatagsa ka banay sa tanang kabanayan sa mga anak sa israel,0
ug gitawag niya ang iyang ngalan si noe nga nagaingon kini siya magalipay kanato sa atong buhat,0
dili ko katou saimoha,0
daghang mga linta sa among bungtod,0
nitaas na sa ang ihap sa mga namatay sa sunodsunod nga pagboto sa jolo,1
kini nga singsing mahimong magsugod hapit m p ang diyametro ug maglakip sa kooperasyon sa usa ka dosena nga mga hayop,1
ug si edom mitubag kaniya dili ka moagi sa akong kayutaan,0
wa koy oras aron mukuha pa ug lain nga estudyante,0
layo ang imong maabtan,0
dili ko makadutsa sa gabii,0
mopauli ka na ba alang sa pasko,0
apan kong ang mamumuno sa bisan unsang panahona molakaw ngadto sa unahan sa utlanan sa lungsod nga dalangpanan,0
ang hugpulong alang kang eliana murag hugpulong sa bongbong,0
unsa ang gisulti ni tom mahitungod sa ako,0
kaniya mitubag sila nga nanagingon,0
dili ni ra ni magdugay ang pulong pulong,0
wala koy labot og unsa ang iyang gibuhat,0
dili ganahan si tom nga mag gabasero,0
kini kung wala karon,0
pirme siya nagareklamo mahitungod sa pagkaon,0
hapit dili mapildi si tom sa chess,0
pirme ka lang nagpataka ug buhat,0
giestorya na nako ang akong higala,0
sa pagpahibalo sa tuig sa kahimuot sa ginoo,0
ningbalik na ang mga estudyante,0
giingon ni dante nga si tomas namatay tungod sa pagkalason,0
kasagaran ang mga hapones kay madasigon,0
apan si jehova nagkuha kaninyo,0
ug gipasugoan nila si jose sa pagingon ang imong amahan nagsugo sa wala pa siya mamatay,0
unsay imo gibuhat karun adlawa,0
dili pa ko milyonaryo,0
kini gyud ang mga daan nga mga libro,0
naay mga bulak sa balay,0
ako sad niadto ko,0
ang nasud croatia kay naa sa habagatansidlakang bahin sa europa,0
gisalikway ni tom ang tanyag sa iyaha,0
ug si jose gibaligya sa mga mediahanon didto sa egipto kang potiphar,0
kanus a ka niabot sa hapon,0
ang mga guinikanan nako kay nanaghinigugmaay,0
kadtong mahabilin diha kaniya igalubong diha sa kamatayon,0
ug gihatag ni abraham ang tanan nga iya kang isaac,0
si tom ray kahibaw mubuhat ana dere,0
kini mao ang kaliwatan sa mga pilipinas,0
tingali gasigarilyo ka atubangan sa imong kompyuter,0
ug ang mga anak ni ruben,0
unya ang sacerdote magapapanumpa sa babaye uban sa panumpa nga panunglo,0
aduna ba kay reklamo,0
ayaw ni pang guniti,0
kang issachar si nathanael ang anak nga lalake ni suar,0
ang paminaw ni tomas kay bago siyang tao,0
ug kadtong dapita gihinganlan ni jacob sa ngalan nga bethel,0
mas maayog dili hisgutan nang butanga na,0
ang panit ang pinakadakong organo sa lawas,0
giunsa nimo pagabli ang box,0
ayaw pagbanha kung ingon ani ang okasyon,0
dili naga istorya og olandes ang akong mga ginikanan,0
ug ang hari sa asiria namati kaniya ug ang hari sa asiria mitungas batok sa damasco,0
ang batang bago pang molakaw bantayanan kaayo,0
usa ka dako nga painting ni henry tonks nga nagbitay sa flaxman gallery sa ucl nga naghulagway sa bentham nga nagaprobar sa mga plano sa bagong unibersidad,0
manginom ta og bubble tea sa dakbayan,0
pagbasa kung asa ka moundang,0
nagdahan ang batasan nimo,0
karon makalingaw unya mahimo ka makakaon daghang karmelitos,0
dada ko sa imong boss,0
panalangini ako bisan ako usab amahan ko,0
ug si joas miingon kanilang tanan nga nanagtindog batok kaniya makigaway kamo alang kang baal kun inyo ba nga luwason siya siya nga makigaway alang niini ipapatay ninyo siya samtang buntag pa kong siya ugaling usa ka dios,1
himuon nato ni nga mubo,0
dili ako makaadto karong gabii,0
nalatayan ang rider nga gilayong hinungdan sa iyang kamatayon ug naguba usab ang iyang motorsiklo,0
nakakanat ang kalayo kay wa ko makagahit sa kaingin,0
pakiusab gani sa imong gisulti,0
ug miingon kamo ania karon,0
ug midalagan ang usa ka batanong lalake,0
gihangyo nila nga hatagan siya usa ka maayong panumduman nga layo sa kontrobersiya,0
pila kabulak ang gipalit nimo,0
pirme kang nagpasiugda ug away,0
ug sila magabantay sa ilang katungdanan,0
nagadagan kami sa napulo ka kilometro,0
walay rason aron mahadlok,0
ug gituyod ni moises ang iyang kamot paingon sa langit,0
kay ang damgo moabut pinaagi sa daghanan nga patigayon ug ang tingog sa buangbuang maila pinaagi sa daghanang mga pulong,1
ang hinungdan sa iyang kamatayon wala gipahibalo,0
pwede ko nimo tabangan,0
ug si laban adunay duha ka anak nga babaye ang ngalan sa magulang mao si lea,0
ang sa ikawalo ka adlaw kamo may balaan nga pagtigum walay bisan unsa nga bulohaton nga inalagad nga pagabuhaton ninyo,0
layo ang sydney gikan ngari,0
baba ug paghugas ug kamot,0
dili gyud nako malimtan ang imong kabuotan,0
laay kaayo ning wa tay buhat,0
hoy unsay imong ginabuhat sa kwarto nako,0
ug namatay si sara didto sa kiriatharba,1
wa kabalo si tom kon unsa iyang hulatan,0
usa ka lake sa mga kanding alang sa haladtungodsasala,0
kong ang dautan motindog,0
nganong dili mo man nuon mi duawon,0
isulti mo sa tibook nga katilingban sa mga anak sa israel,0
nasayod sa kung unsa ang gibuhat ni tom,0
mas lisod ang pranses sa ingles,0
gusto nakong dadon na nga pawikan,0
mas datu siya kaya sa bisan kinsa diri sa lungsod,0
ug nagsugo si jose sa tinugyanan sa iyang balay,0
mahimo ba siya mo duaw sa miting ugma,0
ug sa nagkahiduol na siya sa pultahan sa lungsod,0
mas gwapa kang marika tuo sa ako,0
gitawag na nimo siya,0
ikaw magagahum sa akong panimalay,0
ug kini sila mao ang mga anak nga lalake ni aholibama,0
ganahan ko motanaw ug mga salidang akoang nahunahunaan,0
labi nakong ganahan ang magpabilin dinhi,0
inanay og kadaghan ang nahibaloan tang iningles,0
ang iho kay adunay daghang mga klase sa ngipon,0
wala gi saysay ni tom kung pila gyud iyang nabayran,0
pirme kang nagdala ug problema,0
ngitngit kaayo aron magbasa og libro diha,0
giunsa ba nimo pagsakay dinhi,0
perting tagasa anang pantalon halos moabot sa salog,0
migilok ang akong ilong,0
kay ang ilang mamamawi kusganon man siya magalaban sa ilang katungod batok kanimo,0
mga si katipuneros ang napatay sa giyera,1
ug pagatukoron ko ang akong pakigsaad sa taliwala kanako ug kanimo,0
ang tanang pagbulotan nga iya sa nahaunang mapintas nga mananap gihimo niya diha sa atubangan sa nahauna,0
ug kong ang babaye wala mahugawi kondili nga mahinlo,0
kinahanglan niya og usa ka sa tasa nga asukar,0
ang tanan kay mu ambak,0
murag adlawadlaw gabie sa pangangaluluwa sa baryo ni ricardo,0
kinsa ang nagbantay sa kini nga iro,0
ug sila magapatalinghug sa imong tingog ug ikaw moadto ug ang mga anciano sa israel,0
ang mga bao kay walay ngipon,0
wala ko kabalo kung asa na dapit,0
nagabansay siya sa balay adlawadlaw,0
wala koy bisan usa ka lungag sa ngipon,0
way mopakabana sa imong mga aksyon,0
pakipadayon ang estorta ninyo,0
sa akong kakurat buhi siya,0
salamat sa iyuhang pagkamaatimanon,0
kinsa ang imong una nga magtutudlo sa pransya,0
ayaw ko guniti uy,0
kinsa ka ug asa ka gikan,0
naghikay mi para kang sam,0
nag binuang ra ko,0
dalag ang bulak na gamay,0
anaay kambal ang akong inahan,0
walay motuo sa imong mga saad kay klaro nga walay kapuslanan,0
sa akong paminaw aduna koy taas kaayo nga hilanat,0
sa sugo ni jehova ang mga anak sa israel managpanlakaw,0
dili apan nagatenis ko,0
ug sila wala manghibalo nga si jose nakasabut kanila kay dihay maghuhubad sa taliwala nila,0
gihunahuna ba nimo na tabangan siya,0
isipon mo ang katawohan,0
sa ingon niana ang mga anak sa israel nagbuhat sumala sa tanan nga gisugo ni jehova kang moises niini nagpahamutang sila pinaagi sa ilang mga bandila,0
ang mga anak nga lalake ni jose sunod sa ilang mga panimalay si manases ug si ephraim,0
nikaon si nestor og butong,0
nagpagarbo ko sa akong mga anak nga babaye,0
si jose mao ang sanga nga mabungaon,0
usahay ang tatoebay murag si eliza katong sikayatris na kompyuter,0
lami ang ilang mga keyk,0
ganahan kog mag basa,0
ang katawhan kay mga unggoy nga padayon nagalambo,0
adunay tunok sa ilang mga dughan,0
ug mianha ang usa sa mga nakakalagiw,0
kinsa man ang baligyaan ni gregor sa awto,0
ug dadon ninyo nganhi kanako ang inyong igsoon nga kamanghuran,0
nakawala na ko sa akoang tatay,0
wala na koy panahon makigistorya sa imuha,0
motindog unta ang dios,0
ben ikaw na og hugas og mga plato,0
kini ang tibuuk nga paningkamot nga gisimbolo sa paggamit sa mga pulong sa lain nga tagsulat ang pagsulay ni fichte ug uban pang mga pilosopo nga magtukod mga sistema pinaagi sa kaigmat sa hunahuna ug sa pagsulay ni robespierre nga buhaton kini sa tabang sa guillotine kini ang nakatagbo kanato sa mga nagagay nga mga bersikulo sa butterfly sa among mga magbabalak ug sa musika ni auber,0
dakoa ang imuhang iro,0
ug igabutang ni aaron ang duruha ka kamot niya sa ibabaw sa ulo sa kanding nga buhi,0
kinahanglan motuman sa mga mando,0
awading ang ngalan sa planeta ni teteng,0
ang us food and drug administration nagpasidaan nga ang naguso nga benadryl challenge sa tiktok mamahimong makamatay,0
ug siya gibutang nila sa bilanggoan,0
isulat inyong ngalan ug address ani nga sobre,0
tinuod nga maayo ang sinehan,0
ngilad ang inyong relihiyon,0
ligdong bang tawo si mother teresa,0
kay ako mao man si jehova nga inyong dios busa,0
nasakit ko nagpundo ko sa balay tibuok adlaw,0
namalit ug monggos si doria sa palengke,0
ug ang asargadda ug ang hesmom ug ang bethpelet,0
naghuwat si tom sa kotse,0
ang database sa institut libre online uban ang pagrehistro sa login ang mga gitukod nga mga direktor sa institut,0
walay maka pugong sa iyaha,0
kina ang pinakaunang higayon nga abrihan nako ni nga sira,0
sumala sa census sa populasyon ni adtong,0
ug sa gisugo kamo ni jehova gikan sa cadesbarnea,0
ug bisan unsa nga mahikap sa tawong mahugaw,0
ikaw ang hinungdan sa kadaut sa mga plano,0
naghatag usab ang reserba nga hinungdanon nga dalangpanan alang sa mga hayop sama sa lagsaw sa pilipinas,1
asa ang dapat nato nga adtuan,0
gusto nako ang imong paghigugma,0
natingala siya sa iyang kadanghag,0
panabok kamo ngadto sa tarsis managminatay kamo,0
ikaw ra pirmi ang hinungdan ngano nga magubot ang tanan,0
unsay buot pasabot aning senyales,0
ug sila mingpanaw gikan sa moseroth ug mingpahaluna sa benejaakan,0
plamuot jud ni si mr bean,0
ug ang mga anak nga lalake ni jada igsoon nga lalake ni sammai si jether,0
adunay isda nga mulupad,0
gusto ra ka pirmi og pasidungog,0
pirme kang naglikay sa responsibilidad bisan klaro nga sayop nimo,0
busa ang arayis sa sakayan miadto kaniya,0
sama sa gibuhat nila sa pambobomba sa jolo cathedral kaniadtong disyembre na daghang nagsimba ang nangamatay,0
kinsa man unyay moatiman sa imong iring,0
naa ray usa ka batiis si tom,0
kay sila nanagpalagut kaninyo uban sa ilang mga lalang,0
busa ilang giiwayan siya ug siya miagi duol sa alagian sa mga kabayo ngadto sa balay sa hari ug didto siya gipatay,1
usa ka gidudahang gunrunner ang napatay sa engkwentro sa usa ka buybust operation nga gihimo sa pulisya criminal investigation and detection group cidg sa san jose del monte,1
ug sa mga adlaw nga nanglakaw kita gikan sa cadesbarnea hangtud sa atong pagabut sa sapa sa sered,0
ayaw mi ug kalimti,0
ug si faraon naghingalan kang jose,0
nagatuon siya og ingles kada adlaw,0
nikaon mi ug mga prutas human panihapon,0
kahibalo si tom kung unsa ang nalangkit,0
kinsa ba imong ganahan maistorya,0
siya misandig sa ako,0
naa syay karapatan nga magdesisyon para sa iyahang sarili,0
bisan pa niini walay kabus uban kanimo kay si jehova nga imong dios magapanalangin kanimo gayud sa yuta nga gihatag kanimo alang sa usa ka pagkapanulondon aron magpanagiya ka niini,0
gidakop ang aktibistang nga si amanda lacaba echanis,0
ang tinapay gihimo gikan sa harina tubig ug kanunay patubo,0
hawd ang handurawan ni nestor,0
kolor bughaw ang kilid sa salamin,0
tagnaa kung kinsa ang akong nakita karon,0
wala nagkahigayon si tom na buhaton kini,0
tinoud kini nga gatudlo siyag pranses,0
adunay gulaman sa ref,0
pagtanom mog ube sa palibot sa balay,0
ang nasamaran sa itlog kun naputlan sa kinatawo dili magasulod sa katilingban ni jehova,0
ug si jacob nasuko,0
gihatag niya sa ako ang sulat ug ninglakaw,0
tanan nga lahilahi na mga tawo nagpuyo sa tokyo,0
sa una akong gibasa kini,0
nag baktas si tom,0
mura ug interesado gayud si tom kang maria,0
gigamit ni tom ang tanan niyang bala,0
unsa pay buton nimo,0
sumulti ka sa mga anak sa israel,0
ug kong ang sacerdote magahiling niini,0
iyang gisulat ang kaugalingon niyang ngalan,0
pwede ba tika matabangan,0
panginabuhi kamo ang nagmugna,0
ang paon ginganlan og katahom,0
ug si canaan mahimong sulogoon niya,0
agham ng sansinukob ang astronomiya,0
sa mahuman mo ang paghatag sa ikapulo sa tanan nga ikapulo sa imong mga bunga sa ikatolo ka tuig,0
iring na o iro,0
nangandoy siya nga makaduaw sa paris,0
si jehova magapanalangin kanimo ug magabantay kanimo,0
ika tulo nga ni ulan sa biyahe,0
grabe ka tugnaw ang akong mga tiil,0
buot nako mahibalan ang mga detalye,0
kinsa ang gusto magsugod,0
ug gibutang ni moises ang mga sungkod sa atubangan ni jehova sa balongbalong sa pagpamatuod,0
imposiblen buhaton nako ang ingon ato,0
usa ka iro ang naligsan sa usa ka trak,0
ginadawat niya ang mga regalo,0
apan gipahigawas na kita karon gikan sa kasugoan,0
nagakaon ug dakong puti na tsokoleyt keyk ang lalake,0
di makalupad ning langgama,0
ug kong magalakaw kamo nga batok kanako,0
edi ayaw na ug pagduhaduha,0
ni abot ko sa tsina,0
magpabukal og ube sa kaldero,0
wala nakoy panahon nga sulatan pa siya,0
siya ang ulahi nga niabot,0
ang trak gikan sa butuan city ug padulong sa zamboanga city,0
nidaog ang estados unidos sa sangka padulong sa bulan,0
klit niulan apan naglakaw pa mi,0
ang dios dili usa ka tawo,0
ug ilang gisugilon kaniya ang tanan nga mga pulong ni jose nga iyang gisulti kanila ug sa nakita niya ang mga sakyanan nga gipadala ni jose aron sa pagdala kaniya,0
ang taksi draybir naay kalabotan sa kawat,0
ang tinuod na papaitan kay pait kaysa aslom,0
karon gisumpong siya sa iyang kabuang na pod,1
ihatag kini ni jose nianang lalaki,0
kaparehas ni sa akoang biseklato,0
oh panimalay ni levi,0
naglangkob kini sa mga headwaters sa tumaga river sa habagatang bukid sa zamboanga cordillera nga nagalagad sa mga kinahanglanon sa tubig sa pila ka,0
adunay nga numero sa tawo ug hayop nga gikulit diha sa rockwall nga lagmit gikulit panahon sa ulahing bahin sa neolithic,1
nahadlok ang aleman tungod kay dalag ang iyang beer,0
ug gituyod ni abraham ang iyang kamot,0
karon ipaingon sa panimalay ni aaron,0
ikaw lamang ang akong kaila nga kapareho nako og edad,0
ayaw ko samoka kon nagtuon,0
giisip ba nimong mobalik sa ingon ato nga paagi,0
naa bay rason imong pagpangutana,0
ug ang balangaw anha sa panganod ug pagatanawon ko kini aron mahinumduman ko ang saad nga dayon sa taliwala sa dios ug sa tanan nga binuhat nga buhi sa tanang unod nga anaa sa ibabaw sa yuta,0
ug iyang gihimo kadtong dautan sa mga mata ni jehova,0
mao ni ang akoang anak nga maalam,0
gahig ulo di kasabot,0
ug si jehova miingon kang moises didto sa median lumakaw ka,0
nakitan ni silvestre ang kobra didto sa parke,0
ug nahitabo sa pagkabuntag,0
ang iyang istorya pulos witwit,0
tulo sa mga kidnapper ni sohal ang napatay sa engkwentro sa mga awtoridad sa slex kaniadtong,1
ug nangadto sila sa mga sacerdote nga punoan ug sa mga anciano,0
palingkora si tom sa ulahi,0
ug siya gipanalanginan niya didto,0
unya pagahimoon ni jehova nga makapatingala gayud ang imong mga kamatay,0
busa mga hinigugma likayi ninyo ang pagsimba ug mga diosdios,0
unya ila kamong itugyan ngadto sa mga kasakitan,0
ug sila mingpanaw gikan sa horhaguidgad ug mingpahaluna sa jotbatha,0
ang mga polyp kay gipalapdan lang sa gabii,0
usahay rako gagawas inig lunes,0
sa akong hunahuna sayop ka,0
pasaway pirmi imong mga aksyon,0
yawyaw kaayo si pedro,0
ang a kay usa ka ekspresyon,0
tomas dili mahinumdom sa akong ngalan,0
ug kong mahulog ang ilang mga lawas nga patay sa ibabaw sa bisan unsa nga binhi nga igpupugas,0
kabalo naman ang tanan nga bawal magdikitdikit gumikan sa makatakod ug makamatay ang covid,0
ug si samson miingon magpakamatay ako uban sa mga filistehanon ug siya miduko uban ang tibook niyang kusog ug ang balay nahugno sa ibabaw sa mga kadagkuan ug sa katawohan nga didto sa sulod busa ang mga tawo nga iyang napatay sa iyang pagkamatay labi pang daghan kay kanila nga iyang gipatay sa buhi pa siya,1
naghulat kami sa dugay nga panahon apan wala siya mingtungha,0
arogante siya kung naa siya didto,0
sa banay ni ephraim,0
mahimo nga baki ang butete,0
naa siya sa simbahan karon,0
ug ang iyang panon ug kadtong mga naisip kanila,0
ug samtang ang mga anak sa israel didto pa sa kamingawan,0
nganong nagapangatik man ka,0
ug si jehova miingon kanako tumindog ka,0
wala man ko mosulat niya,0
dili mo anhi diri ang iyahang amahan tungod sa kabisi,0
nabuta ang iyang usa ka mata,0
ug managpanuol ang mga sacerdote,0
nagakaon si nestor og maja de ube,0
di pwede lugson ang bisan si kinsa,0
ang tanang mga lalake sa mga anak ni aaron magakaon niini,0
gitanom nila ning mga puno,0
nagalangoy ang bata sa daku nga suba,0
mao kini ang nagluwas kanako,0
pagahubgon ko sa dugo ang akong mga udyong,0
anaay parke sa mga langgam sa habagatan sa iyang dakbayan,0
wala madugta ang patay niyang lawas bisan pa pipila ka dekada na ning gilubong,1
ang paganalisar sa earwax sa usa ka lalaki nga asul nga balyena nga gipatay sa pagbangga sa usa ka barko sa baybayon sa california nagpakita nga mga kontaminado sama sa mga pestisidyo,1
nagapamuwak ang mga punoan sa mansanas,0
ang proyekto kinahanglan una nga igpakita sa mga pagpamati sa publiko sa konseho sa syudad sa manila ug sa lupon sa probinsya sa cebu tungod sa epekto niini sa klima,0
ug si jehova miingon kang moises hangtud anusa nga magatamay kanako kining katawohan ug hangtud anusa nga sila dili motuo kanako,0
namalit ug letsugas si doria sa palengke,0
mibalik si tomas ngadto sa iyang yutang natawhan,0
kondili nga ang tagsatagsa ka babaye magapangayo sa iyang silingan,0
ayaw na kini hunahunaa,0
dugay na ba to,0
mao nga milakaw si abram,0
ang adunay igdulongog kinahanglan magpatalinghug sa sulti sa espiritu ngadto sa mga iglesia kaniya nga magamadaugon,0
ningbalibad si defense secretary delfin lorenzana sa alegasyon,0
naa koy salapi pang palit ana,0
pirme kang gaapas sa uban kay di ka kabalo mobarog,0
udto na busa patya ang telebisyon,0
kahinumduman nga sa laray sa house speakership dili pa dugay,0
adunay halohalo sa ref ni karl,0
usa kini sa duha nga nahabilin nga mga kalasangan sa kapatagan sa isla sa negros,0
ikaw ra ang makabuhat ato,0
gisaad sa ginoo nga tanan katawhan mangamatay,0
sa pagsulti ni ephraim,0
ug kang ohio ug sasac ug jeremoth,0
ang ecosystem sa bakhaw usa ka lainlain ug puyanan sa daghang mga langgam,0
maayo ang panahon sa tibuok semana,0
pwede ka mu salom,0
ug igahalad ni aaron ang lakeng vaca alang sa haladtungodsasala,0
pagtukod kamo ug mga kalungsoran alang kaninyo ug sa inyong mga kabataan,0
kong ang imong igsoon mahimong kabus,0
kini mao ang mga panimalay ni levi ang panimalay sa mga levihanon,0
wala siya diri karon nganong ginapangita nimo siya,0
unsa ang naa gawas sa laniakea,0
kabalo ka wala nako to buhati,0
murag walay naminaw sa atoa,0
ug ang tanan nga vaca alang sa mga haladsapakigdait,0
ang kasuko nga nagtukmod sa usa ka tawo sa pagpatay sa iyang asawa tungod sa kasina dili usa ka halimbawa niini,1
wala may ganahan ug bastos nga mamaligyaay,1
ngano bang pagakuhaon ang ngalan sa among amahan gikan sa taliwala sa iyang panimalay,0
nalipat kag palong sa suga,0
kay kon wala siyay air bag patay sigurado siya,1
ug miingon kanila si isaac nganong mianhi kamo kanako,0
nanimaho ang imong tae,0
ikaw ang gitudlo nga lider,0
ug sila mingpanaw gikan sa punon ug mingpahaluna sa oboth,0
tawag didto ug ambulansya,0
daghan mga loro galupad sa tamnanan sa kastilyo,0
hangtodhangtod niya higugmaon iyang asawa,0
motulo ka tuig nang nagtuon si tom og french,0
gakaon si pedro karon sa tsokolateriya sa baryo,0
ug si jehova misulti kang moises ug kang aaron nga nagaingon,0
kabalo ko sa nindot nga kastilyo,0
gusto nako nga imbitahon ka sa parti,0
wala siya mahilunang nia ang iyang amahan,0
ang pulong ni jehova midangat na usab kanako nga nagaingon,0
gibohusan ako sa iyang kalagot,0
nganong gatago si tom,0
ug sa nahiadto na siya didto nga gidala ngadto sa iyang inahan,0
nagbukal sa kainit ang tsa,0
di ka kabalo moatubang ug realidad,0
wala pa nagsugod si mary,0
john lloyd sa pagkaadunay anak kakuyaw walay makatupong sa kalipay,0
ang manibela sa mga awto nga amerikano naa sa wala,0
busa kinahanglan panglimbasugan ta ang pagsulod sa maong kapahulayan,0
sa pagabut ni eliseo diha sa balay,0
nanay mo ba siya,0
kinsay dili gatugon saamoa,0
kami kay wala gikapoy,0
apan ang tambok ug ang mga amimislon,0
wala nako giprito ang donat,0
ug ang sacerdote magahiling kaniya ug,0
gumikan sa akong kadangag daghang sayup sa akong mga kapahayag,0
mura daw mo ug babae,0
nagbuhat ug pandesal si daniel,0
gusto ko og keyk nga asul,0
kinsa bajud ang naay labot,0
apan kong adunay tawo nga magadumot sa iyang isigkatawo,0
adunay pipila ka mga bukid nga nabuak tungod sa sobrang pagkaupaw pagkahuman sa pagpamutol og mga kahoy,0
naggilok ang akong tiil,0
naa sa dakong kwarto ang parti,0
karon ang mga ciudad sa banay sa mga anak ni benjamin,0
yugyoga ang mansanitas aron molagas ang mga bonga ug dahun,0
gipintalan og puti aron mas dako kining balay,0
nasuko siya sa amoa,0
mao nga giingon niya nga ang pagduaw sa mga namatay sa niining panahon sa pandemiya dili kinahanglan buhaton sa kadaghanan ug sa parehas nga oras,1
ganahan ko sa iro,0
unsang oras nihawa ang una nga tren,0
kini gilangkuban sa isla sa olango ug ka nga mga islet sa satellite sulpa,0
gisagol ni nellie ang malipukon sa harina,0
ug adunay nagakalainlaing pagalagad apan mao rang usa ka ginoo,0
murag milyonaryo si tom,0
gipatay ang mga isda ug namala ang mga tanum,1
nanguna gihapon ang estados unidos nga adunay labing kataas nga mga namatay tungod sa covid nga adunay,1
ug siya nangita apan wala niya hikaplagi ang mga diosdios,0
daghan og bulak sa tanaman ni juan,0
ug si ahola nakighilawas sa diha nga naako pa siya ug siya nabuang sa iyang mga hinigugma,1
lami ang morcon ni esmeraldo,0
ayaw kawadi og paghandom wa pa nawala ang tanan,0
alamdag sa hunahuna ang sikolohiya,0
walay sadan sa nahitabo,0
ikapilang presidente sa pilipinas si pnoy,0
ginapakaon ni antonio si celeste og tinutong,0
wala kay kapasidad nga magdala ug sakto nga mga desisyon,0
ug si jacob mitubag ug miingon kang laban kay nahadlok ako,0
ug minglakaw ang mga anak sa israel ug napahaluna sa mga kapatagan sa moab,0
ang mga anak nga lalake ni benjamin sunod sa ilang mga panimalay sa kang bela,0
ug ang hari nagpaadto ug nagpatawag kang semei,0
ang mga tawong mapahitason naghunahuna nga sila labaw sa uban,0
layo pa ang ugma maoy atubanga ang karon,0
gusto ni tom nga musulti,0
unya miingon ang hari ang usa miingon mao kini ang akong anak nga buhi,0
ug gisuginlan si rebeca sa mga pulong ni esau nga iyang anak nga kamagulangan ug iyang gipasugoan ug gipatawag si jacob nga anak niya nga kamanghuran,0
ug ang tanan nga mga anciano niadtong ciudara nga labing haduol sa gipatay nga tawo,0
diyutay ba lamang kini nga butang nga gidala mo kami gikan sa usa ka yuta nga nagapaagay sa gatas ug dugos,0
kini nga mga flukes gibangon ug gibugatan sa taas nga mga hampak,0
naay mga punuan sa makopa ang tanaman ni juan,0
ang mga mutant mahimo nga labi ka grabe,0
di ka kabalo mosunod ug mga simple nga patakaran,0
ang yuta sa egipto anaa sa atubangan mo papuyon mo sa labing maayong yuta ang imong amahan ug ang imong mga igsoon nga lalake papuyon mo sila sa yuta sa gosen ug kong makamatngon ka nga sa ilang taliwala adunay mga tawo nga mga masingkamuton ibutang mo sila sa pagkapangulo nga mga magbalantay sa akong mga vaca,0
o kong siya makasamad kaniya uban sa usa ka hinagiban,0
ug bisan kinsa nga kalaga nga magakaon niadtong namatay sa iyang kaugalingon,1
gibisita nako ang panaderya,0
ang tanan lakip ang mga archive sa parokya gisunog,0
apan dihay mga judio nga nangabut didto gikan sa antioquia ug sa iconio ug sa nadani nila ang mga tawo,0
namulok na kining saging,0
nakitan nako ang eroplano,0
wala niandar ang kompyuter ni tomas,0
ug sa ilang pagkabasa niini nangalipay sila sa tambag,0
ug ang mga kalungsoran mamahimo alang kaninyo nga dalangpanan gikan sa magpapanimalus,0
tingali ang pagkabuang sumbanon sa imong pamilyaha,1
tungod sa paghunong sa prc sa pagproseso sa covid tests,0
nagkaalarma daghang tawo sa alemanya sa kahimtang sa nasud,0
kang kinsa ni kwarta,0
ang pulong ni jehova midangat kanako pagusab nga nagaingon,0
dili ko makaingon nga nakuyawanko,1
si moises nga akong alagad dili sama niini siya matinumanon sa tibook ko nga balay,0
buhaton ko gyud na,0
nagkinatawanay ang mga estudyante,0
ug si jehova namulong kang josue ayaw kahadlok tungod kanila kay ugma niining panahona igahatag ko nga patay silang tanan sa atubangan sa israel ikaw magakiting sa ilang mga kabayo ug magasunog sa ilang mga carro sa kalayo,1
maayo nga marka nako sa iningles,0
wala niabot ang mga suki,0
dili ninyo pagipalaglag ang banay sa mga panimalay ni coath gikan sa taliwala sa mga levihanon,0
busa ayaw kamo pagpakigambitay kanila,0
ga droga ang magasawa og dili sila malipayon,0
