ug mitubag si abraham ang dios sa iyang kaugalingon magatagana sa nating carnero nga igahaladngasinunog,0
gipa duyog nimo ug gitara si tom,0
nalibang ang bata samtang kini naa sa tulunghaan,0
ang mga tanom butang kanon naglakip sa mga saha sa tamon nga mukatay sa ilalom sa yuta,0
dili na kamo maghatag ug dagami sa katawohan alang sa pagbuhat ug tisa ingon sa gihimo hangtud karon ug pasagdi sila nga maoy moadto ug manguha ug dagami alang kanila,0
ganahan ko ug mga iro,0
nagpadayon ang pagpangita ug gikahadlokan nga napatay usab ang duha nga mga engineer,1
iyaha to nga balay,0
mas ganahan si drake og suman,0
nakatilawan mo na ba ning putahea,0
kung gusto nimo mohilak hilak ka,0
apan ang inyong mga bata nga gagmay,0
pagdali aron ma apsan nimo,0
nakigkita kini sa apendise i tungod kay kini nga mga species giklasipikar nga nameligro nga mapuo sa tibuuk nga tanan o usa ka hinungdan nga nahimog usa ka tinago nga bahin ug ang mga partido sa cms ang tanawon nga nahigugma sa pagbantay sa mga hayop,1
sumala sa tanan nga imong gipangayo kang jehova nga imong dios sa horeb sa sadlaw sa pagkatigum,0
nagakaon si nestor og sopas na monggo,0
pila man ang plete,0
niadto siya sa daghang siyudad,0
mas lisud pa kay sa imong hunahuna,0
ang patayng lawas sa biktima ipaubos sa autopsy,1
kini ang ampay kong plano,0
nagsuot og arites si mary,0
wala madugay human niadto siya gibanlas sa balanga bataan,0
nisulat siya og usa ka libro tungkol sa tsina,0
kinsa man ni akong kaistorya,0
ug tungod niini ang damgo gihimo sa nakaduha kang faraon tungod kay ang maong butang gitukod sa dios,0
walay manga na asul,0
wala nay mabuhat imong pagbasol sa iyaha sa aksidente,0
nganong buot kamo nga mangamatay,0
ug gipasulod siya ni isaac ngadto sa balongbalong sa iyang inahan nga si sara,0
ibaligya nako ang alahas sa mga pumapalit,0
ang lebel sa inyong kaalam sa sikolohiya kay primitibo pa,0
ug gihinganlan kini ni laban ug jegarsahadutha apan gihinganlan ni jacob ug galaad,0
ang pagpakaon sa mga balongbalong sagad makita sa gabii,0
maingon sa pagkuha niini gikan sa vaca nga lake sa mga haladsapakigdait ug ang sacerdote magasunog kanila sa ibabaw sa halaran sa haladngasinunog,0
ayaw kalimot kandadohan ang pultahan,0
lisod sabton iyang teyorya,0
ang kusgan sa taliwala sa mga gamhanan mosulti kaniya gikan sa taliwala sa sheol uban kanila nga magatabang kaniya sila mingkanaug,0
kinsa ang gusto nimong estoryahon,0
nganong niingon kag babye,0
busa si hari dario mitimaan sa sinulat ug sa sugo,0
makita usab ang nailhang datos nga labaw sa milyon nga mga tawo ang namatay tungod sa covid samtang labaw sa milyon nga mga tawo ang naayo,1
naay nakaingon sa akoa nga kana nga bata dili makadungog,0
ug ang anak nga lalake sa usa ka babaye nga israelhanon,0
walay motuo sa imong mga gipangsulti bisan sa imong kaugalingon,0
daghan nga tao ang nitambong sa lubong,0
namuwak ug daghan ang punoan sa tseri,0
malisud ingon sa gibuhat mo,0
abi nako giingon nako sa imoha nga dili maganhi dinhi,0
ug magabutangbutang kaniya ug makauulaw nga mga butang,0
wa kay abilidad nga makadawat ug kritisismo kay gahig ulo ka,0
gipagpaliban ang dula sa sunod domingo,0
isipon mo ang tibook nga katilingban sa mga anak sa israel,0
ang mga bungbong nga nagbulag kanila nagsilbing mga butil,0
nganong wala ka sa direktoryo sa telepono,0
wala siyay mga tambal,0
nga niini mosulod si aaron sa dapit nga labing balaan uban ang usa ka nating vaca nga lake alang sa haladtungodsasala,0
kinsay naka diskubre sa amerika,0
wala ka nag inusara,0
malipay gyud siya kon madungog to niya,0
walay garantiya kung kanusa matapos ang pagpatay sa atong mga isigka abogado,1
nagakaon si nestor og dinuguan,0
ang balaod sa manggialamon maoy usa ka tuburan sa kinabuhi,0
ang pagtimbaya ug pasalamat maoy makalipay kanimo,0
ug ang katawohan giuhaw sa tubig ug ang katawohan nagbagulbol batok kang moises,0
ang mga buta makakita na,0
kay kon ang usa ka tawo dili makamao nga magdumala sa iyang kaugalingong panimalay,0
kagahapon nakadungog ko og usa ka maayo nga kanta,0
unsa sad ang uyab niya,0
di ka kasabot bisan sa pinakasayon nga trabaho,0
ug ang iyang mga kaigsoonan sumala sa ilang mga panimalay sa natukib na ang kaagi sa ilang mga kagikanan ang pangulo si jeiel ug si zacharias,0
kalit ra siyang nahilom,0
ayaw og lakaw nga wa kay nakuha,0
dili ka magbuhat ug pagkadilimatarung sa paghukom dili ka magpasulabi sa kabus,0
ang kapital sa hungary mao ang budapest,0
nagakaon si nestor og pan de ube,0
daghang mga aspeto sa epistemology ang gihisgutan usab ni socrates,0
ang akong iro kanunay nagahigda sa kasagbutan,0
dili himoang basta basta ang leptospirosis tungod ky pwede na mamatay,1
unsang orasa ka mo hawa,0
kinsa to gani ka,0
hinoon gibautismohan ko usab ang panimalay ni estefanas gawas niana,0
ang dumuloong ug ang sinuholan dili magakaon gikan kaniya,0
isa ka basong tubig sa gud doy,0
daghang mga pangpublikong lawas ang dili obligado sa pagsunod sa balaod,0
nagunsa mo sa taas,0
unsa ang ilang itukod diri nga lugar,0
sigurado nga masaligan nimo siya,0
nakita ang patayng lawas human ireklamo sa mga lumulopyo sa lugar ang nialisngaw nga baho gikan sa sapa nga pagtuo nila nga basura lamang,1
ug siya nagminatay sa paghilak ug nanagpakadungog ang mga egiptohanon,0
siya ang gitawag nato nga batang lalaki nga brilyante,0
naay lahi nga humot ang mga buwak,0
kung nasamok sila nasuko,0
ako usab naggawi batok kanila,0
ug dili mo hagdawan ang imong parrasan,0
sa taginit mugamit og payong aron landungan ang nawong,0
didto ra ko sa luyo mulingkod,0
ug akong pagabuhaton kanimo ang usa ka daku nga nasud,0
sila nanagpaabugho kanako tungod sa dili dios nanagpasuko sila kanako tungod sa ilang mga parayeg ug dasigon ko sila sa pagpangabugho niadtong dili katawohan,0
mao nga ang gasa miuna kaniya,0
dili kini barato dili ba,0
ug kong tungod niining mga butanga dili kamo magmatngon kanako,0
kaniadto nagapangisda ko og pipila ka oras kadabakasyon,0
bago si tom dinhi,0
ug ang ilang haladngakalanon ug ang ilang mga haladngailimnon alang sa mga lakeng vaca,0
si joseph ang modagan,0
ug sa pagsulod ni moises sa balongbalong nga pagatiguman aron sa pagpakigsulti kaniya,0
ug kami mingtubag dili kami makahimo sa pagadto kong ang among igsoon nga lalake nga kamanghuran makauban kanamo,0
kong sa pito ka pilo pagapanimalusan si cain,0
dili ta ka mapasaylo,0
karon ang akong adlawng natawhan,0
ang paghigugma ang pirmi mahimong tuyo sa kon kinsang mangdaot,0
ug kini mao ang mga ngalan sa mga anak ni levi sumala sa ilang mga kaliwatan si gerson,0
ang endemiko sa pilipinas nagpuyo sa mga kalasangan ug kagubatan,0
kinsa ang imuhang nakasugat,0
ug ang mga kalungsoran nga inyong igahatag ngadto sa mga levihanon,0
katloan ka gatasan nga camello uban ang ilang mga nati,0
ug si jehova miingon kang moises ug kang aaron kumuha kamo ug mga kinumkom nga abo gikan sa hudno,0
di pa hinog ang mga saging na kini,0
ug mitubag siya ambut magbalantay ba ako sa akong igsoon,0
ug gipanalanginan niya si jose,0
nasamad ang akong abaga,0
kon nabalan niya ang tinuod iingon niya sa atoa,0
dili gusto si tom saakong gihatag,0
nagpuyo siya sa nueva york,0
sigurado nga malipay siya,0
gihatag nakog dakong gakos si tom,0
wa ka gitugtan og anha dira sa sulod,0
nganong dili nimo tanawon ang kini nga mga impormasyon,0
ni lingi siya sa dihang nabati niya ang tingog niini,0
kaniadto kay pulo ka tuig lang siya,0
naay usa ka babayeng tagaamerika sa among klase,0
ang usa ka anak nga manggialamon maoy kalipay sa iyang amahan apan ang usa ka tawong buangbuang nagatamay sa iyang inahan,1
tama na na para karong adlawa,0
abi ba nako og amerkano siya,0
gitabangan ko ninyo ug gusto sad nako kamo tabangan,0
maka mugna ba ka ug mga tambal gikan sa laboratoryo,0
apil sa naangol ang usa ka kapitan sa pulisya,0
kinsa ang moapil sa miting,0
ug si lot miingon kanila o,0
unya miingon si jehova kang moises tuyora ang imong kamot ug kupti siya sa ikog ug iyang gituyod ang iyang kamot,0
ug bisan kinsa nga tawohana sa mga anak sa israel,0
magunsa ka kon ikaw sa akong sitwasyon,0
nagpaatikatik siya nga doktor,0
pagbantay unyag kining imong hidunggan imung ilagablab,0
hawod magbayle akong amigo,0
ginakaon ni antonio ang tintuong,0
tungod kay grabe ka init nakabentilador sila sa ilang balay,0
nahibalan usab siya nga usa ka una nga tigpasiugda sa mga katungod sa mga hayop,1
ug ang sacerdote magabutang sa lana nga anaa sa iyang kamot sa ibabaw sa langodngod sa dalunggan nga too niadtong pagahinloan,0
wala ba kamo mahibalo nga kitang tanan nga nabautismohan ngadto kang cristo jesus gibautismohan man ngadto sa iyang kamatayon,0
nangutana siya bahin sa kung diin ang balay,0
girepresenta niya ang iyang klase sa panagtapok,0
ningbusikad na ang mga magnolia,0
basin ang ubang uniberso kay murag tinuod,0
kadto lamang nga panganay sa taliwala sa mga mananap,0
ug sa nakita ni jehova,0
kay siya nagapabutalid sa daghang mga samaran oo,0
alang sa duha ka distrito ang taguigpateros nila cayetano ug asawang lani cayetano kay p bilyon gikan sa dpwh,0
naa na sa trabaho si angeline quinto,0
ug miingon sila kang moises tungod ba kay walay mga lubnganan sa egipto,0
pagalaglagon ko usab ang yuta,0
ug kining mga butanga mamahimong alang sa usa ka batasan ug tulomanon nganha kaninyo ngadto sa tanan ninyong mga kaliwatan sa tanan ninyong mga puloyanan,0
magsulti ka sa mga anak sa israel,0
daghan mga loro galupad sa ganghaan sa kastilyo,0
kondili sa dapit nga pagapilion ni jehova nga imong dios,0
ni apas si tom,0
kabaw mu buhat si dindin ug tocino de cielo,0
ug si asa natulog uban sa iyang mga amahan,0
natanom og rosas si isabela sa tibuok palibot sa balay,0
ang tiyera kay ang atoang planeta nga asul ug lunhaw,0
kinahanglan nako pakaunon ang akong mga iring,0
nganong dako ang bulan karong gabhiona,0
nahinumdoman nako nga nagsulob siya og berde nga kalo,0
dili tanan nakabalo kung unsa ang iyang buot ipasabot,0
apan sa pagkadungog niini ni jesus,0
ingni si tom kung nganong dili ka makaadto,0
taba ko sa imong pananaw,0
kini sila mao ang mga anak nga lalake ni ham,0
dili ganahan si tom ug mga dalagang puno ug meykap,0
ning lingkod siya daplin sa sapa,0
mitindog ako sa taliwala ni jehova ug kaninyo niadtong panahona,0
ug mitubag siya kang ephron,0
pagsugod na ug kanta,0
dili pwede ang iro sa iyang syudad,0
naga esno sa dakong lungsod,0
gilangan niya ang iyang biyhae padulong og meksiko,0
gipaubos niya ang iyang ulo sa kaulaw,0
pirme kang magdahom nga ikaw ang bright bisan walay mopasan nimo,0
taas kaayo ang akong sayal,0
ingna si tom kon unsa imong nadunggan,0
ug si laban mibangon pagsayo sa buntag,0
ug sa tuig nga ikapulo ug upat miabut si chedorlaomer,0
mga wala damhang linugdangan kadto toy gipahibalo,0
kinsay nagsupot sa akong manok,0
ug sa pagkakita sa mga igsoon ni jose nga ang ilang amahan patay na,1
basi sa ulahi nga tala,0
wala ko magtrabaho hangtud karon,0
ug mahitungod kang semaias ang taganehelam sumulti ka sa pagingon,0
unta mokaon kami sa restwran sa france,0
kang kansang mga tagiya nagapatay kanila,1
ug ang hebehanon ug ang arcehanon ug ang cinehanon,0
kay si jesus misugo man ugod sa mahugawng espiritu sa paggula gikan sa tawo kay sa makadaghan siya pagadakpon niini siya gipabantayan ug gitalikalaan ug giposasan,0
walay mopasalig sa imong gipaningkamotan,0
nagpataka ra ka pirmi ug panulti bisan way klaro,0
magsingkamot kamo sa pagtuman sa tibook nga sugo nga gisugo ko kaninyo niining adlawa,0
ayaw og lantaw saakoa,0
gisugyot ni robin waterfield nga ang socrates usa ka boluntaryo nga scapegoat ang iyang kamatayon mao ang nagputli nga tambal alang sa mga kadaut sa athens,0
gihigugma nako ang akong asawa,0
ug mao nga gibuhat kini sa mga anak nga lalake ni israel gihatagan sila ni jose ug mga sakyanan ingon sa sugo ni faraon,0
gitokahan bitaw namo kamog plawta,0
daghang mga isyu ang partikular nga panagbingkil sa mga sesyon sa komisyon,0
ug misunod kaniya ang usa ka dakung panon sa katawhan,0
gwapa siya sama sa usa ka rosas,0
ug nangutana siya sa sulogoon kinsa ba kining tawohana nga gikan sa kapatagan nga nagasugat kanato ug ang ulipon mitubag kini mao ang akong agalon unya gikuha niya ang iyang pandong ug nagtabon siya sa iyang kaugalingon,0
basig muulan karung gabii,0
lalake sila nga adunay pipila ra ka mga pulong,0
kanunay kang daotan ug tuyo,0
ug ang ngalan sa ikaduha gihinganlan niya si ephraim kay ang dios naghimo kanako nga mabungaon sulod sa yuta sa akong kaguol,0
dili ni mga balaod nako,0
alerdyik siya sa ayskrim,0
bisan kinsa nga tawohana sa balay sa israel nga magapatay ug vaca kun nating carnero,0
pahuman ang biyahe sa paris,0
ug miingon si raquel sa pagpakiglayog nga hilabihan nagpakiglayog ako sa akong igsoon nga babaye,0
ug si hamor ug si sichem nga iyang anak nga lalake gipatay nila sa sulab sa pinuti ug gikuha nila si dina sa balay ni sichem ug nanagpanggula sila,0
ug si jehova misulti kang moises ug kang aaron,0
ug kong kanding ang iyang halad,0
nag champurado si ramon sa kusina,0
sa walay duhaduha kamo mao ang katawohan,0
ug nangaabli usab ang mga lubong,0
gamay na ang oras nato,0
adunay kamatuorang gibuhat siya,0
ug si david nahiabut sa iyang balay didto sa jerusalem ug gikuha sa hari ang napulo ka babaye nga iyang puyopuyo nga iyang gibilin sa pagbantay sa balay,0
ug sa walay kokahadlok nagwali sa ngalan sa ginoo ug siya nakigsulti ug nakiglantugi batok sa mga judiyonggresyanhon apan sila naninguha sa pagpatay kaniya,1
kami ang mananaog sa dula,0
ug sa wala madugay,0
naay niutot dili to ako,0
dili nimo mahimong putulon ang mga bulak,0
ug tapus niini si jesus misuroy sa galilea ug siya dili buot mosuroy sa judea kay ang mga judio naninguha man sa pagpatay kaniya,1
ug gikan niini igahalad niya ang tanan nga tambok ang tambok nga ikog,0
sa pananaw nako nahadlok nimo si tom,0
ang imong gisulti walay pulos higala,0
nagkita mi sa simbahan,0
gipabuhat niya sa amoa ang tarbaho,0
gipaypayan ni tomas ang kaugalingon niya,0
ug gipasakay siya sa iyang ikaduha ka carro nga iyang kaugalingon,0
apan ang adlaw nga ikapito maoy usa ka adlaw nga igpapahulay alang kang jehova nga imong dios niining adlawa dili ka magbuhat,0
magmahingpit ikaw uban kang jehova nga imong dios,0
ug kini naila niya ug miingon mao ang sinina sa akong anak,0
apan kong ang sacerdote magahiling,0
ug si henoch nakadangat ug kanuman ug lima ka tuig,0
ubayubay pud ang barko sa linaw,0
wlaa ko kabalo kung asa siya nagpuyo,0
mas kuyaw siya nga swimmer kaysa sa akoa,0
patay ang usa ka drayber sa taxi sa pagpamaril kaniadtong miyerkules sa gabii sa syudad sa quezon,0
daghang dagkong kahoy didto,0
wala ko kabalo hain ang akoa,0
ang adunay igdulongog kinahanglan siya magpatalinghug niini,0
ug siya naghimo ug duruha ka ulo sa haligi nga tinunaw nga tumbaga,0
walay motuo nga maayo ka kay walay ebidensya,0
ug nakaipon kanamo didto ang usa ka batanon nga hebreohanon,0
ug sa diha nga ikapainum na kaniya ang tubig,0
pwede ka mopili og bisan unsa ato,0
ug ang tabil sa pultahan sa sawang maoy buhat sa magbobolda,0
itom ang tutunlan ug nawong,0
kini mao ang mga anak nga lalake ni dan sunod sa ilang mga panimalay sa kang suham,0
unya si jose midali kay ang iyang kasingkasing nangandoy tungod sa iyang igsoon,0
gisundan kini sa brazil nga adunay,0
unsay nahitabo sa imong iro,0
magtiwas ko sa akong trabaho aron mahuman dayon,0
nangape si zack sa kapeterya,0
giila sa palasyo sa malakanyang ang kabayanihan sa lima ka tauhan sa department of public works and highways dpwh nga namatay samtang nagpahigayon og clearing operations sa kasamtangan sa bagyo nga ulysses,1
wala gihapon ko nanihapon,0
karon kay mas tigulang ug mas kabalo na siya,0
nitanaw ko og balita sa telebisyon pagkahuman sa panihapon,0
siya ug ang uban nga mga gomburza gipatay didto sa bagumbayan sa,1
ganahan ko ug mga bao,0
nahurot na iyang paglaom,0
isulon ang imong kalo,0
usa ka katawohan nga dagku ug hatagas,0
ilado ang tenis sa mga magtutungha,0
wala nasabtan ni tom nganong iyaha kining himoon,0
ako pa saimoha didtoa ko mag baktas,0
pag inom og sarsaparilya,0
naghikay og ispagheti si amanda sa kusina,0
naminaw ba ka sa ako,0
kini makita usab sa madagascar,0
nakahanay ang balay nila sa punsoy,0
ayaw paggasto og sobra sa imong kita,0
mao kini ang giingon ni jehova niini makaila ikaw nga ako mao si jehova ania karon,0
ug kong usa ka tawo makasala sa walay pagpanghibalo,0
andam na ang kasilyas,0
ikaw lunsay matahum hinigugma ko ug walay buling diha kanimo,0
gusto nila ang ingles nga sinultian,0
wala na ko nakagusto sa imo,0
unya ang mga principe ug ang tibook katawohan mingsulti sa mga sacerdote ug sa mga manalagna kining tawohana dili angay sa kamatayon kay siya misulti kanato sa ngalan ni jehova nga atong dios,0
ug kini mao ang mga tuig sa kinabuhi ni ismael,0
daghang butiki didto sa parke,0
ug ang iyang mga igsoon nasina kaniya apan kini nga pulonga gitagoan sa hunahuna sa iyang amahan,0
ug didto nagpabilin hangtud sa pagkamatay ni herodes kini nahitabo tuman sa giingon sa ginoo pinaagi sa profeta,0
asa ka moadto karong gabii,0
bisitahan ko sa akong uyab matag adlaw,0
bayolet ang kilid sa dako nga murag itlog na salamin,0
si machnadbai si sasai si sarai,0
ug siya gipanalanginan niya,0
apan gikan sa usa ka sanga sa iyang mga gamut may usa nga motindog puli kaniya,0
ug miingon si israel kang jose ania karon,0
gisulti niya kini dili sa kinaugalingon niyang pagbulotan,0
naghikay og ispagheti si amanda sa kapistahan,0
wala baka ga langoy,0
kung nindot ugma magpiknik kita,0
kabalo siya nga dili siya modaog,0
yuta nga ginabantayan ni jehova nga imong dios ang mga mata ni jehova nga imong dios kanunay nga anaa sa ibabaw niya,0
ang pangulo nga si cora,0
ug si jehova miingon kang moises didto sa median lumakaw ka,0
gibanabana ni jm breiwick nga ang mapahimuslanon sa taas sa limitasyon sa ligal nga gidakon nga piye nga bahin sa populasyon sa nova scotia mga,0
gipalitan ko ang bata nga baye og usa ka suweter,0
ug si jehova nga atong dios nagtugyan kaniya sa atong atubangan ug siya gipatay ta ug ang iyang mga anak nga lalake ug ang tibook niya nga katawohan,0
daghang dulaan si silvestre sa balay niya,0
kay giserhan gayud ni jehova ang tanan nga taguangkan sa panimalay ni abimelech tungod kang sara nga asawa ni abraham,0
kolor abo ang langit karun sa dakbayan,0
di nako masabtan iyang gisulti,0
dili ko gusto suportahan si tom,0
dili nako makugaan kon madakpan si tom,0
ug si jehova misulti kang moises didto sa bukid sa sinai,0
imuha ba kining lapis,0
ug miingon siya kang kinsa ka ba nga anak,0
ug si faraon misulti kang jose nga nagaingon ang imong amahan ug ang imong mga igsoong lalake minganhi kanimo,0
nagaihaw ug karne si tomas,0
wala kay respeto sa mga tawo nga mas taas pa nimo,0
ug akong gihatag ang mga levihanon ingon sa hatag kang aaron ug sa iyang mga anak nga lalake gikan sa taliwala sa mga anak sa israel,0
kini mao ang kabalaoran ug mga tulomanon nga pagasingkamotan ninyo sa pagbuhat sa yuta nga gihatag kaninyo ni jehova,0
kinsa kinsa ang mangunguha,0
aduna koy akses sa iyang librarya,0
suko ka ba sa ako,0
ug miingon si adam kini mao karon ang bukog sa akong mga bukog,0
ang pagkalugi sa mga pukot nga ginagamit sa pagpangisda maoy hinungdan sa daghang kamatayon,0
sumala sa una nga imbestigasyon,0
magadt ko sa europa sunod semana,0
ang mga sapatos gahi kaayo samtang bago pa,0
unsa ang duhat sa ingles,0
ngano nga wala ka makasabut,0
gamay ra nga tanum ang tinuod nga gisunog o gipaso,0
gi gakos ko ni tom,0
mokaon og taho si nestor,0
buot ko unta nga ako usa ka langgam,0
ang tanang mga ciudad sa mga gersonhon,0
naay daku nga away ang relihiyon ug siyensya,0
pagkaton gikan sa sayop sa uban,0
ang inyong suliran kay dili lang mahitungod sa seks,0
nabati nako nga naay nagakamang sa akong likod,0
gusto ka nga magsine karong gabii,0
ug ang tibook nga arabah nga unahan sa jordan dapit sa timogan hangtud sa dagat sa arabah sa ilalum sa mga banghilig sa pisga,0
naa sa kusina si tom,0
unya mitindog ang usa ka bagong hari sa egipto,0
kini mao ang mahugaw alang kaninyo sa taliwala sa tanang mga mananap nga nagakamang sa yuta bisan kinsa nga makahikap niini kong kini mga patay,1
unya miingon si abisai ang anak nga lalake ni sarvia sa hari ngano nga magtunglo kining patay nga iro sa akong ginoong hari paadtoa ako,1
oy kumusta na man ka,0
gihigugma gihapon nako si mary,0
siya nga mogula sa atubangan nila,0
ug sa diha nga ang mga tawo sa israel nakakita nga si abimelech namatay na,1
ug gilabay ni saul ang iyang bangkaw aron sa pagbangkaw kaniya diha niana hibaloan ni jonathan nga gitinguha sa iyang amahan ang pagpatay kang david,1
aron ang yuta dili magasuka kaninyo usab,0
maingon sa nieve sa tinginit,0
katulgon kaayo ko para magdrayb,0
bisan ingon sa gisugo ni jehova kang moises,0
imbitado ko sa iyahang kasal,0
maayo ba ang gatas,0
wala gitarog ni tom ang iyang paniudto,0
ug sa ikapito ka adlaw ang sacerdote magahiling kaniya ug,0
iyang pagalatuson siya ug kapatan ka hampak,0
nagaroskaldo si mhel sa kusina,0
asawa ko ni tom,0
wala ko magbasa og nobela sa pranses,0
tawgan ta ka inig abot nako didto,0
di na siya maganahan ana,0
si pilato mitubag ang gikasulat ko na gikasulat ko na,0
kini maoy endimiko sa pilipinas,0
bata pa ako kaniadtong nahitabo ang martial law sa nasud,0
nagapakabana ko sa imuhang kaugmaon,0
moabot na di ba,0
ug si moises milakaw ug mipauli ngadto kang jetro nga iyang ugangan,0
sa pananaw ba nimo magustuhan niya akoang regalo,0
kinahanglan niya mag trabaho miski dominggo,0
ang mga balay sa panglawas,0
wa kay paki bisan gipasagdan na nimo ang tanan,0
kanang bataa mosiyagit dayon kon dili tagaan sa gusto,0
gikapoy na ang mga anak,0
misinggit ang madre ug pakitabang sa lagarat nga tingug,0
apan ang iyang kalag nahimuot kaayo kang dina anak nga babaye ni jacob,0
wa ka kasabot bisan sa pinakasimple nga mga direksyon,0
nganong busy ka karon,0
wala nadanyos ang among barko sa giyera,0
apan ang katawohan miingon dili ka magadto kay sa diha nga kami mangalagiw,0
lungtian og puti ang kolor sa kurtina,0
paubana ang imong igsoon nga babaye,0
gawas lamang kaha niadtong usa ka butang nga akong gisinggit samtang nagtindog ako sa ilang taliwala,0
nawala nako akong pasaporte,0
di ko gusto ko nga moadto diri,0
ingon ani man jud ko,0
wala kay mga plano nga molampos,0
ug kong siya makalolooy,0
ug alang sa halad sa mga haladsapakigdait,0
wala ko kabalo kung unsay pamaagi tika pasalamatan,0
nikaon si nestor og pandesa,0
daghan ang mihubad sa plato nga nagingonbisan ingon nga ang una nga isulatnga kahibalo mao ang gipakamatarung tinuod nga pagtuo,0
wa kay abilidad nga moatubang ug mga problema,0
kay ang hesbon mao ang lungsod ni sihon ang hari sa mga amorehanon,0
ug ang mga binatonan ni isaac nanagkalot didto sa walog,1
daghang magkalainlain nga mga espisye mga dolphin,0
gusto niya nga makita kita pagusab,0
maayo ba siyang mokanta,0
may kalipay ba ako sa kamatayon sa tawong dautan nagaingon ang ginoong jehova ug dili magapanghinaut hinoon nga siya mobalik gikan sa iyang dalan,0
ug gihinganlan ni abraham kadtong dapita nga jehovajereh nga maoy ngalan hangtud karon,0
gusto nako siyang pugngan sa panigarilyo,0
pinauyon sa hepe sa quezon city police district station nga si police lieutenant colonel benjamin gabriel,0
nakatarungan si jeremias nga patay na ang mg abiktima sa pagabot niya sa apartment complex aron magpalit og marijuana,1
nang hilak ang mga unggoy sa lasang,0
gipasagdan mo bang bukas ang dungawan,0
dili kabalo si tom magtali sa kurbata,0
daghang unlan si silvestre sa iyang lawak,0
pirme kang palpak bisan sa pinakasayon nga trabaho,0
aron mokalagiw didto ang makapatay ug tawo,0
tumindog ka ug umadto sa padanaram,0
tabangan ta ka na,0
disiplina nga eskolar ang paghubad,0
tungod niini si hananias nga manalagna namatay sa maong tuig sa ikapito ka bulan,1
pahibala ko nganong kinahanglan man nimo mahibalan,0
kusog ang tingog niya,0
unsa kini nga imong gibuhat kanako,0
gidili ang pagdikit papel sa dingding,0
kini susama sa acropora divaricata acropora variabilis ug acropora hoeksemai,0
patay ang usa ka maguuma sa barangay poponton ning lungsod human gipusil kaniadtong miyerkules sa gabii,0
ang tawag aning langgama kay kanaway,0
ang tagsatagsa ka manggialamon nga babaye magatukod sa iyang balay apan ang buangbuang magaguba niana uban sa iyang mga kamot,1
kaon sa bisan unsa nga imong gusto,0
ug ang mga mago sa egipto mibuhat sa mao nga paagi sa ilang mga lamat ug ang kasingkasing ni faraon migahi,0
paggawas sa duha sa simbahan nagtingog na ang kampana,0
dato kaayo ang akong uyoan,0
unsa kadugay ka nang buntis,0
ang mapa sa distribusyon sa draco mindanensis gikan sa breo,0
tibuok adlaw ko nga nanglimpyo sa kwarto,0
namalit ug talong si doria sa palengke,0
unsa ang imuhang suoton sa halloween,0
ang eksobiyolohiya kay estudyo sa kinabuhi sa espasyo,0
si crisanto ug juan carlos lozano napatay sa arboretum sa lungsod sa quezon kaniadtong mayo,1
unsa man ang imong gika busyhan karong semanaha,0
ang estados unidos sa gihapon ang adunay labing kadaghan nga mga namatay tungod sa covid nga adunay,1
ang nagkalainlain nga mga hayop sa kining duha ka mga grupo kay adunay kalainan sa pamaagi kung asa ang ulo kay gihatagan gihatag dugo gikan sa mga arterya,1
ug sa nakapamulong siya niini siya mipabilin sa galilea,0
wala miy baho nga paryente nagkapariha lang ang among apilyedo,1
pirme kang nagatang sa uban kay di ka kahibalo moatubang sa imong problema,0
nakaeskwela siya ug kolehiyo tungod sa scholarship,0
naglibog siya tungod sa klase sa kinahanglan nga covid test busa wala siya makaapas sa lubong sa iyang amahan sa zamboanga city,0
apan mas namugnaw sa niigata kaysa sa hokkaido,0
ang usa pa nga pananglitan mao ang domestic violence offender gun ban,0
igu ra ang pagkaon alang sa tanan,0
sa tingtugnaw nagaeski ang akong pamilya,0
o kong ang unod adunay paso sa kalayo sa iyang panit,0
ang maayong ngalan labi pang maayo kay sa bililhon nga lana ug ang adlaw sa pagkamatay kay sa adlaw nga natawohan,0
puwede kahang maghulatmaghuwat ko niya,0
wa ko nanginahanglan ug kwarta nimo,0
puti ang bulak sa rosas na kato,0
